"Number";"Commit";"Parent";"Refactoring";"EntityBefore";"EntityAfter";"FullDescription"
319;"553fa0b3b3022c525dd8c7d9f4328b961f89b320";"4fa216de878c7ebc1231e862c67dba3dfbea2e7a";"Move Class";"org.crsh.lang.ClassFactory";"org.crsh.util.ClassFactory";"Move Class org.crsh.lang.ClassFactory moved to org.crsh.util.ClassFactory"
319;"553fa0b3b3022c525dd8c7d9f4328b961f89b320";"4fa216de878c7ebc1231e862c67dba3dfbea2e7a";"Move Class";"org.crsh.lang.groovy.command.ArgumentNameTransformer";"org.crsh.lang.groovy.ast.ArgumentNameTransformer";"Move Class org.crsh.lang.groovy.command.ArgumentNameTransformer moved to org.crsh.lang.groovy.ast.ArgumentNameTransformer"
319;"553fa0b3b3022c525dd8c7d9f4328b961f89b320";"4fa216de878c7ebc1231e862c67dba3dfbea2e7a";"Move Class";"org.crsh.lang.groovy.command.CommandTransformer";"org.crsh.lang.groovy.ast.CommandTransformer";"Move Class org.crsh.lang.groovy.command.CommandTransformer moved to org.crsh.lang.groovy.ast.CommandTransformer"
319;"553fa0b3b3022c525dd8c7d9f4328b961f89b320";"4fa216de878c7ebc1231e862c67dba3dfbea2e7a";"Move Class";"org.crsh.lang.groovy.command.DefaultImportTransformer";"org.crsh.lang.groovy.ast.DefaultImportTransformer";"Move Class org.crsh.lang.groovy.command.DefaultImportTransformer moved to org.crsh.lang.groovy.ast.DefaultImportTransformer"
319;"553fa0b3b3022c525dd8c7d9f4328b961f89b320";"4fa216de878c7ebc1231e862c67dba3dfbea2e7a";"Move Class";"org.crsh.lang.groovy.repl.GroovyREPL";"org.crsh.lang.groovy.GroovyREPL";"Move Class org.crsh.lang.groovy.repl.GroovyREPL moved to org.crsh.lang.groovy.GroovyREPL"
319;"553fa0b3b3022c525dd8c7d9f4328b961f89b320";"4fa216de878c7ebc1231e862c67dba3dfbea2e7a";"Move Class";"org.crsh.lang.groovy.shell.ShellBinding";"org.crsh.lang.groovy.ShellBinding";"Move Class org.crsh.lang.groovy.shell.ShellBinding moved to org.crsh.lang.groovy.ShellBinding"
319;"553fa0b3b3022c525dd8c7d9f4328b961f89b320";"4fa216de878c7ebc1231e862c67dba3dfbea2e7a";"Move Class";"org.crsh.lang.AbstractClassCache";"org.crsh.util.AbstractClassCache";"Move Class org.crsh.lang.AbstractClassCache moved to org.crsh.util.AbstractClassCache"
319;"553fa0b3b3022c525dd8c7d9f4328b961f89b320";"4fa216de878c7ebc1231e862c67dba3dfbea2e7a";"Move Method";"org.crsh.lang.groovy.shell.GroovyCommandManager.destroy(HashMap)";"org.crsh.lang.groovy.GroovyCommandManager.destroy(HashMap)";"Move Method public destroy(session HashMap) : void from class org.crsh.lang.groovy.shell.GroovyCommandManager to public destroy(session HashMap) : void from class org.crsh.lang.groovy.GroovyCommandManager"
319;"553fa0b3b3022c525dd8c7d9f4328b961f89b320";"4fa216de878c7ebc1231e862c67dba3dfbea2e7a";"Move Method";"org.crsh.lang.groovy.shell.GroovyCommandManager.doCallBack(HashMap,String,String)";"org.crsh.lang.groovy.GroovyCommandManager.doCallBack(HashMap,String,String)";"Move Method public doCallBack(session HashMap, name String, defaultValue String) : String from class org.crsh.lang.groovy.shell.GroovyCommandManager to public doCallBack(session HashMap, name String, defaultValue String) : String from class org.crsh.lang.groovy.GroovyCommandManager"
319;"553fa0b3b3022c525dd8c7d9f4328b961f89b320";"4fa216de878c7ebc1231e862c67dba3dfbea2e7a";"Move Method";"org.crsh.lang.groovy.shell.GroovyCommandManager.eval(HashMap,String,String)";"org.crsh.lang.groovy.GroovyCommandManager.eval(HashMap,String,String)";"Move Method private eval(session HashMap, name String, def String) : String from class org.crsh.lang.groovy.shell.GroovyCommandManager to private eval(session HashMap, name String, def String) : String from class org.crsh.lang.groovy.GroovyCommandManager"
319;"553fa0b3b3022c525dd8c7d9f4328b961f89b320";"4fa216de878c7ebc1231e862c67dba3dfbea2e7a";"Move Method";"org.crsh.lang.groovy.shell.GroovyCommandManager.getGroovyShell(PluginContext,Map)";"org.crsh.lang.groovy.GroovyCommandManager.getGroovyShell(PluginContext,Map)";"Move Method public getGroovyShell(context PluginContext, session Map) : GroovyShell from class org.crsh.lang.groovy.shell.GroovyCommandManager to public getGroovyShell(context PluginContext, session Map) : GroovyShell from class org.crsh.lang.groovy.GroovyCommandManager"
319;"553fa0b3b3022c525dd8c7d9f4328b961f89b320";"4fa216de878c7ebc1231e862c67dba3dfbea2e7a";"Move Method";"org.crsh.lang.groovy.shell.GroovyCommandManager.init(HashMap)";"org.crsh.lang.groovy.GroovyCommandManager.init(HashMap)";"Move Method public init(session HashMap) : void from class org.crsh.lang.groovy.shell.GroovyCommandManager to public init(session HashMap) : void from class org.crsh.lang.groovy.GroovyCommandManager"
319;"553fa0b3b3022c525dd8c7d9f4328b961f89b320";"4fa216de878c7ebc1231e862c67dba3dfbea2e7a";"Move Method";"org.crsh.lang.groovy.shell.GroovyCommandManager.make(Class)";"org.crsh.lang.groovy.GroovyCommandManager.make(Class)";"Move Method private make(clazz Class) : BaseShellCommand from class org.crsh.lang.groovy.shell.GroovyCommandManager to private make(clazz Class) : BaseShellCommand from class org.crsh.lang.groovy.GroovyCommandManager"
319;"553fa0b3b3022c525dd8c7d9f4328b961f89b320";"4fa216de878c7ebc1231e862c67dba3dfbea2e7a";"Move Method";"org.crsh.lang.groovy.shell.GroovyCommandManager.make2(Class)";"org.crsh.lang.groovy.GroovyCommandManager.make2(Class)";"Move Method private make2(clazz Class) : GroovyScriptShellCommand from class org.crsh.lang.groovy.shell.GroovyCommandManager to private make2(clazz Class) : GroovyScriptShellCommand from class org.crsh.lang.groovy.GroovyCommandManager"
319;"553fa0b3b3022c525dd8c7d9f4328b961f89b320";"4fa216de878c7ebc1231e862c67dba3dfbea2e7a";"Move Method";"org.crsh.lang.groovy.shell.GroovyCommandManager.getLifeCycle(HashMap,String)";"org.crsh.lang.groovy.GroovyCommandManager.getLifeCycle(HashMap,String)";"Move Method public getLifeCycle(session HashMap, name String) : GroovyScript from class org.crsh.lang.groovy.shell.GroovyCommandManager to public getLifeCycle(session HashMap, name String) : GroovyScript from class org.crsh.lang.groovy.GroovyCommandManager"
319;"553fa0b3b3022c525dd8c7d9f4328b961f89b320";"4fa216de878c7ebc1231e862c67dba3dfbea2e7a";"Move Method";"org.crsh.lang.groovy.shell.GroovyCommandManager.resolveCommand(String)";"org.crsh.lang.groovy.GroovyCommandManager.resolveCommand(String,byte[])";"Move Method public resolveCommand(name String) : ShellCommand from class org.crsh.lang.groovy.shell.GroovyCommandManager to public resolveCommand(name String, source byte[]) : ShellCommand from class org.crsh.lang.groovy.GroovyCommandManager"
319;"553fa0b3b3022c525dd8c7d9f4328b961f89b320";"4fa216de878c7ebc1231e862c67dba3dfbea2e7a";"Move Method";"org.crsh.lang.groovy.shell.GroovyCommandManager.getGroovyShell(Map)";"org.crsh.lang.groovy.GroovyCommandManager.getGroovyShell(Map)";"Move Method public getGroovyShell(session Map) : GroovyShell from class org.crsh.lang.groovy.shell.GroovyCommandManager to public getGroovyShell(session Map) : GroovyShell from class org.crsh.lang.groovy.GroovyCommandManager"
319;"553fa0b3b3022c525dd8c7d9f4328b961f89b320";"4fa216de878c7ebc1231e862c67dba3dfbea2e7a";"Move Attribute";"org.crsh.lang.groovy.shell.GroovyCommandManager.log";"org.crsh.lang.groovy.GroovyCommandManager.log";"Move Attribute package log : Logger from class org.crsh.lang.groovy.shell.GroovyCommandManager to class org.crsh.lang.groovy.GroovyCommandManager"
319;"553fa0b3b3022c525dd8c7d9f4328b961f89b320";"4fa216de878c7ebc1231e862c67dba3dfbea2e7a";"Move Attribute";"org.crsh.lang.groovy.shell.GroovyCommandManager.scriptCache";"org.crsh.lang.groovy.GroovyCommandManager.scriptCache";"Move Attribute private scriptCache : AbstractClassCache from class org.crsh.lang.groovy.shell.GroovyCommandManager to class org.crsh.lang.groovy.GroovyCommandManager"
320;"4fa216de878c7ebc1231e862c67dba3dfbea2e7a";"e01188cb3b637d125190238ff8bc15e73f694535";"Rename Class";"org.crsh.command.NoSuchCommandException";"org.crsh.command.CommandCreationException";"Rename Class org.crsh.command.NoSuchCommandException renamed to org.crsh.command.CommandCreationException"
320;"4fa216de878c7ebc1231e862c67dba3dfbea2e7a";"e01188cb3b637d125190238ff8bc15e73f694535";"Move And Rename Class";"org.crsh.lang.groovy.shell.ClassManager";"org.crsh.lang.ClassCache";"Move And Rename Class org.crsh.lang.groovy.shell.ClassManager moved to org.crsh.lang.ClassCache"
320;"4fa216de878c7ebc1231e862c67dba3dfbea2e7a";"e01188cb3b637d125190238ff8bc15e73f694535";"Move Method";"org.crsh.command.BaseCommand.describe(String,DescriptionFormat)";"org.crsh.command.BaseShellCommand.describe(String,DescriptionFormat)";"Move Method public describe(line String, mode DescriptionFormat) : String from class org.crsh.command.BaseCommand to public describe(line String, mode DescriptionFormat) : String from class org.crsh.command.BaseShellCommand"
320;"4fa216de878c7ebc1231e862c67dba3dfbea2e7a";"e01188cb3b637d125190238ff8bc15e73f694535";"Move Method";"org.crsh.command.BaseCommand.getDescriptor()";"org.crsh.command.BaseShellCommand.getDescriptor()";"Move Method public getDescriptor() : CommandDescriptor from class org.crsh.command.BaseCommand to public getDescriptor() : CommandDescriptor from class org.crsh.command.BaseShellCommand"
320;"4fa216de878c7ebc1231e862c67dba3dfbea2e7a";"e01188cb3b637d125190238ff8bc15e73f694535";"Move Method";"org.crsh.command.BaseCommand.resolveInvoker(InvocationMatch)";"org.crsh.command.BaseShellCommand.resolveInvoker(InvocationMatch)";"Move Method public resolveInvoker(match InvocationMatch) : CommandInvoker from class org.crsh.command.BaseCommand to public resolveInvoker(match InvocationMatch) : CommandInvoker from class org.crsh.command.BaseShellCommand"
320;"4fa216de878c7ebc1231e862c67dba3dfbea2e7a";"e01188cb3b637d125190238ff8bc15e73f694535";"Move Method";"org.crsh.lang.groovy.command.GroovyScriptCommand.complete(RuntimeContext,String)";"org.crsh.lang.groovy.command.GroovyScriptShellCommand.complete(RuntimeContext,String)";"Move Method public complete(context RuntimeContext, line String) : CompletionMatch from class org.crsh.lang.groovy.command.GroovyScriptCommand to public complete(context RuntimeContext, line String) : CompletionMatch from class org.crsh.lang.groovy.command.GroovyScriptShellCommand"
320;"4fa216de878c7ebc1231e862c67dba3dfbea2e7a";"e01188cb3b637d125190238ff8bc15e73f694535";"Move Method";"org.crsh.lang.groovy.command.GroovyScriptCommand.describe(String,DescriptionFormat)";"org.crsh.lang.groovy.command.GroovyScriptShellCommand.describe(String,DescriptionFormat)";"Move Method public describe(line String, mode DescriptionFormat) : String from class org.crsh.lang.groovy.command.GroovyScriptCommand to public describe(line String, mode DescriptionFormat) : String from class org.crsh.lang.groovy.command.GroovyScriptShellCommand"
320;"4fa216de878c7ebc1231e862c67dba3dfbea2e7a";"e01188cb3b637d125190238ff8bc15e73f694535";"Move Method";"org.crsh.command.BaseCommand.getPipeCommandInvoker(org.crsh.cli.impl.invocation.CommandInvoker,B)";"org.crsh.command.BaseShellCommand.getPipeCommandInvoker(org.crsh.cli.impl.invocation.CommandInvoker,CC,Resolver)";"Move Method private getPipeCommandInvoker(invoker org.crsh.cli.impl.invocation.CommandInvoker, instance B) : CommandInvoker from class org.crsh.command.BaseCommand to private getPipeCommandInvoker(invoker org.crsh.cli.impl.invocation.CommandInvoker, instance CC, resolver Resolver) : CommandInvoker from class org.crsh.command.BaseShellCommand"
320;"4fa216de878c7ebc1231e862c67dba3dfbea2e7a";"e01188cb3b637d125190238ff8bc15e73f694535";"Move Method";"org.crsh.command.BaseCommand.getInvoker(org.crsh.cli.impl.invocation.CommandInvoker,B,Class)";"org.crsh.command.BaseShellCommand.getInvoker(org.crsh.cli.impl.invocation.CommandInvoker,CC,Class,Resolver)";"Move Method private getInvoker(invoker org.crsh.cli.impl.invocation.CommandInvoker, instance B, _producedType Class) : CommandInvoker from class org.crsh.command.BaseCommand to private getInvoker(invoker org.crsh.cli.impl.invocation.CommandInvoker, instance CC, _producedType Class, resolver Resolver) : CommandInvoker from class org.crsh.command.BaseShellCommand"
320;"4fa216de878c7ebc1231e862c67dba3dfbea2e7a";"e01188cb3b637d125190238ff8bc15e73f694535";"Move Method";"org.crsh.lang.groovy.command.GroovyScriptCommand.resolveInvoker(String,Map,List)";"org.crsh.lang.groovy.command.GroovyScriptShellCommand.resolveInvoker(String,Map,List)";"Move Method public resolveInvoker(name String, options Map, args List) : CommandInvoker from class org.crsh.lang.groovy.command.GroovyScriptCommand to public resolveInvoker(name String, options Map, args List) : CommandInvoker from class org.crsh.lang.groovy.command.GroovyScriptShellCommand"
320;"4fa216de878c7ebc1231e862c67dba3dfbea2e7a";"e01188cb3b637d125190238ff8bc15e73f694535";"Move Method";"org.crsh.command.BaseCommand.complete(RuntimeContext,String)";"org.crsh.command.BaseShellCommand.complete(RuntimeContext,String)";"Move Method public complete(context RuntimeContext, line String) : CompletionMatch from class org.crsh.command.BaseCommand to public complete(context RuntimeContext, line String) : CompletionMatch from class org.crsh.command.BaseShellCommand"
320;"4fa216de878c7ebc1231e862c67dba3dfbea2e7a";"e01188cb3b637d125190238ff8bc15e73f694535";"Move Method";"org.crsh.command.BaseCommand.resolveInvoker(String,Map,List)";"org.crsh.command.BaseShellCommand.resolveInvoker(String,Map,List)";"Move Method public resolveInvoker(name String, options Map, args List) : CommandInvoker from class org.crsh.command.BaseCommand to public resolveInvoker(name String, options Map, args List) : CommandInvoker from class org.crsh.command.BaseShellCommand"
320;"4fa216de878c7ebc1231e862c67dba3dfbea2e7a";"e01188cb3b637d125190238ff8bc15e73f694535";"Move Method";"org.crsh.command.BaseCommand.resolveInvoker(String)";"org.crsh.command.BaseShellCommand.resolveInvoker(String)";"Move Method public resolveInvoker(line String) : CommandInvoker from class org.crsh.command.BaseCommand to public resolveInvoker(line String) : CommandInvoker from class org.crsh.command.BaseShellCommand"
320;"4fa216de878c7ebc1231e862c67dba3dfbea2e7a";"e01188cb3b637d125190238ff8bc15e73f694535";"Move Method";"org.crsh.lang.groovy.command.GroovyScriptCommand.resolveInvoker(String)";"org.crsh.lang.groovy.command.GroovyScriptShellCommand.resolveInvoker(String)";"Move Method public resolveInvoker(line String) : CommandInvoker from class org.crsh.lang.groovy.command.GroovyScriptCommand to public resolveInvoker(line String) : CommandInvoker from class org.crsh.lang.groovy.command.GroovyScriptShellCommand"
320;"4fa216de878c7ebc1231e862c67dba3dfbea2e7a";"e01188cb3b637d125190238ff8bc15e73f694535";"Move Method";"org.crsh.command.BaseCommand.resolveInvoker2(InvocationMatch)";"org.crsh.command.BaseShellCommand.resolveInvoker2(InvocationMatch)";"Move Method private resolveInvoker2(match InvocationMatch) : CommandInvoker from class org.crsh.command.BaseCommand to private resolveInvoker2(match InvocationMatch) : CommandInvoker from class org.crsh.command.BaseShellCommand"
320;"4fa216de878c7ebc1231e862c67dba3dfbea2e7a";"e01188cb3b637d125190238ff8bc15e73f694535";"Move Method";"org.crsh.lang.groovy.shell.AbstractClassManager.getClass(String)";"org.crsh.lang.AbstractClassCache.getClass(String)";"Move Method package getClass(name String) : Class from class org.crsh.lang.groovy.shell.AbstractClassManager to public getClass(name String) : Class from class org.crsh.lang.AbstractClassCache"
320;"4fa216de878c7ebc1231e862c67dba3dfbea2e7a";"e01188cb3b637d125190238ff8bc15e73f694535";"Extract Method";"org.crsh.shell.InvocationContextTestCase.testContextAccessInScript()";"org.crsh.shell.TestInvocationContext.execute2(Class,String[])";"Extract Method public execute2(commandClass Class, args String[]) : String extracted from public testContextAccessInScript() : void in class org.crsh.shell.InvocationContextTestCase"
320;"4fa216de878c7ebc1231e862c67dba3dfbea2e7a";"e01188cb3b637d125190238ff8bc15e73f694535";"Extract Method";"org.crsh.shell.InvocationContextTestCase.testArgumentAccessInScript()";"org.crsh.shell.TestInvocationContext.execute2(Class,String[])";"Extract Method public execute2(commandClass Class, args String[]) : String extracted from public testArgumentAccessInScript() : void in class org.crsh.shell.InvocationContextTestCase"
320;"4fa216de878c7ebc1231e862c67dba3dfbea2e7a";"e01188cb3b637d125190238ff8bc15e73f694535";"Extract Method";"org.crsh.shell.InvocationContextTestCase.testArgumentAccessInClosure()";"org.crsh.shell.TestInvocationContext.execute2(Class,String[])";"Extract Method public execute2(commandClass Class, args String[]) : String extracted from public testArgumentAccessInClosure() : void in class org.crsh.shell.InvocationContextTestCase"
320;"4fa216de878c7ebc1231e862c67dba3dfbea2e7a";"e01188cb3b637d125190238ff8bc15e73f694535";"Extract Method";"org.crsh.shell.InvocationContextTestCase.testResolveContextInScript()";"org.crsh.shell.TestInvocationContext.execute2(Class,String[])";"Extract Method public execute2(commandClass Class, args String[]) : String extracted from public testResolveContextInScript() : void in class org.crsh.shell.InvocationContextTestCase"
320;"4fa216de878c7ebc1231e862c67dba3dfbea2e7a";"e01188cb3b637d125190238ff8bc15e73f694535";"Extract Method";"org.crsh.shell.InvocationContextTestCase.testScriptUseReturnValue()";"org.crsh.shell.TestInvocationContext.execute2(Class,String[])";"Extract Method public execute2(commandClass Class, args String[]) : String extracted from public testScriptUseReturnValue() : void in class org.crsh.shell.InvocationContextTestCase"
320;"4fa216de878c7ebc1231e862c67dba3dfbea2e7a";"e01188cb3b637d125190238ff8bc15e73f694535";"Extract Method";"org.crsh.shell.InvocationContextTestCase.testScriptDiscardReturnValue()";"org.crsh.shell.TestInvocationContext.execute2(Class,String[])";"Extract Method public execute2(commandClass Class, args String[]) : String extracted from public testScriptDiscardReturnValue() : void in class org.crsh.shell.InvocationContextTestCase"
320;"4fa216de878c7ebc1231e862c67dba3dfbea2e7a";"e01188cb3b637d125190238ff8bc15e73f694535";"Move Attribute";"org.crsh.lang.groovy.shell.AbstractClassManager.config";"org.crsh.lang.groovy.GroovyClassFactory.config";"Move Attribute private config : CompilerConfiguration from class org.crsh.lang.groovy.shell.AbstractClassManager to class org.crsh.lang.groovy.GroovyClassFactory"
320;"4fa216de878c7ebc1231e862c67dba3dfbea2e7a";"e01188cb3b637d125190238ff8bc15e73f694535";"Move Attribute";"org.crsh.command.BaseCommand.descriptor";"org.crsh.command.BaseShellCommand.descriptor";"Move Attribute private descriptor : CommandDescriptorImpl from class org.crsh.command.BaseCommand to class org.crsh.command.BaseShellCommand"
322;"e70e9e13fb264f696d32ec0a33f214d3c6201b82";"22ce9617cb25eb553f166fe59b1e22e0e632f51e";"Extract Method";"org.crsh.cli.impl.lang.MethodDescriptor.getInvoker(InvocationMatch)";"org.crsh.cli.impl.lang.MethodDescriptor.getInvoker2(InvocationMatch,Class)";"Extract Method private getInvoker2(_match InvocationMatch, returnType Class) : CommandInvoker extracted from public getInvoker(_match InvocationMatch) : CommandInvoker in class org.crsh.cli.impl.lang.MethodDescriptor"
322;"e70e9e13fb264f696d32ec0a33f214d3c6201b82";"22ce9617cb25eb553f166fe59b1e22e0e632f51e";"Extract Method";"org.crsh.command.BaseCommand.resolveInvoker(InvocationMatch)";"org.crsh.command.BaseCommand.resolveInvoker2(InvocationMatch)";"Extract Method private resolveInvoker2(match InvocationMatch) : CommandInvoker extracted from public resolveInvoker(match InvocationMatch) : CommandInvoker in class org.crsh.command.BaseCommand"
325;"f8b0bf8ee2e14eb22311e05f4055e77618d9bee0";"7d563cffa1d3a85c1a7a4144076dcc0d8d0b245d";"Extract Method";"org.crsh.processor.jline.JLineProcessor.loop()";"org.crsh.processor.jline.JLineProcessor.readLine()";"Extract Method private readLine() : String extracted from private loop() : void in class org.crsh.processor.jline.JLineProcessor"
333;"87422749579e91b278c5c4b274160c92264cc6c1";"038836825e7446b8b85dabda2ba5994083e3729c";"Extract Method";"org.crsh.lang.groovy.closure.PipeLineClosure.getProperty(String)";"org.crsh.lang.groovy.closure.PipeLineClosure._sub(String)";"Extract Method private _sub(name String) : PipeLineClosure extracted from public getProperty(property String) : Object in class org.crsh.lang.groovy.closure.PipeLineClosure"
333;"87422749579e91b278c5c4b274160c92264cc6c1";"038836825e7446b8b85dabda2ba5994083e3729c";"Extract Method";"org.crsh.lang.groovy.closure.PipeLineClosure.invokeMethod(String,Object)";"org.crsh.lang.groovy.closure.PipeLineClosure._sub(String)";"Extract Method private _sub(name String) : PipeLineClosure extracted from public invokeMethod(name String, args Object) : Object in class org.crsh.lang.groovy.closure.PipeLineClosure"
336;"4aa5800ad1a4a21ccd482bffb4fd8f6e42c27547";"613e38a56390722eab3731a66ebb12684fe0cc41";"Move Class";"org.crsh.lang.groovy.ShellBinding";"org.crsh.lang.groovy.shell.ShellBinding";"Move Class org.crsh.lang.groovy.ShellBinding moved to org.crsh.lang.groovy.shell.ShellBinding"
336;"4aa5800ad1a4a21ccd482bffb4fd8f6e42c27547";"613e38a56390722eab3731a66ebb12684fe0cc41";"Rename Class";"org.crsh.command.pipeline.Pipe";"org.crsh.command.pipeline.PipeLineElement";"Rename Class org.crsh.command.pipeline.Pipe renamed to org.crsh.command.pipeline.PipeLineElement"
336;"4aa5800ad1a4a21ccd482bffb4fd8f6e42c27547";"613e38a56390722eab3731a66ebb12684fe0cc41";"Rename Class";"org.crsh.lang.groovy.closure.InnerInvocationContext";"org.crsh.lang.groovy.closure.PipeLineInvocationContext";"Rename Class org.crsh.lang.groovy.closure.InnerInvocationContext renamed to org.crsh.lang.groovy.closure.PipeLineInvocationContext"
336;"4aa5800ad1a4a21ccd482bffb4fd8f6e42c27547";"613e38a56390722eab3731a66ebb12684fe0cc41";"Rename Method";"org.crsh.ssh.term.inline.SSHInlineShellProcessContext.provide(Chunk)";"org.crsh.ssh.term.inline.SSHInlineShellProcessContext.write(Chunk)";"Rename Method public provide(element Chunk) : void renamed to public write(element Chunk) : void in class org.crsh.ssh.term.inline.SSHInlineShellProcessContext"
336;"4aa5800ad1a4a21ccd482bffb4fd8f6e42c27547";"613e38a56390722eab3731a66ebb12684fe0cc41";"Move Method";"org.crsh.command.pipeline.PipeFilter.isPiped()";"org.crsh.command.pipeline.AbstractPipe.isPiped()";"Move Method public isPiped() : boolean from class org.crsh.command.pipeline.PipeFilter to public isPiped() : boolean from class org.crsh.command.pipeline.AbstractPipe"
336;"4aa5800ad1a4a21ccd482bffb4fd8f6e42c27547";"613e38a56390722eab3731a66ebb12684fe0cc41";"Move Method";"org.crsh.command.pipeline.PipeFilter.Chunkizer.getConsumedType()";"org.crsh.lang.groovy.closure.ClosureInvoker.getConsumedType()";"Move Method public getConsumedType() : Class from class org.crsh.command.pipeline.PipeFilter.Chunkizer to public getConsumedType() : Class from class org.crsh.lang.groovy.closure.ClosureInvoker"
336;"4aa5800ad1a4a21ccd482bffb4fd8f6e42c27547";"613e38a56390722eab3731a66ebb12684fe0cc41";"Move Method";"org.crsh.command.pipeline.PipeFilter.Chunkizer.getProducedType()";"org.crsh.command.pipeline.ToChunkPipe.getProducedType()";"Move Method public getProducedType() : Class from class org.crsh.command.pipeline.PipeFilter.Chunkizer to public getProducedType() : Class from class org.crsh.command.pipeline.ToChunkPipe"
336;"4aa5800ad1a4a21ccd482bffb4fd8f6e42c27547";"613e38a56390722eab3731a66ebb12684fe0cc41";"Move Method";"org.crsh.command.pipeline.PipeFilter.Sink.getConsumedType()";"org.crsh.lang.groovy.closure.ClosureInvoker.getConsumedType()";"Move Method public getConsumedType() : Class from class org.crsh.command.pipeline.PipeFilter.Sink to public getConsumedType() : Class from class org.crsh.lang.groovy.closure.ClosureInvoker"
336;"4aa5800ad1a4a21ccd482bffb4fd8f6e42c27547";"613e38a56390722eab3731a66ebb12684fe0cc41";"Move Method";"org.crsh.command.pipeline.PipeFilter.Sink.getProducedType()";"org.crsh.command.pipeline.ConvertingPipe.getProducedType()";"Move Method public getProducedType() : Class from class org.crsh.command.pipeline.PipeFilter.Sink to public getProducedType() : Class from class org.crsh.command.pipeline.ConvertingPipe"
336;"4aa5800ad1a4a21ccd482bffb4fd8f6e42c27547";"613e38a56390722eab3731a66ebb12684fe0cc41";"Move Method";"org.crsh.lang.groovy.closure.CommandClosure.unwrapArgs(Object)";"org.crsh.lang.groovy.closure.PipeLineClosure.unwrapArgs(Object)";"Move Method public unwrapArgs(arguments Object) : Object[] from class org.crsh.lang.groovy.closure.CommandClosure to private unwrapArgs(arguments Object) : Object[] from class org.crsh.lang.groovy.closure.PipeLineClosure"
336;"4aa5800ad1a4a21ccd482bffb4fd8f6e42c27547";"613e38a56390722eab3731a66ebb12684fe0cc41";"Move Method";"org.crsh.lang.groovy.command.GroovyScriptCommand.getConsumedType()";"org.crsh.lang.groovy.closure.ClosureInvoker.getConsumedType()";"Move Method public getConsumedType() : Class from class org.crsh.lang.groovy.command.GroovyScriptCommand to public getConsumedType() : Class from class org.crsh.lang.groovy.closure.ClosureInvoker"
336;"4aa5800ad1a4a21ccd482bffb4fd8f6e42c27547";"613e38a56390722eab3731a66ebb12684fe0cc41";"Move Method";"org.crsh.lang.groovy.command.GroovyScriptCommand.getProducedType()";"org.crsh.lang.groovy.closure.ClosureInvoker.getProducedType()";"Move Method public getProducedType() : Class from class org.crsh.lang.groovy.command.GroovyScriptCommand to public getProducedType() : Class from class org.crsh.lang.groovy.closure.ClosureInvoker"
336;"4aa5800ad1a4a21ccd482bffb4fd8f6e42c27547";"613e38a56390722eab3731a66ebb12684fe0cc41";"Move Method";"org.crsh.command.pipeline.PipeFilter.readLine(String,boolean)";"org.crsh.command.pipeline.AbstractPipe.readLine(String,boolean)";"Move Method public readLine(msg String, echo boolean) : String from class org.crsh.command.pipeline.PipeFilter to public readLine(msg String, echo boolean) : String from class org.crsh.command.pipeline.AbstractPipe"
