"Number";"Commit";"Parent";"Refactoring";"EntityBefore";"EntityAfter";"FullDescription"
2;"2801269c7e47bd6e243612654a74cee809d20959";"3224abedd01aaa85aae9ae3399efe92557f42e55";"Extract Method";"org.crsh.auth.FilePublicKeyProvider.loadKeys()";"org.crsh.auth.FilePublicKeyProvider.convertPemKeyPair(PEMKeyPair)";"Extract Method private convertPemKeyPair(pemKeyPair PEMKeyPair) : KeyPair extracted from public loadKeys() : Iterable in class org.crsh.auth.FilePublicKeyProvider"
10;"3c45c9663e01fdec5e075ecdfe7877f2d39aa57a";"56320c52fcfb87328d2e836c91cc0871385fac60";"Rename Method";"org.crsh.lang.impl.groovy.Helper.resolveCommandProperty(InvocationContext,String)";"org.crsh.lang.impl.groovy.Helper.resolveProperty(InvocationContext,String)";"Rename Method public resolveCommandProperty(context InvocationContext, property String) : PipeLineClosure renamed to public resolveProperty(context InvocationContext, property String) : PipeLineClosure in class org.crsh.lang.impl.groovy.Helper"
10;"3c45c9663e01fdec5e075ecdfe7877f2d39aa57a";"56320c52fcfb87328d2e836c91cc0871385fac60";"Rename Method";"org.crsh.lang.impl.groovy.Helper.resolveCommandInvocation(InvocationContext,String,Object)";"org.crsh.lang.impl.groovy.Helper.resolveMethodInvocation(InvocationContext,String,Object)";"Rename Method public resolveCommandInvocation(context InvocationContext, name String, args Object) : Runnable renamed to public resolveMethodInvocation(context InvocationContext, name String, args Object) : SafeCallable in class org.crsh.lang.impl.groovy.Helper"
10;"3c45c9663e01fdec5e075ecdfe7877f2d39aa57a";"56320c52fcfb87328d2e836c91cc0871385fac60";"Extract Method";"org.crsh.groovy.GroovyCommand.invokeMethod(String,Object)";"org.crsh.lang.impl.groovy.Helper.invokeMethod(RuntimeContext,String,Object,MissingMethodException)";"Extract Method public invokeMethod(context RuntimeContext, name String, args Object, ex MissingMethodException) : Object extracted from public invokeMethod(name String, args Object) : Object in class org.crsh.groovy.GroovyCommand"
10;"3c45c9663e01fdec5e075ecdfe7877f2d39aa57a";"56320c52fcfb87328d2e836c91cc0871385fac60";"Extract Method";"org.crsh.lang.impl.groovy.command.GroovyScriptCommand.invokeMethod(String,Object)";"org.crsh.lang.impl.groovy.Helper.invokeMethod(RuntimeContext,String,Object,MissingMethodException)";"Extract Method public invokeMethod(context RuntimeContext, name String, args Object, ex MissingMethodException) : Object extracted from public invokeMethod(name String, args Object) : Object in class org.crsh.lang.impl.groovy.command.GroovyScriptCommand"
13;"990be847fc886c403223cb62f7e28991b21d82e7";"6243fe0a760f0c55e04ada3ad36d8046b4521f47";"Extract Superclass";"org.crsh.shell.impl.command.InvocationContextImpl";"org.crsh.shell.impl.command.AbstractInvocationContext";"Extract Superclass org.crsh.shell.impl.command.AbstractInvocationContext from class org.crsh.shell.impl.command.InvocationContextImpl"
30;"26d5adf0a94562b5142e405b2e3eaa2415760c29";"403f421bfee5ab0ce3f48b3405fe01da6bce3099";"Move Class";"org.crsh.BaseProcess";"test.shell.base.BaseProcess";"Move Class org.crsh.BaseProcess moved to test.shell.base.BaseProcess"
30;"26d5adf0a94562b5142e405b2e3eaa2415760c29";"403f421bfee5ab0ce3f48b3405fe01da6bce3099";"Move Class";"org.crsh.BaseProcessContext";"test.shell.base.BaseProcessContext";"Move Class org.crsh.BaseProcessContext moved to test.shell.base.BaseProcessContext"
30;"26d5adf0a94562b5142e405b2e3eaa2415760c29";"403f421bfee5ab0ce3f48b3405fe01da6bce3099";"Move Class";"org.crsh.BaseProcessFactory";"test.shell.base.BaseProcessFactory";"Move Class org.crsh.BaseProcessFactory moved to test.shell.base.BaseProcessFactory"
30;"26d5adf0a94562b5142e405b2e3eaa2415760c29";"403f421bfee5ab0ce3f48b3405fe01da6bce3099";"Move Class";"org.crsh.BaseShell";"test.shell.base.BaseShell";"Move Class org.crsh.BaseShell moved to test.shell.base.BaseShell"
30;"26d5adf0a94562b5142e405b2e3eaa2415760c29";"403f421bfee5ab0ce3f48b3405fe01da6bce3099";"Move Class";"org.crsh.CommandQueue";"test.CommandQueue";"Move Class org.crsh.CommandQueue moved to test.CommandQueue"
30;"26d5adf0a94562b5142e405b2e3eaa2415760c29";"403f421bfee5ab0ce3f48b3405fe01da6bce3099";"Move Class";"org.crsh.JDBCCommandTestCase";"org.crsh.command.base.JDBCCommandTestCase";"Move Class org.crsh.JDBCCommandTestCase moved to org.crsh.command.base.JDBCCommandTestCase"
30;"26d5adf0a94562b5142e405b2e3eaa2415760c29";"403f421bfee5ab0ce3f48b3405fe01da6bce3099";"Move Class";"org.crsh.SystemCommandTestCase";"org.crsh.command.base.SystemCommandTestCase";"Move Class org.crsh.SystemCommandTestCase moved to org.crsh.command.base.SystemCommandTestCase"
30;"26d5adf0a94562b5142e405b2e3eaa2415760c29";"403f421bfee5ab0ce3f48b3405fe01da6bce3099";"Move Class";"org.crsh.TestPluginLifeCycle";"test.plugin.TestPluginLifeCycle";"Move Class org.crsh.TestPluginLifeCycle moved to test.plugin.TestPluginLifeCycle"
30;"26d5adf0a94562b5142e405b2e3eaa2415760c29";"403f421bfee5ab0ce3f48b3405fe01da6bce3099";"Move Class";"org.crsh.groovy.ArgumentNameTestCase";"org.crsh.lang.impl.groovy.ArgumentNameTestCase";"Move Class org.crsh.groovy.ArgumentNameTestCase moved to org.crsh.lang.impl.groovy.ArgumentNameTestCase"
30;"26d5adf0a94562b5142e405b2e3eaa2415760c29";"403f421bfee5ab0ce3f48b3405fe01da6bce3099";"Move Class";"org.crsh.processor.term.SyncCompleter";"test.shell.sync.SyncCompleter";"Move Class org.crsh.processor.term.SyncCompleter moved to test.shell.sync.SyncCompleter"
30;"26d5adf0a94562b5142e405b2e3eaa2415760c29";"403f421bfee5ab0ce3f48b3405fe01da6bce3099";"Move Class";"org.crsh.processor.term.SyncProcess";"test.shell.sync.SyncProcess";"Move Class org.crsh.processor.term.SyncProcess moved to test.shell.sync.SyncProcess"
30;"26d5adf0a94562b5142e405b2e3eaa2415760c29";"403f421bfee5ab0ce3f48b3405fe01da6bce3099";"Move Class";"org.crsh.processor.term.SyncShell";"test.shell.sync.SyncShell";"Move Class org.crsh.processor.term.SyncShell moved to test.shell.sync.SyncShell"
30;"26d5adf0a94562b5142e405b2e3eaa2415760c29";"403f421bfee5ab0ce3f48b3405fe01da6bce3099";"Move Class";"org.crsh.repl.ReplTestCase";"org.crsh.lang.ReplTestCase";"Move Class org.crsh.repl.ReplTestCase moved to org.crsh.lang.ReplTestCase"
30;"26d5adf0a94562b5142e405b2e3eaa2415760c29";"403f421bfee5ab0ce3f48b3405fe01da6bce3099";"Move Class";"org.crsh.shell.Commands";"test.command.Commands";"Move Class org.crsh.shell.Commands moved to test.command.Commands"
30;"26d5adf0a94562b5142e405b2e3eaa2415760c29";"403f421bfee5ab0ce3f48b3405fe01da6bce3099";"Move Class";"org.crsh.shell.CustomCommandResolverTestCase";"org.crsh.shell.impl.command.CustomCommandResolverTestCase";"Move Class org.crsh.shell.CustomCommandResolverTestCase moved to org.crsh.shell.impl.command.CustomCommandResolverTestCase"
30;"26d5adf0a94562b5142e405b2e3eaa2415760c29";"403f421bfee5ab0ce3f48b3405fe01da6bce3099";"Move Class";"org.crsh.shell.DispatchTestCase";"org.crsh.shell.impl.command.DispatchTestCase";"Move Class org.crsh.shell.DispatchTestCase moved to org.crsh.shell.impl.command.DispatchTestCase"
30;"26d5adf0a94562b5142e405b2e3eaa2415760c29";"403f421bfee5ab0ce3f48b3405fe01da6bce3099";"Move Class";"org.crsh.shell.EvalTestCase";"org.crsh.text.ui.EvalTestCase";"Move Class org.crsh.shell.EvalTestCase moved to org.crsh.text.ui.EvalTestCase"
30;"26d5adf0a94562b5142e405b2e3eaa2415760c29";"403f421bfee5ab0ce3f48b3405fe01da6bce3099";"Move Class";"org.crsh.shell.HelpTestCase";"org.crsh.command.HelpTestCase";"Move Class org.crsh.shell.HelpTestCase moved to org.crsh.command.HelpTestCase"
30;"26d5adf0a94562b5142e405b2e3eaa2415760c29";"403f421bfee5ab0ce3f48b3405fe01da6bce3099";"Move Class";"org.crsh.shell.ParameterTestCase";"org.crsh.lang.impl.groovy.ParameterTestCase";"Move Class org.crsh.shell.ParameterTestCase moved to org.crsh.lang.impl.groovy.ParameterTestCase"
30;"26d5adf0a94562b5142e405b2e3eaa2415760c29";"403f421bfee5ab0ce3f48b3405fe01da6bce3099";"Move Class";"org.crsh.shell.PipeLineFailureTestCase";"org.crsh.shell.impl.command.PipeLineFailureTestCase";"Move Class org.crsh.shell.PipeLineFailureTestCase moved to org.crsh.shell.impl.command.PipeLineFailureTestCase"
30;"26d5adf0a94562b5142e405b2e3eaa2415760c29";"403f421bfee5ab0ce3f48b3405fe01da6bce3099";"Move Class";"org.crsh.shell.Value";"test.text.Value";"Move Class org.crsh.shell.Value moved to test.text.Value"
30;"26d5adf0a94562b5142e405b2e3eaa2415760c29";"403f421bfee5ab0ce3f48b3405fe01da6bce3099";"Move Class";"org.crsh.shell.ValueRenderable";"test.text.ValueRenderable";"Move Class org.crsh.shell.ValueRenderable moved to test.text.ValueRenderable"
30;"26d5adf0a94562b5142e405b2e3eaa2415760c29";"403f421bfee5ab0ce3f48b3405fe01da6bce3099";"Move Class";"org.crsh.command.TestInvocationContext";"test.command.TestInvocationContext";"Move Class org.crsh.command.TestInvocationContext moved to test.command.TestInvocationContext"
30;"26d5adf0a94562b5142e405b2e3eaa2415760c29";"403f421bfee5ab0ce3f48b3405fe01da6bce3099";"Move Class";"org.crsh.shell.PipeTestCase";"org.crsh.shell.impl.command.PipeTestCase";"Move Class org.crsh.shell.PipeTestCase moved to org.crsh.shell.impl.command.PipeTestCase"
31;"403f421bfee5ab0ce3f48b3405fe01da6bce3099";"13d786b626c8ce8473a5e2c1fbf9a9b7c572b6f5";"Move Class";"org.crsh.shell.TestInvocationContext";"org.crsh.command.TestInvocationContext";"Move Class org.crsh.shell.TestInvocationContext moved to org.crsh.command.TestInvocationContext"
31;"403f421bfee5ab0ce3f48b3405fe01da6bce3099";"13d786b626c8ce8473a5e2c1fbf9a9b7c572b6f5";"Move Class";"org.crsh.shell.InvocationContextTestCase";"org.crsh.command.InvocationContextTestCase";"Move Class org.crsh.shell.InvocationContextTestCase moved to org.crsh.command.InvocationContextTestCase"
32;"13d786b626c8ce8473a5e2c1fbf9a9b7c572b6f5";"489a6cfa6cd103fba07bd1ac769a09fd1e1c3129";"Rename Class";"org.crsh.shell.AbstractCommandTestCase";"org.crsh.shell.AbstractShellTestCase";"Rename Class org.crsh.shell.AbstractCommandTestCase renamed to org.crsh.shell.AbstractShellTestCase"
33;"489a6cfa6cd103fba07bd1ac769a09fd1e1c3129";"c182d8fff0c13d3083b922054521311c5bc8f03b";"Move Class";"org.crsh.shell.EGrepTestCase";"org.crsh.command.base.EGrepTestCase";"Move Class org.crsh.shell.EGrepTestCase moved to org.crsh.command.base.EGrepTestCase"
33;"489a6cfa6cd103fba07bd1ac769a09fd1e1c3129";"c182d8fff0c13d3083b922054521311c5bc8f03b";"Move Class";"org.crsh.shell.JMXCommandTestCase";"org.crsh.command.base.JMXCommandTestCase";"Move Class org.crsh.shell.JMXCommandTestCase moved to org.crsh.command.base.JMXCommandTestCase"
33;"489a6cfa6cd103fba07bd1ac769a09fd1e1c3129";"c182d8fff0c13d3083b922054521311c5bc8f03b";"Move Class";"org.crsh.shell.entities.Bar";"org.crsh.command.base.entities.Bar";"Move Class org.crsh.shell.entities.Bar moved to org.crsh.command.base.entities.Bar"
33;"489a6cfa6cd103fba07bd1ac769a09fd1e1c3129";"c182d8fff0c13d3083b922054521311c5bc8f03b";"Move Class";"org.crsh.shell.entities.Foo";"org.crsh.command.base.entities.Foo";"Move Class org.crsh.shell.entities.Foo moved to org.crsh.command.base.entities.Foo"
33;"489a6cfa6cd103fba07bd1ac769a09fd1e1c3129";"c182d8fff0c13d3083b922054521311c5bc8f03b";"Move Class";"org.crsh.shell.entities.Foo2";"org.crsh.command.base.entities.Foo2";"Move Class org.crsh.shell.entities.Foo2 moved to org.crsh.command.base.entities.Foo2"
33;"489a6cfa6cd103fba07bd1ac769a09fd1e1c3129";"c182d8fff0c13d3083b922054521311c5bc8f03b";"Move Class";"org.crsh.shell.factory.Bindings";"org.crsh.command.base.factory.Bindings";"Move Class org.crsh.shell.factory.Bindings moved to org.crsh.command.base.factory.Bindings"
33;"489a6cfa6cd103fba07bd1ac769a09fd1e1c3129";"c182d8fff0c13d3083b922054521311c5bc8f03b";"Move Class";"org.crsh.shell.factory.EmptyContext";"org.crsh.command.base.factory.EmptyContext";"Move Class org.crsh.shell.factory.EmptyContext moved to org.crsh.command.base.factory.EmptyContext"
33;"489a6cfa6cd103fba07bd1ac769a09fd1e1c3129";"c182d8fff0c13d3083b922054521311c5bc8f03b";"Move Class";"org.crsh.shell.factory.ErrorContext";"org.crsh.command.base.factory.ErrorContext";"Move Class org.crsh.shell.factory.ErrorContext moved to org.crsh.command.base.factory.ErrorContext"
33;"489a6cfa6cd103fba07bd1ac769a09fd1e1c3129";"c182d8fff0c13d3083b922054521311c5bc8f03b";"Move Class";"org.crsh.shell.factory.ErrorInitialContextFactory";"org.crsh.command.base.factory.ErrorInitialContextFactory";"Move Class org.crsh.shell.factory.ErrorInitialContextFactory moved to org.crsh.command.base.factory.ErrorInitialContextFactory"
33;"489a6cfa6cd103fba07bd1ac769a09fd1e1c3129";"c182d8fff0c13d3083b922054521311c5bc8f03b";"Move Class";"org.crsh.shell.factory.JPAContext";"org.crsh.command.base.factory.JPAContext";"Move Class org.crsh.shell.factory.JPAContext moved to org.crsh.command.base.factory.JPAContext"
33;"489a6cfa6cd103fba07bd1ac769a09fd1e1c3129";"c182d8fff0c13d3083b922054521311c5bc8f03b";"Move Class";"org.crsh.shell.factory.JPAInitialContextFactory";"org.crsh.command.base.factory.JPAInitialContextFactory";"Move Class org.crsh.shell.factory.JPAInitialContextFactory moved to org.crsh.command.base.factory.JPAInitialContextFactory"
33;"489a6cfa6cd103fba07bd1ac769a09fd1e1c3129";"c182d8fff0c13d3083b922054521311c5bc8f03b";"Move Class";"org.crsh.shell.factory.NestedContext";"org.crsh.command.base.factory.NestedContext";"Move Class org.crsh.shell.factory.NestedContext moved to org.crsh.command.base.factory.NestedContext"
33;"489a6cfa6cd103fba07bd1ac769a09fd1e1c3129";"c182d8fff0c13d3083b922054521311c5bc8f03b";"Move Class";"org.crsh.shell.factory.NestedInitialContextFactory";"org.crsh.command.base.factory.NestedInitialContextFactory";"Move Class org.crsh.shell.factory.NestedInitialContextFactory moved to org.crsh.command.base.factory.NestedInitialContextFactory"
33;"489a6cfa6cd103fba07bd1ac769a09fd1e1c3129";"c182d8fff0c13d3083b922054521311c5bc8f03b";"Move Class";"org.crsh.shell.factory.SimpleContext";"org.crsh.command.base.factory.SimpleContext";"Move Class org.crsh.shell.factory.SimpleContext moved to org.crsh.command.base.factory.SimpleContext"
33;"489a6cfa6cd103fba07bd1ac769a09fd1e1c3129";"c182d8fff0c13d3083b922054521311c5bc8f03b";"Move Class";"org.crsh.shell.factory.SimpleInitialContextFactory";"org.crsh.command.base.factory.SimpleInitialContextFactory";"Move Class org.crsh.shell.factory.SimpleInitialContextFactory moved to org.crsh.command.base.factory.SimpleInitialContextFactory"
33;"489a6cfa6cd103fba07bd1ac769a09fd1e1c3129";"c182d8fff0c13d3083b922054521311c5bc8f03b";"Move Class";"org.crsh.shell.factory.TypedContext";"org.crsh.command.base.factory.TypedContext";"Move Class org.crsh.shell.factory.TypedContext moved to org.crsh.command.base.factory.TypedContext"
33;"489a6cfa6cd103fba07bd1ac769a09fd1e1c3129";"c182d8fff0c13d3083b922054521311c5bc8f03b";"Move Class";"org.crsh.shell.factory.TypedInitialContextFactory";"org.crsh.command.base.factory.TypedInitialContextFactory";"Move Class org.crsh.shell.factory.TypedInitialContextFactory moved to org.crsh.command.base.factory.TypedInitialContextFactory"
33;"489a6cfa6cd103fba07bd1ac769a09fd1e1c3129";"c182d8fff0c13d3083b922054521311c5bc8f03b";"Move Class";"org.crsh.shell.SortCommandTestCase";"org.crsh.command.base.SortCommandTestCase";"Move Class org.crsh.shell.SortCommandTestCase moved to org.crsh.command.base.SortCommandTestCase"
33;"489a6cfa6cd103fba07bd1ac769a09fd1e1c3129";"c182d8fff0c13d3083b922054521311c5bc8f03b";"Move Class";"org.crsh.shell.FilterCommandTestCase";"org.crsh.command.base.FilterCommandTestCase";"Move Class org.crsh.shell.FilterCommandTestCase moved to org.crsh.command.base.FilterCommandTestCase"
33;"489a6cfa6cd103fba07bd1ac769a09fd1e1c3129";"c182d8fff0c13d3083b922054521311c5bc8f03b";"Move Class";"org.crsh.shell.JPACommandTestCase";"org.crsh.command.base.JPACommandTestCase";"Move Class org.crsh.shell.JPACommandTestCase moved to org.crsh.command.base.JPACommandTestCase"
33;"489a6cfa6cd103fba07bd1ac769a09fd1e1c3129";"c182d8fff0c13d3083b922054521311c5bc8f03b";"Move Class";"org.crsh.shell.JNDICommandTestCase";"org.crsh.command.base.JNDICommandTestCase";"Move Class org.crsh.shell.JNDICommandTestCase moved to org.crsh.command.base.JNDICommandTestCase"
34;"c182d8fff0c13d3083b922054521311c5bc8f03b";"046f39f2729430d8559a9da8a72d97d9bda742ba";"Move And Rename Class";"org.crsh.shell.Commands.FailDuringOpen2";"org.crsh.shell.PipeLineFailureTestCase.Counter";"Move And Rename Class org.crsh.shell.Commands.FailDuringOpen2 moved to org.crsh.shell.PipeLineFailureTestCase.Counter"
38;"75c04073d302e9aa651c36d258b9ef9e09b14ad0";"aba5696027b825e22c2a6d5cdc532a190cb373ff";"Extract Method";"org.crsh.groovy.GroovyCommand.invokeMethod(String,Object)";"org.crsh.lang.impl.groovy.Helper.resolveCommandInvocation(InvocationContext,String,Object)";"Extract Method public resolveCommandInvocation(context InvocationContext, name String, args Object) : Runnable extracted from public invokeMethod(name String, args Object) : Object in class org.crsh.groovy.GroovyCommand"
38;"75c04073d302e9aa651c36d258b9ef9e09b14ad0";"aba5696027b825e22c2a6d5cdc532a190cb373ff";"Extract Method";"org.crsh.lang.impl.groovy.closure.ClosureDelegate.invokeMethod(String,Object)";"org.crsh.lang.impl.groovy.Helper.resolveCommandInvocation(InvocationContext,String,Object)";"Extract Method public resolveCommandInvocation(context InvocationContext, name String, args Object) : Runnable extracted from public invokeMethod(name String, args Object) : Object in class org.crsh.lang.impl.groovy.closure.ClosureDelegate"
38;"75c04073d302e9aa651c36d258b9ef9e09b14ad0";"aba5696027b825e22c2a6d5cdc532a190cb373ff";"Extract Method";"org.crsh.groovy.GroovyCommand.getProperty(String)";"org.crsh.lang.impl.groovy.Helper.resolveCommandProperty(InvocationContext,String)";"Extract Method public resolveCommandProperty(context InvocationContext, property String) : PipeLineClosure extracted from public getProperty(property String) : Object in class org.crsh.groovy.GroovyCommand"
43;"897a29769748fbb7eff9448e80a252472ad991c8";"5af130b488120555009fc7b5bbab22aa76fdb8de";"Rename Method";"org.crsh.plugin.PropertyManager.resolvePropertyValue(String,Class)";"org.crsh.plugin.PropertyManager.getPropertyValue(PropertyDescriptor)";"Rename Method private resolvePropertyValue(propertyName String, type Class) : T renamed to public getPropertyValue(desc PropertyDescriptor) : T in class org.crsh.plugin.PropertyManager"
46;"3bab461414d81ca50b6258aba67b5661e4a8c430";"a2aa8b1d98a97fb0d7c126f6c47aad2c706f734c";"Rename Class";"org.crsh.text.ScreenAppendable";"org.crsh.text.Screenable";"Rename Class org.crsh.text.ScreenAppendable renamed to org.crsh.text.Screenable"
71;"a4cc784d2de4a5dcfe56d32052e8fbdef3e37fe8";"e37f7f175f59d50259c217bf6bcad1302fee6a96";"Move Class";"org.crsh.io.Consumer";"org.crsh.stream.Consumer";"Move Class org.crsh.io.Consumer moved to org.crsh.stream.Consumer"
71;"a4cc784d2de4a5dcfe56d32052e8fbdef3e37fe8";"e37f7f175f59d50259c217bf6bcad1302fee6a96";"Move Class";"org.crsh.io.Filter";"org.crsh.stream.Filter";"Move Class org.crsh.io.Filter moved to org.crsh.stream.Filter"
71;"a4cc784d2de4a5dcfe56d32052e8fbdef3e37fe8";"e37f7f175f59d50259c217bf6bcad1302fee6a96";"Move Class";"org.crsh.io.Producer";"org.crsh.stream.Producer";"Move Class org.crsh.io.Producer moved to org.crsh.stream.Producer"
71;"a4cc784d2de4a5dcfe56d32052e8fbdef3e37fe8";"e37f7f175f59d50259c217bf6bcad1302fee6a96";"Move Class";"org.crsh.io.ProducerTestCase";"org.crsh.stream.ProducerTestCase";"Move Class org.crsh.io.ProducerTestCase moved to org.crsh.stream.ProducerTestCase"
79;"1298b733241d737bee795fec0527e2c6a6ad4fe0";"214fd7b78841516115a1633ab6baf6d2be450507";"Rename Class";"org.crsh.text.ChunkAdapter";"org.crsh.text.ScreenContextConsumer";"Rename Class org.crsh.text.ChunkAdapter renamed to org.crsh.text.ScreenContextConsumer"
79;"1298b733241d737bee795fec0527e2c6a6ad4fe0";"214fd7b78841516115a1633ab6baf6d2be450507";"Extract Interface";"org.crsh.text.RenderAppendable";"org.crsh.text.ScreenContext";"Extract Interface org.crsh.text.ScreenContext from class org.crsh.text.RenderAppendable"
79;"1298b733241d737bee795fec0527e2c6a6ad4fe0";"214fd7b78841516115a1633ab6baf6d2be450507";"Extract Interface";"org.crsh.text.RenderWriter";"org.crsh.text.ScreenContext";"Extract Interface org.crsh.text.ScreenContext from class org.crsh.text.RenderWriter"
79;"1298b733241d737bee795fec0527e2c6a6ad4fe0";"214fd7b78841516115a1633ab6baf6d2be450507";"Extract Interface";"org.crsh.shell.impl.command.InvocationContextImpl$1";"org.crsh.text.ScreenContext";"Extract Interface org.crsh.text.ScreenContext from class org.crsh.shell.impl.command.InvocationContextImpl$1"
79;"1298b733241d737bee795fec0527e2c6a6ad4fe0";"214fd7b78841516115a1633ab6baf6d2be450507";"Extract Interface";"org.crsh.text.ui.AbstractRendererTestCase$1";"org.crsh.text.ScreenContext";"Extract Interface org.crsh.text.ScreenContext from class org.crsh.text.ui.AbstractRendererTestCase$1"
79;"1298b733241d737bee795fec0527e2c6a6ad4fe0";"214fd7b78841516115a1633ab6baf6d2be450507";"Rename Method";"org.crsh.telnet.term.AbstractTerm.provide(Chunk)";"org.crsh.telnet.term.AbstractTerm.append(CharSequence)";"Rename Method public provide(element Chunk) : void renamed to public append(s CharSequence) : Appendable in class org.crsh.telnet.term.AbstractTerm"
79;"1298b733241d737bee795fec0527e2c6a6ad4fe0";"214fd7b78841516115a1633ab6baf6d2be450507";"Rename Method";"org.crsh.shell.impl.command.InvocationContextImpl.write(Chunk)";"org.crsh.shell.impl.command.InvocationContextImpl.cls()";"Rename Method public write(chunk Chunk) : void renamed to public cls() : ScreenAppendable in class org.crsh.shell.impl.command.InvocationContextImpl"
79;"1298b733241d737bee795fec0527e2c6a6ad4fe0";"214fd7b78841516115a1633ab6baf6d2be450507";"Rename Method";"org.crsh.web.servlet.WSProcessContext.write(Chunk)";"org.crsh.web.servlet.WSProcessContext.append(CharSequence,int,int)";"Rename Method public write(chunk Chunk) : void renamed to public append(csq CharSequence, start int, end int) : Appendable in class org.crsh.web.servlet.WSProcessContext"
79;"1298b733241d737bee795fec0527e2c6a6ad4fe0";"214fd7b78841516115a1633ab6baf6d2be450507";"Rename Method";"org.crsh.text.RenderAppendable.safeAppend(Chunk)";"org.crsh.text.RenderAppendable.cls()";"Rename Method private safeAppend(chunk Chunk) : void renamed to public cls() : ScreenAppendable in class org.crsh.text.RenderAppendable"
79;"1298b733241d737bee795fec0527e2c6a6ad4fe0";"214fd7b78841516115a1633ab6baf6d2be450507";"Rename Method";"org.crsh.shell.impl.command.CRaSHProcessContext.write(Chunk)";"org.crsh.shell.impl.command.CRaSHProcessContext.append(Style)";"Rename Method public write(chunk Chunk) : void renamed to public append(style Style) : ScreenAppendable in class org.crsh.shell.impl.command.CRaSHProcessContext"
79;"1298b733241d737bee795fec0527e2c6a6ad4fe0";"214fd7b78841516115a1633ab6baf6d2be450507";"Rename Method";"org.crsh.shell.impl.remoting.ClientProcessContext.provide(Chunk)";"org.crsh.shell.impl.remoting.ClientProcessContext.append(Style)";"Rename Method public provide(element Chunk) : void renamed to public append(style Style) : ScreenAppendable in class org.crsh.shell.impl.remoting.ClientProcessContext"
79;"1298b733241d737bee795fec0527e2c6a6ad4fe0";"214fd7b78841516115a1633ab6baf6d2be450507";"Rename Method";"org.crsh.ssh.term.inline.SSHInlineShellProcessContext.write(Chunk)";"org.crsh.ssh.term.inline.SSHInlineShellProcessContext.append(CharSequence,int,int)";"Rename Method public write(element Chunk) : void renamed to public append(csq CharSequence, start int, end int) : Appendable in class org.crsh.ssh.term.inline.SSHInlineShellProcessContext"
79;"1298b733241d737bee795fec0527e2c6a6ad4fe0";"214fd7b78841516115a1633ab6baf6d2be450507";"Rename Method";"org.crsh.telnet.term.processor.Processor.provide(Chunk)";"org.crsh.telnet.term.processor.Processor.getWidth()";"Rename Method public provide(element Chunk) : void renamed to public getWidth() : int in class org.crsh.telnet.term.processor.Processor"
79;"1298b733241d737bee795fec0527e2c6a6ad4fe0";"214fd7b78841516115a1633ab6baf6d2be450507";"Rename Method";"org.crsh.text.RenderWriter.provide(Chunk)";"org.crsh.text.RenderWriter.append(CharSequence)";"Rename Method public provide(element Chunk) : void renamed to public append(s CharSequence) : RenderWriter in class org.crsh.text.RenderWriter"
79;"1298b733241d737bee795fec0527e2c6a6ad4fe0";"214fd7b78841516115a1633ab6baf6d2be450507";"Move Method";"org.crsh.shell.impl.command.pipeline.AbstractPipe.getAttributes()";"org.crsh.shell.impl.command.pipeline.CommandInvokerAdapter.getAttributes()";"Move Method public getAttributes() : Map from class org.crsh.shell.impl.command.pipeline.AbstractPipe to public getAttributes() : Map from class org.crsh.shell.impl.command.pipeline.CommandInvokerAdapter"
79;"1298b733241d737bee795fec0527e2c6a6ad4fe0";"214fd7b78841516115a1633ab6baf6d2be450507";"Move Method";"org.crsh.shell.impl.command.pipeline.AbstractPipe.getProperty(String)";"org.crsh.shell.impl.command.pipeline.CommandInvokerAdapter.getProperty(String)";"Move Method public getProperty(propertyName String) : String from class org.crsh.shell.impl.command.pipeline.AbstractPipe to public getProperty(propertyName String) : String from class org.crsh.shell.impl.command.pipeline.CommandInvokerAdapter"
79;"1298b733241d737bee795fec0527e2c6a6ad4fe0";"214fd7b78841516115a1633ab6baf6d2be450507";"Move Method";"org.crsh.shell.impl.command.pipeline.AbstractPipe.getSession()";"org.crsh.shell.impl.command.pipeline.CommandInvokerAdapter.getSession()";"Move Method public getSession() : Map from class org.crsh.shell.impl.command.pipeline.AbstractPipe to public getSession() : Map from class org.crsh.shell.impl.command.pipeline.CommandInvokerAdapter"
