"Number";"Commit";"Parent";"Refactoring";"EntityBefore";"EntityAfter";"FullDescription"
702;"20acb5bc60402dcbed785d04966afa10b21b86e5";"81cc2cec8e52b8fd814d5ddd0e4a277f6b08441b";"Extract Method";"redis.clients.jedis.Protocol.getSingleLineReply(InputStream)";"redis.clients.jedis.Protocol.processBulkReply(InputStream)";"Extract Method private processBulkReply(is InputStream) : Object extracted from public getSingleLineReply(is InputStream) : String in class redis.clients.jedis.Protocol"
702;"20acb5bc60402dcbed785d04966afa10b21b86e5";"81cc2cec8e52b8fd814d5ddd0e4a277f6b08441b";"Extract Method";"redis.clients.jedis.Protocol.getSingleLineReply(InputStream)";"redis.clients.jedis.Protocol.processInteger(InputStream)";"Extract Method private processInteger(is InputStream) : Object extracted from public getSingleLineReply(is InputStream) : String in class redis.clients.jedis.Protocol"
702;"20acb5bc60402dcbed785d04966afa10b21b86e5";"81cc2cec8e52b8fd814d5ddd0e4a277f6b08441b";"Extract Method";"redis.clients.jedis.Protocol.getSingleLineReply(InputStream)";"redis.clients.jedis.Protocol.processMultiBulkReply(InputStream)";"Extract Method private processMultiBulkReply(is InputStream) : Object extracted from public getSingleLineReply(is InputStream) : String in class redis.clients.jedis.Protocol"
702;"20acb5bc60402dcbed785d04966afa10b21b86e5";"81cc2cec8e52b8fd814d5ddd0e4a277f6b08441b";"Extract Method";"redis.clients.jedis.Protocol.getSingleLineReply(InputStream)";"redis.clients.jedis.Protocol.processStatusCodeReply(InputStream)";"Extract Method private processStatusCodeReply(is InputStream) : Object extracted from public getSingleLineReply(is InputStream) : String in class redis.clients.jedis.Protocol"
703;"81cc2cec8e52b8fd814d5ddd0e4a277f6b08441b";"cc26791c69b7a2a480384506127a3f65de276eea";"Rename Class";"redis.clients.jedis.tests.ClientTest";"redis.clients.jedis.tests.ConnectionTest";"Rename Class redis.clients.jedis.tests.ClientTest renamed to redis.clients.jedis.tests.ConnectionTest"
703;"81cc2cec8e52b8fd814d5ddd0e4a277f6b08441b";"cc26791c69b7a2a480384506127a3f65de276eea";"Extract Superclass";"redis.clients.jedis.Client";"redis.clients.jedis.Connection";"Extract Superclass redis.clients.jedis.Connection from class redis.clients.jedis.Client"
703;"81cc2cec8e52b8fd814d5ddd0e4a277f6b08441b";"cc26791c69b7a2a480384506127a3f65de276eea";"Extract Method";"redis.clients.jedis.Jedis.append(String,String)";"redis.clients.jedis.Client.append(String,String)";"Extract Method public append(key String, value String) : void extracted from public append(key String, value String) : int in class redis.clients.jedis.Jedis"
703;"81cc2cec8e52b8fd814d5ddd0e4a277f6b08441b";"cc26791c69b7a2a480384506127a3f65de276eea";"Extract Method";"redis.clients.jedis.Jedis.dbSize()";"redis.clients.jedis.Client.dbSize()";"Extract Method public dbSize() : void extracted from public dbSize() : int in class redis.clients.jedis.Jedis"
703;"81cc2cec8e52b8fd814d5ddd0e4a277f6b08441b";"cc26791c69b7a2a480384506127a3f65de276eea";"Extract Method";"redis.clients.jedis.Jedis.decr(String)";"redis.clients.jedis.Client.decr(String)";"Extract Method public decr(key String) : void extracted from public decr(key String) : int in class redis.clients.jedis.Jedis"
703;"81cc2cec8e52b8fd814d5ddd0e4a277f6b08441b";"cc26791c69b7a2a480384506127a3f65de276eea";"Extract Method";"redis.clients.jedis.Jedis.decrBy(String,int)";"redis.clients.jedis.Client.decrBy(String,int)";"Extract Method public decrBy(key String, integer int) : void extracted from public decrBy(key String, integer int) : int in class redis.clients.jedis.Jedis"
703;"81cc2cec8e52b8fd814d5ddd0e4a277f6b08441b";"cc26791c69b7a2a480384506127a3f65de276eea";"Extract Method";"redis.clients.jedis.Jedis.del(String[])";"redis.clients.jedis.Client.del(String[])";"Extract Method public del(keys String[]) : void extracted from public del(keys String[]) : int in class redis.clients.jedis.Jedis"
703;"81cc2cec8e52b8fd814d5ddd0e4a277f6b08441b";"cc26791c69b7a2a480384506127a3f65de276eea";"Extract Method";"redis.clients.jedis.Jedis.exists(String)";"redis.clients.jedis.Client.exists(String)";"Extract Method public exists(key String) : void extracted from public exists(key String) : int in class redis.clients.jedis.Jedis"
703;"81cc2cec8e52b8fd814d5ddd0e4a277f6b08441b";"cc26791c69b7a2a480384506127a3f65de276eea";"Extract Method";"redis.clients.jedis.Jedis.expire(String,int)";"redis.clients.jedis.Client.expire(String,int)";"Extract Method public expire(key String, seconds int) : void extracted from public expire(key String, seconds int) : int in class redis.clients.jedis.Jedis"
703;"81cc2cec8e52b8fd814d5ddd0e4a277f6b08441b";"cc26791c69b7a2a480384506127a3f65de276eea";"Extract Method";"redis.clients.jedis.Jedis.expireAt(String,long)";"redis.clients.jedis.Client.expireAt(String,long)";"Extract Method public expireAt(key String, unixTime long) : void extracted from public expireAt(key String, unixTime long) : int in class redis.clients.jedis.Jedis"
703;"81cc2cec8e52b8fd814d5ddd0e4a277f6b08441b";"cc26791c69b7a2a480384506127a3f65de276eea";"Extract Method";"redis.clients.jedis.Jedis.flushAll()";"redis.clients.jedis.Client.flushAll()";"Extract Method public flushAll() : void extracted from public flushAll() : String in class redis.clients.jedis.Jedis"
703;"81cc2cec8e52b8fd814d5ddd0e4a277f6b08441b";"cc26791c69b7a2a480384506127a3f65de276eea";"Extract Method";"redis.clients.jedis.Jedis.flushDB()";"redis.clients.jedis.Client.flushDB()";"Extract Method public flushDB() : void extracted from public flushDB() : String in class redis.clients.jedis.Jedis"
703;"81cc2cec8e52b8fd814d5ddd0e4a277f6b08441b";"cc26791c69b7a2a480384506127a3f65de276eea";"Extract Method";"redis.clients.jedis.Jedis.getSet(String,String)";"redis.clients.jedis.Client.getSet(String,String)";"Extract Method public getSet(key String, value String) : void extracted from public getSet(key String, value String) : String in class redis.clients.jedis.Jedis"
703;"81cc2cec8e52b8fd814d5ddd0e4a277f6b08441b";"cc26791c69b7a2a480384506127a3f65de276eea";"Extract Method";"redis.clients.jedis.Jedis.hdel(String,String)";"redis.clients.jedis.Client.hdel(String,String)";"Extract Method public hdel(key String, field String) : void extracted from public hdel(key String, field String) : int in class redis.clients.jedis.Jedis"
703;"81cc2cec8e52b8fd814d5ddd0e4a277f6b08441b";"cc26791c69b7a2a480384506127a3f65de276eea";"Extract Method";"redis.clients.jedis.Jedis.hexists(String,String)";"redis.clients.jedis.Client.hexists(String,String)";"Extract Method public hexists(key String, field String) : void extracted from public hexists(key String, field String) : int in class redis.clients.jedis.Jedis"
703;"81cc2cec8e52b8fd814d5ddd0e4a277f6b08441b";"cc26791c69b7a2a480384506127a3f65de276eea";"Extract Method";"redis.clients.jedis.Jedis.hget(String,String)";"redis.clients.jedis.Client.hget(String,String)";"Extract Method public hget(key String, field String) : void extracted from public hget(key String, field String) : String in class redis.clients.jedis.Jedis"
703;"81cc2cec8e52b8fd814d5ddd0e4a277f6b08441b";"cc26791c69b7a2a480384506127a3f65de276eea";"Extract Method";"redis.clients.jedis.Jedis.hgetAll(String)";"redis.clients.jedis.Client.hgetAll(String)";"Extract Method public hgetAll(key String) : void extracted from public hgetAll(key String) : Map in class redis.clients.jedis.Jedis"
703;"81cc2cec8e52b8fd814d5ddd0e4a277f6b08441b";"cc26791c69b7a2a480384506127a3f65de276eea";"Extract Method";"redis.clients.jedis.Jedis.hincrBy(String,String,int)";"redis.clients.jedis.Client.hincrBy(String,String,int)";"Extract Method public hincrBy(key String, field String, value int) : void extracted from public hincrBy(key String, field String, value int) : int in class redis.clients.jedis.Jedis"
703;"81cc2cec8e52b8fd814d5ddd0e4a277f6b08441b";"cc26791c69b7a2a480384506127a3f65de276eea";"Extract Method";"redis.clients.jedis.Jedis.hkeys(String)";"redis.clients.jedis.Client.hkeys(String)";"Extract Method public hkeys(key String) : void extracted from public hkeys(key String) : List in class redis.clients.jedis.Jedis"
703;"81cc2cec8e52b8fd814d5ddd0e4a277f6b08441b";"cc26791c69b7a2a480384506127a3f65de276eea";"Extract Method";"redis.clients.jedis.Jedis.hlen(String)";"redis.clients.jedis.Client.hlen(String)";"Extract Method public hlen(key String) : void extracted from public hlen(key String) : int in class redis.clients.jedis.Jedis"
703;"81cc2cec8e52b8fd814d5ddd0e4a277f6b08441b";"cc26791c69b7a2a480384506127a3f65de276eea";"Extract Method";"redis.clients.jedis.Jedis.hmget(String,String[])";"redis.clients.jedis.Client.hmget(String,String[])";"Extract Method public hmget(key String, fields String[]) : void extracted from public hmget(key String, fields String[]) : List in class redis.clients.jedis.Jedis"
703;"81cc2cec8e52b8fd814d5ddd0e4a277f6b08441b";"cc26791c69b7a2a480384506127a3f65de276eea";"Extract Method";"redis.clients.jedis.Jedis.hmset(String,Map)";"redis.clients.jedis.Client.hmset(String,Map)";"Extract Method public hmset(key String, hash Map) : void extracted from public hmset(key String, hash Map) : String in class redis.clients.jedis.Jedis"
703;"81cc2cec8e52b8fd814d5ddd0e4a277f6b08441b";"cc26791c69b7a2a480384506127a3f65de276eea";"Extract Method";"redis.clients.jedis.Jedis.hset(String,String,String)";"redis.clients.jedis.Client.hset(String,String,String)";"Extract Method public hset(key String, field String, value String) : void extracted from public hset(key String, field String, value String) : int in class redis.clients.jedis.Jedis"
703;"81cc2cec8e52b8fd814d5ddd0e4a277f6b08441b";"cc26791c69b7a2a480384506127a3f65de276eea";"Extract Method";"redis.clients.jedis.Jedis.hsetnx(String,String,String)";"redis.clients.jedis.Client.hsetnx(String,String,String)";"Extract Method public hsetnx(key String, field String, value String) : void extracted from public hsetnx(key String, field String, value String) : int in class redis.clients.jedis.Jedis"
703;"81cc2cec8e52b8fd814d5ddd0e4a277f6b08441b";"cc26791c69b7a2a480384506127a3f65de276eea";"Extract Method";"redis.clients.jedis.Jedis.hvals(String)";"redis.clients.jedis.Client.hvals(String)";"Extract Method public hvals(key String) : void extracted from public hvals(key String) : List in class redis.clients.jedis.Jedis"
703;"81cc2cec8e52b8fd814d5ddd0e4a277f6b08441b";"cc26791c69b7a2a480384506127a3f65de276eea";"Extract Method";"redis.clients.jedis.Jedis.incr(String)";"redis.clients.jedis.Client.incr(String)";"Extract Method public incr(key String) : void extracted from public incr(key String) : int in class redis.clients.jedis.Jedis"
703;"81cc2cec8e52b8fd814d5ddd0e4a277f6b08441b";"cc26791c69b7a2a480384506127a3f65de276eea";"Extract Method";"redis.clients.jedis.Jedis.incrBy(String,int)";"redis.clients.jedis.Client.incrBy(String,int)";"Extract Method public incrBy(key String, integer int) : void extracted from public incrBy(key String, integer int) : int in class redis.clients.jedis.Jedis"
703;"81cc2cec8e52b8fd814d5ddd0e4a277f6b08441b";"cc26791c69b7a2a480384506127a3f65de276eea";"Extract Method";"redis.clients.jedis.Jedis.keys(String)";"redis.clients.jedis.Client.keys(String)";"Extract Method public keys(pattern String) : void extracted from public keys(pattern String) : List in class redis.clients.jedis.Jedis"
703;"81cc2cec8e52b8fd814d5ddd0e4a277f6b08441b";"cc26791c69b7a2a480384506127a3f65de276eea";"Extract Method";"redis.clients.jedis.Jedis.lindex(String,int)";"redis.clients.jedis.Client.lindex(String,int)";"Extract Method public lindex(key String, index int) : void extracted from public lindex(key String, index int) : String in class redis.clients.jedis.Jedis"
703;"81cc2cec8e52b8fd814d5ddd0e4a277f6b08441b";"cc26791c69b7a2a480384506127a3f65de276eea";"Extract Method";"redis.clients.jedis.Jedis.llen(String)";"redis.clients.jedis.Client.llen(String)";"Extract Method public llen(key String) : void extracted from public llen(key String) : int in class redis.clients.jedis.Jedis"
703;"81cc2cec8e52b8fd814d5ddd0e4a277f6b08441b";"cc26791c69b7a2a480384506127a3f65de276eea";"Extract Method";"redis.clients.jedis.Jedis.lpop(String)";"redis.clients.jedis.Client.lpop(String)";"Extract Method public lpop(key String) : void extracted from public lpop(key String) : String in class redis.clients.jedis.Jedis"
703;"81cc2cec8e52b8fd814d5ddd0e4a277f6b08441b";"cc26791c69b7a2a480384506127a3f65de276eea";"Extract Method";"redis.clients.jedis.Jedis.lpush(String,String)";"redis.clients.jedis.Client.lpush(String,String)";"Extract Method public lpush(key String, string String) : void extracted from public lpush(key String, string String) : int in class redis.clients.jedis.Jedis"
703;"81cc2cec8e52b8fd814d5ddd0e4a277f6b08441b";"cc26791c69b7a2a480384506127a3f65de276eea";"Extract Method";"redis.clients.jedis.Jedis.lrange(String,int,int)";"redis.clients.jedis.Client.lrange(String,int,int)";"Extract Method public lrange(key String, start int, end int) : void extracted from public lrange(key String, start int, end int) : List in class redis.clients.jedis.Jedis"
703;"81cc2cec8e52b8fd814d5ddd0e4a277f6b08441b";"cc26791c69b7a2a480384506127a3f65de276eea";"Extract Method";"redis.clients.jedis.Jedis.lrem(String,int,String)";"redis.clients.jedis.Client.lrem(String,int,String)";"Extract Method public lrem(key String, count int, value String) : void extracted from public lrem(key String, count int, value String) : int in class redis.clients.jedis.Jedis"
703;"81cc2cec8e52b8fd814d5ddd0e4a277f6b08441b";"cc26791c69b7a2a480384506127a3f65de276eea";"Extract Method";"redis.clients.jedis.Jedis.lset(String,int,String)";"redis.clients.jedis.Client.lset(String,int,String)";"Extract Method public lset(key String, index int, value String) : void extracted from public lset(key String, index int, value String) : String in class redis.clients.jedis.Jedis"
703;"81cc2cec8e52b8fd814d5ddd0e4a277f6b08441b";"cc26791c69b7a2a480384506127a3f65de276eea";"Extract Method";"redis.clients.jedis.Jedis.ltrim(String,int,int)";"redis.clients.jedis.Client.ltrim(String,int,int)";"Extract Method public ltrim(key String, start int, end int) : void extracted from public ltrim(key String, start int, end int) : String in class redis.clients.jedis.Jedis"
703;"81cc2cec8e52b8fd814d5ddd0e4a277f6b08441b";"cc26791c69b7a2a480384506127a3f65de276eea";"Extract Method";"redis.clients.jedis.Jedis.mget(String[])";"redis.clients.jedis.Client.mget(String[])";"Extract Method public mget(keys String[]) : void extracted from public mget(keys String[]) : List in class redis.clients.jedis.Jedis"
703;"81cc2cec8e52b8fd814d5ddd0e4a277f6b08441b";"cc26791c69b7a2a480384506127a3f65de276eea";"Extract Method";"redis.clients.jedis.Jedis.move(String,int)";"redis.clients.jedis.Client.move(String,int)";"Extract Method public move(key String, dbIndex int) : void extracted from public move(key String, dbIndex int) : int in class redis.clients.jedis.Jedis"
703;"81cc2cec8e52b8fd814d5ddd0e4a277f6b08441b";"cc26791c69b7a2a480384506127a3f65de276eea";"Extract Method";"redis.clients.jedis.Jedis.mset(String[])";"redis.clients.jedis.Client.mset(String[])";"Extract Method public mset(keysvalues String[]) : void extracted from public mset(keysvalues String[]) : String in class redis.clients.jedis.Jedis"
703;"81cc2cec8e52b8fd814d5ddd0e4a277f6b08441b";"cc26791c69b7a2a480384506127a3f65de276eea";"Extract Method";"redis.clients.jedis.Jedis.msetnx(String[])";"redis.clients.jedis.Client.msetnx(String[])";"Extract Method public msetnx(keysvalues String[]) : void extracted from public msetnx(keysvalues String[]) : int in class redis.clients.jedis.Jedis"
703;"81cc2cec8e52b8fd814d5ddd0e4a277f6b08441b";"cc26791c69b7a2a480384506127a3f65de276eea";"Extract Method";"redis.clients.jedis.Jedis.ping()";"redis.clients.jedis.Client.ping()";"Extract Method public ping() : void extracted from public ping() : String in class redis.clients.jedis.Jedis"
703;"81cc2cec8e52b8fd814d5ddd0e4a277f6b08441b";"cc26791c69b7a2a480384506127a3f65de276eea";"Extract Method";"redis.clients.jedis.Jedis.quit()";"redis.clients.jedis.Client.quit()";"Extract Method public quit() : void extracted from public quit() : void in class redis.clients.jedis.Jedis"
703;"81cc2cec8e52b8fd814d5ddd0e4a277f6b08441b";"cc26791c69b7a2a480384506127a3f65de276eea";"Extract Method";"redis.clients.jedis.Jedis.randomKey()";"redis.clients.jedis.Client.randomKey()";"Extract Method public randomKey() : void extracted from public randomKey() : String in class redis.clients.jedis.Jedis"
703;"81cc2cec8e52b8fd814d5ddd0e4a277f6b08441b";"cc26791c69b7a2a480384506127a3f65de276eea";"Extract Method";"redis.clients.jedis.Jedis.rename(String,String)";"redis.clients.jedis.Client.rename(String,String)";"Extract Method public rename(oldkey String, newkey String) : void extracted from public rename(oldkey String, newkey String) : String in class redis.clients.jedis.Jedis"
703;"81cc2cec8e52b8fd814d5ddd0e4a277f6b08441b";"cc26791c69b7a2a480384506127a3f65de276eea";"Extract Method";"redis.clients.jedis.Jedis.renamenx(String,String)";"redis.clients.jedis.Client.renamenx(String,String)";"Extract Method public renamenx(oldkey String, newkey String) : void extracted from public renamenx(oldkey String, newkey String) : int in class redis.clients.jedis.Jedis"
703;"81cc2cec8e52b8fd814d5ddd0e4a277f6b08441b";"cc26791c69b7a2a480384506127a3f65de276eea";"Extract Method";"redis.clients.jedis.Jedis.rpop(String)";"redis.clients.jedis.Client.rpop(String)";"Extract Method public rpop(key String) : void extracted from public rpop(key String) : String in class redis.clients.jedis.Jedis"
703;"81cc2cec8e52b8fd814d5ddd0e4a277f6b08441b";"cc26791c69b7a2a480384506127a3f65de276eea";"Extract Method";"redis.clients.jedis.Jedis.rpoplpush(String,String)";"redis.clients.jedis.Client.rpoplpush(String,String)";"Extract Method public rpoplpush(srckey String, dstkey String) : void extracted from public rpoplpush(srckey String, dstkey String) : String in class redis.clients.jedis.Jedis"
703;"81cc2cec8e52b8fd814d5ddd0e4a277f6b08441b";"cc26791c69b7a2a480384506127a3f65de276eea";"Extract Method";"redis.clients.jedis.Jedis.rpush(String,String)";"redis.clients.jedis.Client.rpush(String,String)";"Extract Method public rpush(key String, string String) : void extracted from public rpush(key String, string String) : int in class redis.clients.jedis.Jedis"
703;"81cc2cec8e52b8fd814d5ddd0e4a277f6b08441b";"cc26791c69b7a2a480384506127a3f65de276eea";"Extract Method";"redis.clients.jedis.Jedis.sadd(String,String)";"redis.clients.jedis.Client.sadd(String,String)";"Extract Method public sadd(key String, member String) : void extracted from public sadd(key String, member String) : int in class redis.clients.jedis.Jedis"
703;"81cc2cec8e52b8fd814d5ddd0e4a277f6b08441b";"cc26791c69b7a2a480384506127a3f65de276eea";"Extract Method";"redis.clients.jedis.Jedis.scard(String)";"redis.clients.jedis.Client.scard(String)";"Extract Method public scard(key String) : void extracted from public scard(key String) : int in class redis.clients.jedis.Jedis"
703;"81cc2cec8e52b8fd814d5ddd0e4a277f6b08441b";"cc26791c69b7a2a480384506127a3f65de276eea";"Extract Method";"redis.clients.jedis.Jedis.sdiff(String[])";"redis.clients.jedis.Client.sdiff(String[])";"Extract Method public sdiff(keys String[]) : void extracted from public sdiff(keys String[]) : Set in class redis.clients.jedis.Jedis"
703;"81cc2cec8e52b8fd814d5ddd0e4a277f6b08441b";"cc26791c69b7a2a480384506127a3f65de276eea";"Extract Method";"redis.clients.jedis.Jedis.sdiffstore(String,String[])";"redis.clients.jedis.Client.sdiffstore(String,String[])";"Extract Method public sdiffstore(dstkey String, keys String[]) : void extracted from public sdiffstore(dstkey String, keys String[]) : int in class redis.clients.jedis.Jedis"
703;"81cc2cec8e52b8fd814d5ddd0e4a277f6b08441b";"cc26791c69b7a2a480384506127a3f65de276eea";"Extract Method";"redis.clients.jedis.Jedis.select(int)";"redis.clients.jedis.Client.select(int)";"Extract Method public select(index int) : void extracted from public select(index int) : String in class redis.clients.jedis.Jedis"
703;"81cc2cec8e52b8fd814d5ddd0e4a277f6b08441b";"cc26791c69b7a2a480384506127a3f65de276eea";"Extract Method";"redis.clients.jedis.Jedis.set(String,String)";"redis.clients.jedis.Client.set(String,String)";"Extract Method public set(key String, value String) : void extracted from public set(key String, value String) : String in class redis.clients.jedis.Jedis"
703;"81cc2cec8e52b8fd814d5ddd0e4a277f6b08441b";"cc26791c69b7a2a480384506127a3f65de276eea";"Extract Method";"redis.clients.jedis.Jedis.setex(String,int,String)";"redis.clients.jedis.Client.setex(String,int,String)";"Extract Method public setex(key String, seconds int, value String) : void extracted from public setex(key String, seconds int, value String) : String in class redis.clients.jedis.Jedis"
703;"81cc2cec8e52b8fd814d5ddd0e4a277f6b08441b";"cc26791c69b7a2a480384506127a3f65de276eea";"Extract Method";"redis.clients.jedis.Jedis.setnx(String,String)";"redis.clients.jedis.Client.setnx(String,String)";"Extract Method public setnx(key String, value String) : void extracted from public setnx(key String, value String) : int in class redis.clients.jedis.Jedis"
703;"81cc2cec8e52b8fd814d5ddd0e4a277f6b08441b";"cc26791c69b7a2a480384506127a3f65de276eea";"Extract Method";"redis.clients.jedis.Jedis.sinter(String[])";"redis.clients.jedis.Client.sinter(String[])";"Extract Method public sinter(keys String[]) : void extracted from public sinter(keys String[]) : Set in class redis.clients.jedis.Jedis"
703;"81cc2cec8e52b8fd814d5ddd0e4a277f6b08441b";"cc26791c69b7a2a480384506127a3f65de276eea";"Extract Method";"redis.clients.jedis.Jedis.sinterstore(String,String[])";"redis.clients.jedis.Client.sinterstore(String,String[])";"Extract Method public sinterstore(dstkey String, keys String[]) : void extracted from public sinterstore(dstkey String, keys String[]) : int in class redis.clients.jedis.Jedis"
703;"81cc2cec8e52b8fd814d5ddd0e4a277f6b08441b";"cc26791c69b7a2a480384506127a3f65de276eea";"Extract Method";"redis.clients.jedis.Jedis.sismember(String,String)";"redis.clients.jedis.Client.sismember(String,String)";"Extract Method public sismember(key String, member String) : void extracted from public sismember(key String, member String) : int in class redis.clients.jedis.Jedis"
703;"81cc2cec8e52b8fd814d5ddd0e4a277f6b08441b";"cc26791c69b7a2a480384506127a3f65de276eea";"Extract Method";"redis.clients.jedis.Jedis.smembers(String)";"redis.clients.jedis.Client.smembers(String)";"Extract Method public smembers(key String) : void extracted from public smembers(key String) : Set in class redis.clients.jedis.Jedis"
703;"81cc2cec8e52b8fd814d5ddd0e4a277f6b08441b";"cc26791c69b7a2a480384506127a3f65de276eea";"Extract Method";"redis.clients.jedis.Jedis.smove(String,String,String)";"redis.clients.jedis.Client.smove(String,String,String)";"Extract Method public smove(srckey String, dstkey String, member String) : void extracted from public smove(srckey String, dstkey String, member String) : int in class redis.clients.jedis.Jedis"
703;"81cc2cec8e52b8fd814d5ddd0e4a277f6b08441b";"cc26791c69b7a2a480384506127a3f65de276eea";"Extract Method";"redis.clients.jedis.Jedis.spop(String)";"redis.clients.jedis.Client.spop(String)";"Extract Method public spop(key String) : void extracted from public spop(key String) : String in class redis.clients.jedis.Jedis"
703;"81cc2cec8e52b8fd814d5ddd0e4a277f6b08441b";"cc26791c69b7a2a480384506127a3f65de276eea";"Extract Method";"redis.clients.jedis.Jedis.srandmember(String)";"redis.clients.jedis.Client.srandmember(String)";"Extract Method public srandmember(key String) : void extracted from public srandmember(key String) : String in class redis.clients.jedis.Jedis"
703;"81cc2cec8e52b8fd814d5ddd0e4a277f6b08441b";"cc26791c69b7a2a480384506127a3f65de276eea";"Extract Method";"redis.clients.jedis.Jedis.srem(String,String)";"redis.clients.jedis.Client.srem(String,String)";"Extract Method public srem(key String, member String) : void extracted from public srem(key String, member String) : int in class redis.clients.jedis.Jedis"
703;"81cc2cec8e52b8fd814d5ddd0e4a277f6b08441b";"cc26791c69b7a2a480384506127a3f65de276eea";"Extract Method";"redis.clients.jedis.Jedis.substr(String,int,int)";"redis.clients.jedis.Client.substr(String,int,int)";"Extract Method public substr(key String, start int, end int) : void extracted from public substr(key String, start int, end int) : String in class redis.clients.jedis.Jedis"
703;"81cc2cec8e52b8fd814d5ddd0e4a277f6b08441b";"cc26791c69b7a2a480384506127a3f65de276eea";"Extract Method";"redis.clients.jedis.Jedis.sunion(String[])";"redis.clients.jedis.Client.sunion(String[])";"Extract Method public sunion(keys String[]) : void extracted from public sunion(keys String[]) : Set in class redis.clients.jedis.Jedis"
703;"81cc2cec8e52b8fd814d5ddd0e4a277f6b08441b";"cc26791c69b7a2a480384506127a3f65de276eea";"Extract Method";"redis.clients.jedis.Jedis.sunionstore(String,String[])";"redis.clients.jedis.Client.sunionstore(String,String[])";"Extract Method public sunionstore(dstkey String, keys String[]) : void extracted from public sunionstore(dstkey String, keys String[]) : int in class redis.clients.jedis.Jedis"
703;"81cc2cec8e52b8fd814d5ddd0e4a277f6b08441b";"cc26791c69b7a2a480384506127a3f65de276eea";"Extract Method";"redis.clients.jedis.Jedis.ttl(String)";"redis.clients.jedis.Client.ttl(String)";"Extract Method public ttl(key String) : void extracted from public ttl(key String) : int in class redis.clients.jedis.Jedis"
703;"81cc2cec8e52b8fd814d5ddd0e4a277f6b08441b";"cc26791c69b7a2a480384506127a3f65de276eea";"Extract Method";"redis.clients.jedis.Jedis.type(String)";"redis.clients.jedis.Client.type(String)";"Extract Method public type(key String) : void extracted from public type(key String) : String in class redis.clients.jedis.Jedis"
