"Number";"Commit";"Parent";"Refactoring";"EntityBefore";"EntityAfter";"FullDescription"
0;"df040537f47c8bf51ed66d16007c2a3f9f1bb802";"78d4d5eb9371bcd083babfd9c6d298b05e493819";"Rename Class";"redis.clients.jedis.exceptions.JedisClusterMaxRedirectionsException";"redis.clients.jedis.exceptions.JedisClusterOperationException";"Rename Class redis.clients.jedis.exceptions.JedisClusterMaxRedirectionsException renamed to redis.clients.jedis.exceptions.JedisClusterOperationException"
3;"85a31bafec147591ce5c74f08bfd9243ceff9193";"dfd3d824ee8daecda112fa7495f1fe9083e720fb";"Move Class";"redis.clients.util.ByteArrayComparator";"redis.clients.jedis.util.ByteArrayComparator";"Move Class redis.clients.util.ByteArrayComparator moved to redis.clients.jedis.util.ByteArrayComparator"
3;"85a31bafec147591ce5c74f08bfd9243ceff9193";"dfd3d824ee8daecda112fa7495f1fe9083e720fb";"Move Class";"redis.clients.util.Hashing";"redis.clients.jedis.util.Hashing";"Move Class redis.clients.util.Hashing moved to redis.clients.jedis.util.Hashing"
3;"85a31bafec147591ce5c74f08bfd9243ceff9193";"dfd3d824ee8daecda112fa7495f1fe9083e720fb";"Move Class";"redis.clients.util.IOUtils";"redis.clients.jedis.util.IOUtils";"Move Class redis.clients.util.IOUtils moved to redis.clients.jedis.util.IOUtils"
3;"85a31bafec147591ce5c74f08bfd9243ceff9193";"dfd3d824ee8daecda112fa7495f1fe9083e720fb";"Move Class";"redis.clients.util.JedisByteHashMap";"redis.clients.jedis.util.JedisByteHashMap";"Move Class redis.clients.util.JedisByteHashMap moved to redis.clients.jedis.util.JedisByteHashMap"
3;"85a31bafec147591ce5c74f08bfd9243ceff9193";"dfd3d824ee8daecda112fa7495f1fe9083e720fb";"Move Class";"redis.clients.util.JedisClusterCRC16";"redis.clients.jedis.util.JedisClusterCRC16";"Move Class redis.clients.util.JedisClusterCRC16 moved to redis.clients.jedis.util.JedisClusterCRC16"
3;"85a31bafec147591ce5c74f08bfd9243ceff9193";"dfd3d824ee8daecda112fa7495f1fe9083e720fb";"Move Class";"redis.clients.util.JedisClusterHashTagUtil";"redis.clients.jedis.util.JedisClusterHashTagUtil";"Move Class redis.clients.util.JedisClusterHashTagUtil moved to redis.clients.jedis.util.JedisClusterHashTagUtil"
3;"85a31bafec147591ce5c74f08bfd9243ceff9193";"dfd3d824ee8daecda112fa7495f1fe9083e720fb";"Move Class";"redis.clients.util.JedisURIHelper";"redis.clients.jedis.util.JedisURIHelper";"Move Class redis.clients.util.JedisURIHelper moved to redis.clients.jedis.util.JedisURIHelper"
3;"85a31bafec147591ce5c74f08bfd9243ceff9193";"dfd3d824ee8daecda112fa7495f1fe9083e720fb";"Move Class";"redis.clients.util.KeyMergeUtil";"redis.clients.jedis.util.KeyMergeUtil";"Move Class redis.clients.util.KeyMergeUtil moved to redis.clients.jedis.util.KeyMergeUtil"
3;"85a31bafec147591ce5c74f08bfd9243ceff9193";"dfd3d824ee8daecda112fa7495f1fe9083e720fb";"Move Class";"redis.clients.util.MurmurHash";"redis.clients.jedis.util.MurmurHash";"Move Class redis.clients.util.MurmurHash moved to redis.clients.jedis.util.MurmurHash"
3;"85a31bafec147591ce5c74f08bfd9243ceff9193";"dfd3d824ee8daecda112fa7495f1fe9083e720fb";"Move Class";"redis.clients.util.Pool";"redis.clients.jedis.util.Pool";"Move Class redis.clients.util.Pool moved to redis.clients.jedis.util.Pool"
3;"85a31bafec147591ce5c74f08bfd9243ceff9193";"dfd3d824ee8daecda112fa7495f1fe9083e720fb";"Move Class";"redis.clients.util.RedisInputStream";"redis.clients.jedis.util.RedisInputStream";"Move Class redis.clients.util.RedisInputStream moved to redis.clients.jedis.util.RedisInputStream"
3;"85a31bafec147591ce5c74f08bfd9243ceff9193";"dfd3d824ee8daecda112fa7495f1fe9083e720fb";"Move Class";"redis.clients.util.RedisOutputStream";"redis.clients.jedis.util.RedisOutputStream";"Move Class redis.clients.util.RedisOutputStream moved to redis.clients.jedis.util.RedisOutputStream"
3;"85a31bafec147591ce5c74f08bfd9243ceff9193";"dfd3d824ee8daecda112fa7495f1fe9083e720fb";"Move Class";"redis.clients.util.SafeEncoder";"redis.clients.jedis.util.SafeEncoder";"Move Class redis.clients.util.SafeEncoder moved to redis.clients.jedis.util.SafeEncoder"
3;"85a31bafec147591ce5c74f08bfd9243ceff9193";"dfd3d824ee8daecda112fa7495f1fe9083e720fb";"Move Class";"redis.clients.util.ShardInfo";"redis.clients.jedis.util.ShardInfo";"Move Class redis.clients.util.ShardInfo moved to redis.clients.jedis.util.ShardInfo"
3;"85a31bafec147591ce5c74f08bfd9243ceff9193";"dfd3d824ee8daecda112fa7495f1fe9083e720fb";"Move Class";"redis.clients.util.Sharded";"redis.clients.jedis.util.Sharded";"Move Class redis.clients.util.Sharded moved to redis.clients.jedis.util.Sharded"
3;"85a31bafec147591ce5c74f08bfd9243ceff9193";"dfd3d824ee8daecda112fa7495f1fe9083e720fb";"Move Class";"redis.clients.util.Slowlog";"redis.clients.jedis.util.Slowlog";"Move Class redis.clients.util.Slowlog moved to redis.clients.jedis.util.Slowlog"
11;"9b60c4088b221c3b566d0cdd777e045c86960642";"6f941debdafea6fc1a725b1dcc184e9365e49695";"Move Class";"redis.clients.jedis.params.geo.GeoRadiusParam";"redis.clients.jedis.params.GeoRadiusParam";"Move Class redis.clients.jedis.params.geo.GeoRadiusParam moved to redis.clients.jedis.params.GeoRadiusParam"
11;"9b60c4088b221c3b566d0cdd777e045c86960642";"6f941debdafea6fc1a725b1dcc184e9365e49695";"Move Class";"redis.clients.jedis.params.set.SetParams";"redis.clients.jedis.params.SetParams";"Move Class redis.clients.jedis.params.set.SetParams moved to redis.clients.jedis.params.SetParams"
11;"9b60c4088b221c3b566d0cdd777e045c86960642";"6f941debdafea6fc1a725b1dcc184e9365e49695";"Move Class";"redis.clients.jedis.params.sortedset.ZAddParams";"redis.clients.jedis.params.ZAddParams";"Move Class redis.clients.jedis.params.sortedset.ZAddParams moved to redis.clients.jedis.params.ZAddParams"
11;"9b60c4088b221c3b566d0cdd777e045c86960642";"6f941debdafea6fc1a725b1dcc184e9365e49695";"Move Class";"redis.clients.jedis.params.sortedset.ZIncrByParams";"redis.clients.jedis.params.ZIncrByParams";"Move Class redis.clients.jedis.params.sortedset.ZIncrByParams moved to redis.clients.jedis.params.ZIncrByParams"
15;"6a8639fb133fe22fa414b7d91bb92940acdd7112";"3313195c1f52c6ad913fc82d39c98ffb37d725c7";"Extract Method";"redis.clients.jedis.BinaryClient.bitop(BitOP,byte[],byte[][])";"redis.clients.jedis.BinaryClient.joinParameters(byte[],byte[],byte[][])";"Extract Method private joinParameters(first byte[], second byte[], rest byte[][]) : byte[][] extracted from public bitop(op BitOP, destKey byte[], srcKeys byte[][]) : void in class redis.clients.jedis.BinaryClient"
15;"6a8639fb133fe22fa414b7d91bb92940acdd7112";"3313195c1f52c6ad913fc82d39c98ffb37d725c7";"Extract Method";"redis.clients.jedis.BinaryClient.zunionstore(byte[],byte[][])";"redis.clients.jedis.BinaryClient.joinParameters(byte[],byte[],byte[][])";"Extract Method private joinParameters(first byte[], second byte[], rest byte[][]) : byte[][] extracted from public zunionstore(dstkey byte[], sets byte[][]) : void in class redis.clients.jedis.BinaryClient"
15;"6a8639fb133fe22fa414b7d91bb92940acdd7112";"3313195c1f52c6ad913fc82d39c98ffb37d725c7";"Extract Method";"redis.clients.jedis.BinaryClient.zinterstore(byte[],byte[][])";"redis.clients.jedis.BinaryClient.joinParameters(byte[],byte[],byte[][])";"Extract Method private joinParameters(first byte[], second byte[], rest byte[][]) : byte[][] extracted from public zinterstore(dstkey byte[], sets byte[][]) : void in class redis.clients.jedis.BinaryClient"
17;"6c3e6d2e5752af2cd22f4fc56ae83c5282e5d4c6";"ca4415f17aafd2d5016bee6b687cfffdf554544c";"Extract Method";"redis.clients.jedis.JedisShardInfo.(String)";"redis.clients.util.JedisURIHelper.isRedisSSLScheme(URI)";"Extract Method public isRedisSSLScheme(uri URI) : boolean extracted from public JedisShardInfo(host String) in class redis.clients.jedis.JedisShardInfo"
17;"6c3e6d2e5752af2cd22f4fc56ae83c5282e5d4c6";"ca4415f17aafd2d5016bee6b687cfffdf554544c";"Extract Method";"redis.clients.jedis.BinaryJedis.initializeClientFromURI(URI,SSLSocketFactory,SSLParameters,HostnameVerifier)";"redis.clients.util.JedisURIHelper.isRedisSSLScheme(URI)";"Extract Method public isRedisSSLScheme(uri URI) : boolean extracted from private initializeClientFromURI(uri URI, sslSocketFactory SSLSocketFactory, sslParameters SSLParameters, hostnameVerifier HostnameVerifier) : void in class redis.clients.jedis.BinaryJedis"
17;"6c3e6d2e5752af2cd22f4fc56ae83c5282e5d4c6";"ca4415f17aafd2d5016bee6b687cfffdf554544c";"Extract Method";"redis.clients.jedis.JedisShardInfo.(URI)";"redis.clients.util.JedisURIHelper.isRedisSSLScheme(URI)";"Extract Method public isRedisSSLScheme(uri URI) : boolean extracted from public JedisShardInfo(uri URI) in class redis.clients.jedis.JedisShardInfo"
35;"05325b21dc8144b9b825f89bee024d7b283b4d47";"d05290da0ed62db680a1d0dfeb246f50f6f3254a";"Move And Rename Class";"redis.clients.jedis.BinaryClient.LIST_POSITION";"redis.clients.jedis.ListPosition";"Move And Rename Class redis.clients.jedis.BinaryClient.LIST_POSITION moved to redis.clients.jedis.ListPosition"
36;"d05290da0ed62db680a1d0dfeb246f50f6f3254a";"8649a39d7d7a6859ebcd8c29ed5615ea5c3da5fd";"Move And Rename Class";"redis.clients.jedis.JedisCluster.Reset";"redis.clients.jedis.ClusterReset";"Move And Rename Class redis.clients.jedis.JedisCluster.Reset moved to redis.clients.jedis.ClusterReset"
40;"a1216b952bbb8ced498e7969d5c2a51d54108314";"46f674dd4c1960d6df3400bf1d3c88a200be04c7";"Extract Method";"redis.clients.jedis.BinaryJedis.zremrangeByScore(byte[],double,double)";"redis.clients.jedis.BinaryClient.zremrangeByScore(byte[],double,double)";"Extract Method public zremrangeByScore(key byte[], min double, max double) : void extracted from public zremrangeByScore(key byte[], min double, max double) : Long in class redis.clients.jedis.BinaryJedis"
41;"46f674dd4c1960d6df3400bf1d3c88a200be04c7";"08d1e4bea08f5a8de1ef394ebf84ea5d8e5c3940";"Rename Method";"redis.clients.jedis.BinaryJedis.getBinaryTupledSet()";"redis.clients.jedis.BinaryJedis.getTupledSet()";"Rename Method private getBinaryTupledSet() : Set renamed to protected getTupledSet() : Set in class redis.clients.jedis.BinaryJedis"
62;"52785df5f053747f9c8cc492b2e7a8090eda332d";"77baf15d9272e8ae64d2be447261d7854224dec3";"Extract Method";"redis.clients.jedis.BinaryJedisCluster.scan(byte[],ScanParams)";"redis.clients.util.JedisClusterHashTagUtil.isClusterCompliantMatchPattern(byte[])";"Extract Method public isClusterCompliantMatchPattern(matchPattern byte[]) : boolean extracted from public scan(cursor byte[], params ScanParams) : ScanResult in class redis.clients.jedis.BinaryJedisCluster"
80;"9d2568ccc102a9f479d1dc446fc45cec78cca577";"e4a918f443ff1bba076d0ba16f8e2a9e474bd113";"Rename Method";"redis.clients.jedis.tests.TupleTest.tupleCompare()";"redis.clients.jedis.tests.TupleTest.compareNoMatch()";"Rename Method public tupleCompare() : void renamed to public compareNoMatch() : void in class redis.clients.jedis.tests.TupleTest"
80;"9d2568ccc102a9f479d1dc446fc45cec78cca577";"e4a918f443ff1bba076d0ba16f8e2a9e474bd113";"Rename Method";"redis.clients.jedis.tests.TupleTest.testCompareTo()";"redis.clients.jedis.tests.TupleTest.compareEqual()";"Rename Method public testCompareTo() : void renamed to public compareEqual() : void in class redis.clients.jedis.tests.TupleTest"
80;"9d2568ccc102a9f479d1dc446fc45cec78cca577";"e4a918f443ff1bba076d0ba16f8e2a9e474bd113";"Extract Method";"redis.clients.jedis.Tuple.compareTo(Tuple)";"redis.clients.jedis.Tuple.compare(Tuple,Tuple)";"Extract Method public compare(t1 Tuple, t2 Tuple) : int extracted from public compareTo(other Tuple) : int in class redis.clients.jedis.Tuple"
91;"5579c0e9762328ca70f61cfc2659af1385f6f374";"137887018948371a535f31c58faa61d61a1ebc6e";"Move Class";"redis.clients.jedis.HostAndPortTest";"redis.clients.jedis.tests.HostAndPortTest";"Move Class redis.clients.jedis.HostAndPortTest moved to redis.clients.jedis.tests.HostAndPortTest"
91;"5579c0e9762328ca70f61cfc2659af1385f6f374";"137887018948371a535f31c58faa61d61a1ebc6e";"Move Method";"redis.clients.jedis.tests.commands.SortedSetCommandsTest.tupleCompare()";"redis.clients.jedis.tests.TupleTest.tupleCompare()";"Move Method public tupleCompare() : void from class redis.clients.jedis.tests.commands.SortedSetCommandsTest to public tupleCompare() : void from class redis.clients.jedis.tests.TupleTest"
91;"5579c0e9762328ca70f61cfc2659af1385f6f374";"137887018948371a535f31c58faa61d61a1ebc6e";"Move Method";"redis.clients.jedis.TupleTest.testCompareTo()";"redis.clients.jedis.tests.TupleTest.testCompareTo()";"Move Method public testCompareTo() : void from class redis.clients.jedis.TupleTest to public testCompareTo() : void from class redis.clients.jedis.tests.TupleTest"
110;"6a933f14f4db03abd32b373cb982fce9baf0fa03";"5c2b5858fcac335b67fc0eb00b503a1c71644b19";"Move Method";"redis.clients.jedis.tests.JedisTest.testHstrLen()";"redis.clients.jedis.tests.commands.HashesCommandsTest.testHstrLen()";"Move Method public testHstrLen() : void from class redis.clients.jedis.tests.JedisTest to public testHstrLen() : void from class redis.clients.jedis.tests.commands.HashesCommandsTest"
110;"6a933f14f4db03abd32b373cb982fce9baf0fa03";"5c2b5858fcac335b67fc0eb00b503a1c71644b19";"Move Method";"redis.clients.jedis.tests.JedisTest.testHstrLen_EmptyHash()";"redis.clients.jedis.tests.commands.HashesCommandsTest.testHstrLen_EmptyHash()";"Move Method public testHstrLen_EmptyHash() : void from class redis.clients.jedis.tests.JedisTest to public testHstrLen_EmptyHash() : void from class redis.clients.jedis.tests.commands.HashesCommandsTest"
113;"686a5f8a317538d02d1271fa6e2025ccac2f4797";"e9d85afb2586bac52f3280c737b2b7151cdece22";"Move Method";"redis.clients.jedis.tests.JedisTest.testBitfield()";"redis.clients.jedis.tests.commands.BitCommandsTest.testBitfield()";"Move Method public testBitfield() : void from class redis.clients.jedis.tests.JedisTest to public testBitfield() : void from class redis.clients.jedis.tests.commands.BitCommandsTest"
113;"686a5f8a317538d02d1271fa6e2025ccac2f4797";"e9d85afb2586bac52f3280c737b2b7151cdece22";"Move Method";"redis.clients.jedis.tests.JedisTest.testBinaryBitfield()";"redis.clients.jedis.tests.commands.BitCommandsTest.testBinaryBitfield()";"Move Method public testBinaryBitfield() : void from class redis.clients.jedis.tests.JedisTest to public testBinaryBitfield() : void from class redis.clients.jedis.tests.commands.BitCommandsTest"
126;"69d4080f5f5b0a2920ea093ac3453fee08467e37";"3a637f53def65f13df083b1c6e0a9ed776b2bbba";"Rename Method";"redis.clients.jedis.JedisClusterInfoCache.setNodeIfNotExist(HostAndPort,boolean,SSLSocketFactory,SSLParameters,HostnameVerifier)";"redis.clients.jedis.JedisClusterInfoCache.setupNodeIfNotExist(HostAndPort,boolean,SSLSocketFactory,SSLParameters,HostnameVerifier)";"Rename Method public setNodeIfNotExist(node HostAndPort, ssl boolean, sslSocketFactory SSLSocketFactory, sslParameters SSLParameters, hostnameVerifier HostnameVerifier) : void renamed to public setupNodeIfNotExist(node HostAndPort, ssl boolean, sslSocketFactory SSLSocketFactory, sslParameters SSLParameters, hostnameVerifier HostnameVerifier) : JedisPool in class redis.clients.jedis.JedisClusterInfoCache"
126;"69d4080f5f5b0a2920ea093ac3453fee08467e37";"3a637f53def65f13df083b1c6e0a9ed776b2bbba";"Rename Method";"redis.clients.jedis.JedisClusterInfoCache.setNodeIfNotExist(HostAndPort)";"redis.clients.jedis.JedisClusterInfoCache.setupNodeIfNotExist(HostAndPort)";"Rename Method public setNodeIfNotExist(node HostAndPort) : void renamed to public setupNodeIfNotExist(node HostAndPort) : JedisPool in class redis.clients.jedis.JedisClusterInfoCache"
126;"69d4080f5f5b0a2920ea093ac3453fee08467e37";"3a637f53def65f13df083b1c6e0a9ed776b2bbba";"Rename Method";"redis.clients.jedis.JedisClusterInfoCache.setNodeIfNotExist(HostAndPort,boolean)";"redis.clients.jedis.JedisClusterInfoCache.setupNodeIfNotExist(HostAndPort,boolean)";"Rename Method public setNodeIfNotExist(node HostAndPort, ssl boolean) : void renamed to public setupNodeIfNotExist(node HostAndPort, ssl boolean) : JedisPool in class redis.clients.jedis.JedisClusterInfoCache"
126;"69d4080f5f5b0a2920ea093ac3453fee08467e37";"3a637f53def65f13df083b1c6e0a9ed776b2bbba";"Move Method";"redis.clients.jedis.JedisClusterConnectionHandler.getShuffledNodesPool()";"redis.clients.jedis.JedisClusterInfoCache.getShuffledNodesPool()";"Move Method protected getShuffledNodesPool() : List from class redis.clients.jedis.JedisClusterConnectionHandler to public getShuffledNodesPool() : List from class redis.clients.jedis.JedisClusterInfoCache"
126;"69d4080f5f5b0a2920ea093ac3453fee08467e37";"3a637f53def65f13df083b1c6e0a9ed776b2bbba";"Extract Method";"redis.clients.jedis.JedisClusterConnectionHandler.renewSlotCache()";"redis.clients.jedis.JedisClusterInfoCache.renewClusterSlots(Jedis)";"Extract Method public renewClusterSlots(jedis Jedis) : void extracted from public renewSlotCache() : void in class redis.clients.jedis.JedisClusterConnectionHandler"
126;"69d4080f5f5b0a2920ea093ac3453fee08467e37";"3a637f53def65f13df083b1c6e0a9ed776b2bbba";"Extract Method";"redis.clients.jedis.JedisClusterConnectionHandler.renewSlotCache(Jedis)";"redis.clients.jedis.JedisClusterInfoCache.renewClusterSlots(Jedis)";"Extract Method public renewClusterSlots(jedis Jedis) : void extracted from public renewSlotCache(jedis Jedis) : void in class redis.clients.jedis.JedisClusterConnectionHandler"
152;"b79d068c70a1f617f71b3eea0696aa196da9fc91";"e85a9e4f4b49815e9a4a32005a223d1a13ad1b6d";"Extract Method";"redis.clients.jedis.JedisClusterInfoCache.discoverClusterNodesAndSlots(Jedis)";"redis.clients.jedis.JedisClusterInfoCache.reset()";"Extract Method public reset() : void extracted from public discoverClusterNodesAndSlots(jedis Jedis) : void in class redis.clients.jedis.JedisClusterInfoCache"
299;"59a13121ab9bb0a82e9fb6d56f036827c7c37330";"5d0f75a32fb7e11f82949824f537fe16a789ac0d";"Extract Method";"redis.clients.util.RedisInputStream.readByte()";"redis.clients.util.RedisInputStream.ensureFill()";"Extract Method private ensureFill() : void extracted from public readByte() : byte in class redis.clients.util.RedisInputStream"
299;"59a13121ab9bb0a82e9fb6d56f036827c7c37330";"5d0f75a32fb7e11f82949824f537fe16a789ac0d";"Extract Method";"redis.clients.util.RedisInputStream.readLine()";"redis.clients.util.RedisInputStream.ensureFill()";"Extract Method private ensureFill() : void extracted from public readLine() : String in class redis.clients.util.RedisInputStream"
299;"59a13121ab9bb0a82e9fb6d56f036827c7c37330";"5d0f75a32fb7e11f82949824f537fe16a789ac0d";"Extract Method";"redis.clients.util.RedisInputStream.read(byte[],int,int)";"redis.clients.util.RedisInputStream.ensureFill()";"Extract Method private ensureFill() : void extracted from public read(b byte[], off int, len int) : int in class redis.clients.util.RedisInputStream"
299;"59a13121ab9bb0a82e9fb6d56f036827c7c37330";"5d0f75a32fb7e11f82949824f537fe16a789ac0d";"Extract Method";"redis.clients.jedis.Protocol.processBulkReply(RedisInputStream)";"redis.clients.util.RedisInputStream.readIntCrLf()";"Extract Method public readIntCrLf() : int extracted from private processBulkReply(is RedisInputStream) : byte[] in class redis.clients.jedis.Protocol"
392;"15891c411734e78dafe61262f7052b0d1936e286";"e10cdda5c7534610a503ec0642938f3c5b3a72f0";"Extract Method";"redis.clients.jedis.HostAndPort.equals(Object)";"redis.clients.jedis.HostAndPort.convertHost(String)";"Extract Method private convertHost(host String) : String extracted from public equals(obj Object) : boolean in class redis.clients.jedis.HostAndPort"
402;"35a2dfd4c06f275d9bcdc07792e382cf59df300d";"08e9b0c7e7a59c8695b65ef7e7f1f140e9e6c9a7";"Rename Method";"redis.clients.jedis.tests.JedisSentinelPoolTest.segfaultMaster()";"redis.clients.jedis.tests.JedisSentinelPoolTest.doSegFaultMaster(JedisSentinelPool)";"Rename Method public segfaultMaster() : void renamed to private doSegFaultMaster(pool JedisSentinelPool) : void in class redis.clients.jedis.tests.JedisSentinelPoolTest"
402;"35a2dfd4c06f275d9bcdc07792e382cf59df300d";"08e9b0c7e7a59c8695b65ef7e7f1f140e9e6c9a7";"Extract Method";"redis.clients.util.Pool.destroy()";"redis.clients.util.Pool.closeInternalPool()";"Extract Method protected closeInternalPool() : void extracted from public destroy() : void in class redis.clients.util.Pool"
423;"52286d6942771bf676c8996e79433fd903f43cf5";"c2a48afafd05f9a0a6d7bdad1ed7a8f8269dc4df";"Inline Method";"redis.clients.jedis.JedisSentinelPool.log(String)";"redis.clients.jedis.JedisSentinelPool.initPool(HostAndPort)";"Inline Method private log(msg String) : void inlined to private initPool(master HostAndPort) : void in class redis.clients.jedis.JedisSentinelPool"
423;"52286d6942771bf676c8996e79433fd903f43cf5";"c2a48afafd05f9a0a6d7bdad1ed7a8f8269dc4df";"Inline Method";"redis.clients.jedis.JedisSentinelPool.log(String)";"redis.clients.jedis.JedisSentinelPool.initSentinels(Set,String)";"Inline Method private log(msg String) : void inlined to private initSentinels(sentinels Set, masterName String) : HostAndPort in class redis.clients.jedis.JedisSentinelPool"
424;"c2a48afafd05f9a0a6d7bdad1ed7a8f8269dc4df";"404c5632c73e070d6f9eaecf2460970d46ffc7c6";"Move Class";"redis.clients.jedis.JedisPool.JedisFactory";"redis.clients.jedis.JedisFactory";"Move Class redis.clients.jedis.JedisPool.JedisFactory moved to redis.clients.jedis.JedisFactory"
485;"3fb7a52017af5247645706dcb7769294f9bee65e";"6707b62342765a0a04cc31325501be3fc5f55193";"Pull Up Method";"redis.clients.jedis.Pipeline.generateResponse(Object)";"redis.clients.jedis.Queable.generateResponse(Object)";"Pull Up Method private generateResponse(data Object) : Response from class redis.clients.jedis.Pipeline to protected generateResponse(data Object) : Response from class redis.clients.jedis.Queable"
485;"3fb7a52017af5247645706dcb7769294f9bee65e";"6707b62342765a0a04cc31325501be3fc5f55193";"Pull Up Method";"redis.clients.jedis.Pipeline.getResponse(Builder)";"redis.clients.jedis.Queable.getResponse(Builder)";"Pull Up Method private getResponse(builder Builder) : Response from class redis.clients.jedis.Pipeline to protected getResponse(builder Builder) : Response from class redis.clients.jedis.Queable"
485;"3fb7a52017af5247645706dcb7769294f9bee65e";"6707b62342765a0a04cc31325501be3fc5f55193";"Pull Up Attribute";"redis.clients.jedis.Pipeline.pipelinedResponses";"redis.clients.jedis.Queable.pipelinedResponses";"Pull Up Attribute private pipelinedResponses : Queue from class redis.clients.jedis.Pipeline to class redis.clients.jedis.Queable"
486;"6707b62342765a0a04cc31325501be3fc5f55193";"ff50c17238cdc3a0c824b00c2a60899ff0438205";"Rename Method";"redis.clients.jedis.Pipeline.(Client)";"redis.clients.jedis.Pipeline.setClient(Client)";"Rename Method public Pipeline(client Client) renamed to public setClient(client Client) : void in class redis.clients.jedis.Pipeline"
506;"2a4a43f4cdcf72e2dcbce5282999bd27e22adf83";"b4ad7697b7ff4d289a2269838c8263a584bb339c";"Move Class";"redis.clients.jedis.JedisException";"redis.clients.jedis.exceptions.JedisException";"Move Class redis.clients.jedis.JedisException moved to redis.clients.jedis.exceptions.JedisException"
548;"8043f12e200e45754baa8a60b30c1b725679054e";"f8636ec16baf8f82c93efda5289de90d10795d5e";"Extract Interface";"redis.clients.jedis.Client";"redis.clients.jedis.Commands";"Extract Interface redis.clients.jedis.Commands from class redis.clients.jedis.Client"
548;"8043f12e200e45754baa8a60b30c1b725679054e";"f8636ec16baf8f82c93efda5289de90d10795d5e";"Move Method";"redis.clients.jedis.JedisPipeline.setClient(Client)";"redis.clients.jedis.PipelineBlock.setClient(Client)";"Move Method public setClient(client Client) : void from class redis.clients.jedis.JedisPipeline to public setClient(client Client) : void from class redis.clients.jedis.PipelineBlock"
551;"a1815f38814ba7b1207d0034045093ff8251ea70";"ad149e82527e2f7a95a86245ecc199d8debf7215";"Inline Method";"redis.clients.util.ShardInfo.initResource()";"redis.clients.util.Sharded.initialize(List)";"Inline Method public initResource() : void inlined to private initialize(shards List) : void in class redis.clients.util.Sharded"
554;"098de44a071d8b7050c25c128d4cfc7d47658610";"71eb4c5b4ae74a18a8db6de91e7f71a2a2797c3c";"Extract Method";"redis.clients.jedis.Connection.getStatusCodeReply()";"redis.clients.util.SafeEncoder.encode(byte[])";"Extract Method public encode(data byte[]) : String extracted from protected getStatusCodeReply() : String in class redis.clients.jedis.Connection"
554;"098de44a071d8b7050c25c128d4cfc7d47658610";"71eb4c5b4ae74a18a8db6de91e7f71a2a2797c3c";"Extract Method";"redis.clients.jedis.Connection.getBulkReply()";"redis.clients.util.SafeEncoder.encode(byte[])";"Extract Method public encode(data byte[]) : String extracted from public getBulkReply() : String in class redis.clients.jedis.Connection"
554;"098de44a071d8b7050c25c128d4cfc7d47658610";"71eb4c5b4ae74a18a8db6de91e7f71a2a2797c3c";"Extract Method";"redis.clients.jedis.tests.JedisTest.checkBinaryData()";"redis.clients.util.SafeEncoder.encode(byte[])";"Extract Method public encode(data byte[]) : String extracted from public checkBinaryData() : void in class redis.clients.jedis.tests.JedisTest"
554;"098de44a071d8b7050c25c128d4cfc7d47658610";"71eb4c5b4ae74a18a8db6de91e7f71a2a2797c3c";"Extract Method";"redis.clients.jedis.Connection.getMultiBulkReply()";"redis.clients.util.SafeEncoder.encode(byte[])";"Extract Method public encode(data byte[]) : String extracted from public getMultiBulkReply() : List in class redis.clients.jedis.Connection"
554;"098de44a071d8b7050c25c128d4cfc7d47658610";"71eb4c5b4ae74a18a8db6de91e7f71a2a2797c3c";"Extract Method";"redis.clients.jedis.BinaryJedis.getBinaryTupledSet()";"redis.clients.util.SafeEncoder.encode(byte[])";"Extract Method public encode(data byte[]) : String extracted from private getBinaryTupledSet() : Set in class redis.clients.jedis.BinaryJedis"
