"Number";"Commit";"Parent";"Refactoring";"EntityBefore";"EntityAfter";"FullDescription"
703;"81cc2cec8e52b8fd814d5ddd0e4a277f6b08441b";"cc26791c69b7a2a480384506127a3f65de276eea";"Extract Method";"redis.clients.jedis.Jedis.zadd(String,double,String)";"redis.clients.jedis.Client.zadd(String,double,String)";"Extract Method public zadd(key String, score double, member String) : void extracted from public zadd(key String, score double, member String) : int in class redis.clients.jedis.Jedis"
703;"81cc2cec8e52b8fd814d5ddd0e4a277f6b08441b";"cc26791c69b7a2a480384506127a3f65de276eea";"Extract Method";"redis.clients.jedis.Jedis.zcard(String)";"redis.clients.jedis.Client.zcard(String)";"Extract Method public zcard(key String) : void extracted from public zcard(key String) : int in class redis.clients.jedis.Jedis"
703;"81cc2cec8e52b8fd814d5ddd0e4a277f6b08441b";"cc26791c69b7a2a480384506127a3f65de276eea";"Extract Method";"redis.clients.jedis.Jedis.zincrby(String,double,String)";"redis.clients.jedis.Client.zincrby(String,double,String)";"Extract Method public zincrby(key String, score double, member String) : void extracted from public zincrby(key String, score double, member String) : double in class redis.clients.jedis.Jedis"
703;"81cc2cec8e52b8fd814d5ddd0e4a277f6b08441b";"cc26791c69b7a2a480384506127a3f65de276eea";"Extract Method";"redis.clients.jedis.Jedis.zrange(String,int,int)";"redis.clients.jedis.Client.zrange(String,int,int)";"Extract Method public zrange(key String, start int, end int) : void extracted from public zrange(key String, start int, end int) : Set in class redis.clients.jedis.Jedis"
703;"81cc2cec8e52b8fd814d5ddd0e4a277f6b08441b";"cc26791c69b7a2a480384506127a3f65de276eea";"Extract Method";"redis.clients.jedis.Jedis.zrangeWithScores(String,int,int)";"redis.clients.jedis.Client.zrangeWithScores(String,int,int)";"Extract Method public zrangeWithScores(key String, start int, end int) : void extracted from public zrangeWithScores(key String, start int, end int) : Set in class redis.clients.jedis.Jedis"
703;"81cc2cec8e52b8fd814d5ddd0e4a277f6b08441b";"cc26791c69b7a2a480384506127a3f65de276eea";"Extract Method";"redis.clients.jedis.Jedis.zrank(String,String)";"redis.clients.jedis.Client.zrank(String,String)";"Extract Method public zrank(key String, member String) : void extracted from public zrank(key String, member String) : int in class redis.clients.jedis.Jedis"
703;"81cc2cec8e52b8fd814d5ddd0e4a277f6b08441b";"cc26791c69b7a2a480384506127a3f65de276eea";"Extract Method";"redis.clients.jedis.Jedis.zrem(String,String)";"redis.clients.jedis.Client.zrem(String,String)";"Extract Method public zrem(key String, member String) : void extracted from public zrem(key String, member String) : int in class redis.clients.jedis.Jedis"
703;"81cc2cec8e52b8fd814d5ddd0e4a277f6b08441b";"cc26791c69b7a2a480384506127a3f65de276eea";"Extract Method";"redis.clients.jedis.Jedis.zrevrange(String,int,int)";"redis.clients.jedis.Client.zrevrange(String,int,int)";"Extract Method public zrevrange(key String, start int, end int) : void extracted from public zrevrange(key String, start int, end int) : Set in class redis.clients.jedis.Jedis"
703;"81cc2cec8e52b8fd814d5ddd0e4a277f6b08441b";"cc26791c69b7a2a480384506127a3f65de276eea";"Extract Method";"redis.clients.jedis.Jedis.zrevrangeWithScores(String,int,int)";"redis.clients.jedis.Client.zrevrangeWithScores(String,int,int)";"Extract Method public zrevrangeWithScores(key String, start int, end int) : void extracted from public zrevrangeWithScores(key String, start int, end int) : Set in class redis.clients.jedis.Jedis"
703;"81cc2cec8e52b8fd814d5ddd0e4a277f6b08441b";"cc26791c69b7a2a480384506127a3f65de276eea";"Extract Method";"redis.clients.jedis.Jedis.zrevrank(String,String)";"redis.clients.jedis.Client.zrevrank(String,String)";"Extract Method public zrevrank(key String, member String) : void extracted from public zrevrank(key String, member String) : int in class redis.clients.jedis.Jedis"
703;"81cc2cec8e52b8fd814d5ddd0e4a277f6b08441b";"cc26791c69b7a2a480384506127a3f65de276eea";"Extract Method";"redis.clients.jedis.Jedis.zscore(String,String)";"redis.clients.jedis.Client.zscore(String,String)";"Extract Method public zscore(key String, member String) : void extracted from public zscore(key String, member String) : double in class redis.clients.jedis.Jedis"
715;"def3f38de70ccc3337f944232201bd39173c06bd";"4ccb12cd75154f0c7629fdc7e168690d58d408b0";"Move And Rename Class";"redis.clients.jedis.tests.JedisTest";"redis.clients.jedis.tests.commands.StringValuesCommandsTest";"Move And Rename Class redis.clients.jedis.tests.JedisTest moved to redis.clients.jedis.tests.commands.StringValuesCommandsTest"
715;"def3f38de70ccc3337f944232201bd39173c06bd";"4ccb12cd75154f0c7629fdc7e168690d58d408b0";"Rename Method";"redis.clients.jedis.Client.getSingleLineReply()";"redis.clients.jedis.Client.getStatusCodeReply()";"Rename Method protected getSingleLineReply() : String renamed to protected getStatusCodeReply() : String in class redis.clients.jedis.Client"
715;"def3f38de70ccc3337f944232201bd39173c06bd";"4ccb12cd75154f0c7629fdc7e168690d58d408b0";"Move Method";"redis.clients.jedis.tests.JedisTest.ping()";"redis.clients.jedis.tests.commands.AllKindOfValuesCommandsTest.ping()";"Move Method public ping() : void from class redis.clients.jedis.tests.JedisTest to public ping() : void from class redis.clients.jedis.tests.commands.AllKindOfValuesCommandsTest"
716;"4ccb12cd75154f0c7629fdc7e168690d58d408b0";"55f640c8ff7c30a88d73a5cef89b12711a5ee34b";"Rename Method";"redis.clients.jedis.Protocol.buildCommand(String,String[])";"redis.clients.jedis.Protocol.sendCommand(OutputStream,String,String[])";"Rename Method public buildCommand(name String, args String[]) : String renamed to public sendCommand(os OutputStream, name String, args String[]) : void in class redis.clients.jedis.Protocol"
716;"4ccb12cd75154f0c7629fdc7e168690d58d408b0";"55f640c8ff7c30a88d73a5cef89b12711a5ee34b";"Extract Method";"redis.clients.jedis.Jedis.ping()";"redis.clients.jedis.Client.sendCommand(String,String[])";"Extract Method protected sendCommand(name String, args String[]) : Client extracted from public ping() : String in class redis.clients.jedis.Jedis"
716;"4ccb12cd75154f0c7629fdc7e168690d58d408b0";"55f640c8ff7c30a88d73a5cef89b12711a5ee34b";"Extract Method";"redis.clients.jedis.Jedis.set(String,String)";"redis.clients.jedis.Client.sendCommand(String,String[])";"Extract Method protected sendCommand(name String, args String[]) : Client extracted from public set(key String, value String) : String in class redis.clients.jedis.Jedis"
716;"4ccb12cd75154f0c7629fdc7e168690d58d408b0";"55f640c8ff7c30a88d73a5cef89b12711a5ee34b";"Extract Method";"redis.clients.jedis.Jedis.get(String)";"redis.clients.jedis.Client.sendCommand(String,String[])";"Extract Method protected sendCommand(name String, args String[]) : Client extracted from public get(key String) : String in class redis.clients.jedis.Jedis"
