"Number";"Commit";"Parent";"Refactoring";"EntityBefore";"EntityAfter";"FullDescription"
554;"098de44a071d8b7050c25c128d4cfc7d47658610";"71eb4c5b4ae74a18a8db6de91e7f71a2a2797c3c";"Extract Method";"redis.clients.jedis.JedisPubSub.process(Client)";"redis.clients.util.SafeEncoder.encode(byte[])";"Extract Method public encode(data byte[]) : String extracted from private process(client Client) : void in class redis.clients.jedis.JedisPubSub"
554;"098de44a071d8b7050c25c128d4cfc7d47658610";"71eb4c5b4ae74a18a8db6de91e7f71a2a2797c3c";"Extract Method";"redis.clients.jedis.Tuple.getElement()";"redis.clients.util.SafeEncoder.encode(byte[])";"Extract Method public encode(data byte[]) : String extracted from public getElement() : String in class redis.clients.jedis.Tuple"
554;"098de44a071d8b7050c25c128d4cfc7d47658610";"71eb4c5b4ae74a18a8db6de91e7f71a2a2797c3c";"Extract Method";"redis.clients.util.Sharded.getShard(byte[])";"redis.clients.util.Sharded.getShardInfo(byte[])";"Extract Method private getShardInfo(key byte[]) : S extracted from public getShard(key byte[]) : R in class redis.clients.util.Sharded"
554;"098de44a071d8b7050c25c128d4cfc7d47658610";"71eb4c5b4ae74a18a8db6de91e7f71a2a2797c3c";"Extract Method";"redis.clients.util.Sharded.getShardInfo(String)";"redis.clients.util.Sharded.getShardInfo(byte[])";"Extract Method private getShardInfo(key byte[]) : S extracted from public getShardInfo(key String) : S in class redis.clients.util.Sharded"
555;"71eb4c5b4ae74a18a8db6de91e7f71a2a2797c3c";"e7582644b1ce457f09300bdecbf7fe08a47daa55";"Pull Up Method";"redis.clients.jedis.JedisPool.getResource()";"redis.clients.util.Pool.getResource()";"Pull Up Method public getResource() : Jedis from class redis.clients.jedis.JedisPool to public getResource() : T from class redis.clients.util.Pool"
555;"71eb4c5b4ae74a18a8db6de91e7f71a2a2797c3c";"e7582644b1ce457f09300bdecbf7fe08a47daa55";"Pull Up Method";"redis.clients.jedis.JedisPool.returnResource(Jedis)";"redis.clients.util.Pool.returnResource(T)";"Pull Up Method public returnResource(jedis Jedis) : void from class redis.clients.jedis.JedisPool to public returnResource(resource T) : void from class redis.clients.util.Pool"
555;"71eb4c5b4ae74a18a8db6de91e7f71a2a2797c3c";"e7582644b1ce457f09300bdecbf7fe08a47daa55";"Move Attribute";"redis.clients.jedis.ShardedJedisPool.algo";"redis.clients.jedis.ShardedJedisPool.ShardedJedisFactory.algo";"Move Attribute private algo : Hashing from class redis.clients.jedis.ShardedJedisPool to class redis.clients.jedis.ShardedJedisPool.ShardedJedisFactory"
555;"71eb4c5b4ae74a18a8db6de91e7f71a2a2797c3c";"e7582644b1ce457f09300bdecbf7fe08a47daa55";"Move Attribute";"redis.clients.jedis.ShardedJedisPool.keyTagPattern";"redis.clients.jedis.ShardedJedisPool.ShardedJedisFactory.keyTagPattern";"Move Attribute private keyTagPattern : Pattern from class redis.clients.jedis.ShardedJedisPool to class redis.clients.jedis.ShardedJedisPool.ShardedJedisFactory"
555;"71eb4c5b4ae74a18a8db6de91e7f71a2a2797c3c";"e7582644b1ce457f09300bdecbf7fe08a47daa55";"Move Attribute";"redis.clients.jedis.ShardedJedisPool.shards";"redis.clients.jedis.ShardedJedisPool.ShardedJedisFactory.shards";"Move Attribute private shards : List from class redis.clients.jedis.ShardedJedisPool to class redis.clients.jedis.ShardedJedisPool.ShardedJedisFactory"
571;"a732ed3a1909ad19b07ff2127fe9d2bad5f134e8";"e38a3fc012d66744d5e68114ad9866fa640ac356";"Rename Class";"redis.clients.jedis.IJedis";"redis.clients.jedis.JedisCommands";"Rename Class redis.clients.jedis.IJedis renamed to redis.clients.jedis.JedisCommands"
572;"e38a3fc012d66744d5e68114ad9866fa640ac356";"99a50db3ea2915ec5d3e942d1b030a2409c55c72";"Extract Interface";"redis.clients.jedis.Jedis";"redis.clients.jedis.IJedis";"Extract Interface redis.clients.jedis.IJedis from class redis.clients.jedis.Jedis"
572;"e38a3fc012d66744d5e68114ad9866fa640ac356";"99a50db3ea2915ec5d3e942d1b030a2409c55c72";"Extract Interface";"redis.clients.jedis.ShardedJedis";"redis.clients.jedis.IJedis";"Extract Interface redis.clients.jedis.IJedis from class redis.clients.jedis.ShardedJedis"
583;"45bb728425c9ca39e4a8c5e9c87036aa3adc49bb";"9db72b749c784e3c3fd01e4ef7908e310ef4fbde";"Move Method";"redis.clients.util.FixedResourcePool.getFails()";"redis.clients.util.FixedResourcePool.Metrics.getFails()";"Move Method public getFails() : long from class redis.clients.util.FixedResourcePool to public getFails() : long from class redis.clients.util.FixedResourcePool.Metrics"
583;"45bb728425c9ca39e4a8c5e9c87036aa3adc49bb";"9db72b749c784e3c3fd01e4ef7908e310ef4fbde";"Move Method";"redis.clients.util.FixedResourcePool.getFailsReported()";"redis.clients.util.FixedResourcePool.Metrics.getFailsReported()";"Move Method public getFailsReported() : long from class redis.clients.util.FixedResourcePool to public getFailsReported() : long from class redis.clients.util.FixedResourcePool.Metrics"
583;"45bb728425c9ca39e4a8c5e9c87036aa3adc49bb";"9db72b749c784e3c3fd01e4ef7908e310ef4fbde";"Move Method";"redis.clients.util.FixedResourcePool.getResourcesCreated()";"redis.clients.util.FixedResourcePool.Metrics.getResourcesCreated()";"Move Method public getResourcesCreated() : long from class redis.clients.util.FixedResourcePool to public getResourcesCreated() : long from class redis.clients.util.FixedResourcePool.Metrics"
583;"45bb728425c9ca39e4a8c5e9c87036aa3adc49bb";"9db72b749c784e3c3fd01e4ef7908e310ef4fbde";"Move Method";"redis.clients.util.FixedResourcePool.getResourcesProvided()";"redis.clients.util.FixedResourcePool.Metrics.getResourcesProvided()";"Move Method public getResourcesProvided() : long from class redis.clients.util.FixedResourcePool to public getResourcesProvided() : long from class redis.clients.util.FixedResourcePool.Metrics"
583;"45bb728425c9ca39e4a8c5e9c87036aa3adc49bb";"9db72b749c784e3c3fd01e4ef7908e310ef4fbde";"Move Method";"redis.clients.util.FixedResourcePool.getResourcesReturned()";"redis.clients.util.FixedResourcePool.Metrics.getResourcesReturned()";"Move Method public getResourcesReturned() : long from class redis.clients.util.FixedResourcePool to public getResourcesReturned() : long from class redis.clients.util.FixedResourcePool.Metrics"
583;"45bb728425c9ca39e4a8c5e9c87036aa3adc49bb";"9db72b749c784e3c3fd01e4ef7908e310ef4fbde";"Inline Method";"redis.clients.util.FixedResourcePool.printStatistics()";"redis.clients.util.FixedResourcePool.init()";"Inline Method private printStatistics() : void inlined to public init() : void in class redis.clients.util.FixedResourcePool"
583;"45bb728425c9ca39e4a8c5e9c87036aa3adc49bb";"9db72b749c784e3c3fd01e4ef7908e310ef4fbde";"Move Attribute";"redis.clients.util.FixedResourcePool.fails";"redis.clients.util.FixedResourcePool.Metrics.fails";"Move Attribute private fails : long from class redis.clients.util.FixedResourcePool to class redis.clients.util.FixedResourcePool.Metrics"
583;"45bb728425c9ca39e4a8c5e9c87036aa3adc49bb";"9db72b749c784e3c3fd01e4ef7908e310ef4fbde";"Move Attribute";"redis.clients.util.FixedResourcePool.resourcesCreated";"redis.clients.util.FixedResourcePool.Metrics.resourcesCreated";"Move Attribute private resourcesCreated : long from class redis.clients.util.FixedResourcePool to class redis.clients.util.FixedResourcePool.Metrics"
583;"45bb728425c9ca39e4a8c5e9c87036aa3adc49bb";"9db72b749c784e3c3fd01e4ef7908e310ef4fbde";"Move Attribute";"redis.clients.util.FixedResourcePool.resourcesProvided";"redis.clients.util.FixedResourcePool.Metrics.resourcesProvided";"Move Attribute private resourcesProvided : long from class redis.clients.util.FixedResourcePool to class redis.clients.util.FixedResourcePool.Metrics"
601;"53efb8471f27ce5aa69b52778e431b31194819b3";"ea784de98a705b8b468bb41fc5af5d71ee2fcdc6";"Push Down Method";"redis.clients.util.ShardInfo.getHost()";"redis.clients.jedis.JedisShardInfo.getHost()";"Push Down Method public getHost() : String from class redis.clients.util.ShardInfo to public getHost() : String from class redis.clients.jedis.JedisShardInfo"
601;"53efb8471f27ce5aa69b52778e431b31194819b3";"ea784de98a705b8b468bb41fc5af5d71ee2fcdc6";"Push Down Method";"redis.clients.util.ShardInfo.getPassword()";"redis.clients.jedis.JedisShardInfo.getPassword()";"Push Down Method public getPassword() : String from class redis.clients.util.ShardInfo to public getPassword() : String from class redis.clients.jedis.JedisShardInfo"
601;"53efb8471f27ce5aa69b52778e431b31194819b3";"ea784de98a705b8b468bb41fc5af5d71ee2fcdc6";"Push Down Method";"redis.clients.util.ShardInfo.getPort()";"redis.clients.jedis.JedisShardInfo.getPort()";"Push Down Method public getPort() : int from class redis.clients.util.ShardInfo to public getPort() : int from class redis.clients.jedis.JedisShardInfo"
601;"53efb8471f27ce5aa69b52778e431b31194819b3";"ea784de98a705b8b468bb41fc5af5d71ee2fcdc6";"Push Down Method";"redis.clients.util.ShardInfo.getTimeout()";"redis.clients.jedis.JedisShardInfo.getTimeout()";"Push Down Method public getTimeout() : int from class redis.clients.util.ShardInfo to public getTimeout() : int from class redis.clients.jedis.JedisShardInfo"
601;"53efb8471f27ce5aa69b52778e431b31194819b3";"ea784de98a705b8b468bb41fc5af5d71ee2fcdc6";"Push Down Method";"redis.clients.util.ShardInfo.setPassword(String)";"redis.clients.jedis.JedisShardInfo.setPassword(String)";"Push Down Method public setPassword(auth String) : void from class redis.clients.util.ShardInfo to public setPassword(auth String) : void from class redis.clients.jedis.JedisShardInfo"
601;"53efb8471f27ce5aa69b52778e431b31194819b3";"ea784de98a705b8b468bb41fc5af5d71ee2fcdc6";"Push Down Method";"redis.clients.util.ShardInfo.setTimeout(int)";"redis.clients.jedis.JedisShardInfo.setTimeout(int)";"Push Down Method public setTimeout(timeout int) : void from class redis.clients.util.ShardInfo to public setTimeout(timeout int) : void from class redis.clients.jedis.JedisShardInfo"
601;"53efb8471f27ce5aa69b52778e431b31194819b3";"ea784de98a705b8b468bb41fc5af5d71ee2fcdc6";"Push Down Method";"redis.clients.util.ShardInfo.toString()";"redis.clients.jedis.JedisShardInfo.toString()";"Push Down Method public toString() : String from class redis.clients.util.ShardInfo to public toString() : String from class redis.clients.jedis.JedisShardInfo"
601;"53efb8471f27ce5aa69b52778e431b31194819b3";"ea784de98a705b8b468bb41fc5af5d71ee2fcdc6";"Extract Method";"redis.clients.util.Sharded.initialize(List)";"redis.clients.util.ShardInfo.initResource()";"Extract Method public initResource() : void extracted from private initialize(shards List) : void in class redis.clients.util.Sharded"
601;"53efb8471f27ce5aa69b52778e431b31194819b3";"ea784de98a705b8b468bb41fc5af5d71ee2fcdc6";"Inline Method";"redis.clients.util.Sharded.calculateHash(String)";"redis.clients.util.Sharded.getShardInfo(String)";"Inline Method private calculateHash(key String) : Long inlined to public getShardInfo(key String) : S in class redis.clients.util.Sharded"
601;"53efb8471f27ce5aa69b52778e431b31194819b3";"ea784de98a705b8b468bb41fc5af5d71ee2fcdc6";"Push Down Attribute";"redis.clients.util.ShardInfo.password";"redis.clients.jedis.JedisShardInfo.password";"Push Down Attribute private password : String from class redis.clients.util.ShardInfo to class redis.clients.jedis.JedisShardInfo"
601;"53efb8471f27ce5aa69b52778e431b31194819b3";"ea784de98a705b8b468bb41fc5af5d71ee2fcdc6";"Push Down Attribute";"redis.clients.util.ShardInfo.port";"redis.clients.jedis.JedisShardInfo.port";"Push Down Attribute private port : int from class redis.clients.util.ShardInfo to class redis.clients.jedis.JedisShardInfo"
601;"53efb8471f27ce5aa69b52778e431b31194819b3";"ea784de98a705b8b468bb41fc5af5d71ee2fcdc6";"Push Down Attribute";"redis.clients.util.ShardInfo.timeout";"redis.clients.jedis.JedisShardInfo.timeout";"Push Down Attribute private timeout : int from class redis.clients.util.ShardInfo to class redis.clients.jedis.JedisShardInfo"
601;"53efb8471f27ce5aa69b52778e431b31194819b3";"ea784de98a705b8b468bb41fc5af5d71ee2fcdc6";"Push Down Attribute";"redis.clients.util.ShardInfo.host";"redis.clients.jedis.JedisShardInfo.host";"Push Down Attribute private host : String from class redis.clients.util.ShardInfo to class redis.clients.jedis.JedisShardInfo"
621;"f9e7887e02b86ce893fde73dfec1ec5daabb7ba3";"aed824c94cf9bc23da96b15b1d65bc6f1a5eff15";"Move Method";"redis.clients.jedis.Protocol.readLine(DataInputStream)";"redis.clients.util.RedisInputStream.readLine()";"Move Method private readLine(is DataInputStream) : String from class redis.clients.jedis.Protocol to public readLine() : String from class redis.clients.util.RedisInputStream"
622;"aed824c94cf9bc23da96b15b1d65bc6f1a5eff15";"b573526a0dc68d70846ccf7a3b031233e2f2bfcd";"Rename Method";"redis.clients.util.RedisOutputStream.writeInt(int)";"redis.clients.util.RedisOutputStream.writeIntCrLf(int)";"Rename Method public writeInt(value int) : void renamed to public writeIntCrLf(value int) : void in class redis.clients.util.RedisOutputStream"
622;"aed824c94cf9bc23da96b15b1d65bc6f1a5eff15";"b573526a0dc68d70846ccf7a3b031233e2f2bfcd";"Extract Method";"redis.clients.jedis.Protocol.sendCommand(RedisOutputStream,String,String[])";"redis.clients.util.RedisOutputStream.writeAsciiCrLf(String)";"Extract Method public writeAsciiCrLf(in String) : void extracted from public sendCommand(os RedisOutputStream, name String, args String[]) : void in class redis.clients.jedis.Protocol"
622;"aed824c94cf9bc23da96b15b1d65bc6f1a5eff15";"b573526a0dc68d70846ccf7a3b031233e2f2bfcd";"Move Attribute";"redis.clients.jedis.Protocol.CHARSET";"redis.clients.util.RedisOutputStream.CHARSET";"Move Attribute public CHARSET : Charset from class redis.clients.jedis.Protocol to class redis.clients.util.RedisOutputStream"
623;"b573526a0dc68d70846ccf7a3b031233e2f2bfcd";"a521841ff51742577074d50722a783415b84d846";"Rename Method";"redis.clients.util.RedisOutputStream.write(String,CharsetEncoder)";"redis.clients.util.RedisOutputStream.writeString(String,CharsetEncoder)";"Rename Method public write(str String, encoder CharsetEncoder) : void renamed to public writeString(str String, encoder CharsetEncoder) : void in class redis.clients.util.RedisOutputStream"
640;"d3be2f629d4dc40239aa429a50f1585ad666a28e";"9fb41cfce4d0b48058018f7bae5062c1ebbf8fa5";"Extract Method";"redis.clients.util.FixedResourcePool.returnBrokenResource(T)";"redis.clients.util.FixedResourcePool.checkInit()";"Extract Method protected checkInit() : void extracted from public returnBrokenResource(resource T) : void in class redis.clients.util.FixedResourcePool"
640;"d3be2f629d4dc40239aa429a50f1585ad666a28e";"9fb41cfce4d0b48058018f7bae5062c1ebbf8fa5";"Extract Method";"redis.clients.util.FixedResourcePool.getResource(long)";"redis.clients.util.FixedResourcePool.checkInit()";"Extract Method protected checkInit() : void extracted from public getResource(maxTime long) : T in class redis.clients.util.FixedResourcePool"
640;"d3be2f629d4dc40239aa429a50f1585ad666a28e";"9fb41cfce4d0b48058018f7bae5062c1ebbf8fa5";"Extract Method";"redis.clients.util.FixedResourcePool.returnResource(T)";"redis.clients.util.FixedResourcePool.checkInit()";"Extract Method protected checkInit() : void extracted from public returnResource(resource T) : void in class redis.clients.util.FixedResourcePool"
640;"d3be2f629d4dc40239aa429a50f1585ad666a28e";"9fb41cfce4d0b48058018f7bae5062c1ebbf8fa5";"Extract Method";"redis.clients.util.FixedResourcePool.returnResource(T)";"redis.clients.util.FixedResourcePool.isValidationNeeded(Wrapper)";"Extract Method private isValidationNeeded(wrapper Wrapper) : boolean extracted from public returnResource(resource T) : void in class redis.clients.util.FixedResourcePool"
660;"c29054096825f5e920b23c75bdc49e818ae6a673";"8d8c5131f133620e2db69da387eb4903345ae2c5";"Rename Class";"redis.clients.jedis.tests.commands.PersistenceControlCommandsTest";"redis.clients.jedis.tests.commands.ControlCommandsTest";"Rename Class redis.clients.jedis.tests.commands.PersistenceControlCommandsTest renamed to redis.clients.jedis.tests.commands.ControlCommandsTest"
677;"111eb11440749a219bed3cd5bb5da116274b84ee";"2279746489d488444266c504346551de8cd9696e";"Extract Method";"redis.clients.jedis.Jedis.zrangeWithScores(String,int,int)";"redis.clients.jedis.Jedis.getTupledSet()";"Extract Method private getTupledSet() : Set extracted from public zrangeWithScores(key String, start int, end int) : Set in class redis.clients.jedis.Jedis"
677;"111eb11440749a219bed3cd5bb5da116274b84ee";"2279746489d488444266c504346551de8cd9696e";"Extract Method";"redis.clients.jedis.Jedis.zrevrangeWithScores(String,int,int)";"redis.clients.jedis.Jedis.getTupledSet()";"Extract Method private getTupledSet() : Set extracted from public zrevrangeWithScores(key String, start int, end int) : Set in class redis.clients.jedis.Jedis"
685;"56795974959e479d3174059c25082de39006604d";"01da80627dc15563357e0b3e66501b41ca545e3f";"Rename Method";"redis.clients.jedis.Protocol.getBulkReply(DataInputStream)";"redis.clients.jedis.Protocol.read(DataInputStream)";"Rename Method public getBulkReply(is DataInputStream) : String renamed to public read(is DataInputStream) : Object in class redis.clients.jedis.Protocol"
693;"b4862828b08115ebe7b70b21da428ffa1ca3859f";"213126543653e0f0ea024493bfa66de8d7a2306d";"Pull Up Method";"redis.clients.jedis.tests.commands.SortingCommandsTest.setUp()";"redis.clients.jedis.tests.commands.JedisCommandTestBase.setUp()";"Pull Up Method public setUp() : void from class redis.clients.jedis.tests.commands.SortingCommandsTest to public setUp() : void from class redis.clients.jedis.tests.commands.JedisCommandTestBase"
693;"b4862828b08115ebe7b70b21da428ffa1ca3859f";"213126543653e0f0ea024493bfa66de8d7a2306d";"Pull Up Method";"redis.clients.jedis.tests.commands.AllKindOfValuesCommandsTest.tearDown()";"redis.clients.jedis.tests.commands.JedisCommandTestBase.tearDown()";"Pull Up Method public tearDown() : void from class redis.clients.jedis.tests.commands.AllKindOfValuesCommandsTest to public tearDown() : void from class redis.clients.jedis.tests.commands.JedisCommandTestBase"
693;"b4862828b08115ebe7b70b21da428ffa1ca3859f";"213126543653e0f0ea024493bfa66de8d7a2306d";"Pull Up Method";"redis.clients.jedis.tests.commands.ConnectionHandlingCommandsTest.tearDown()";"redis.clients.jedis.tests.commands.JedisCommandTestBase.tearDown()";"Pull Up Method public tearDown() : void from class redis.clients.jedis.tests.commands.ConnectionHandlingCommandsTest to public tearDown() : void from class redis.clients.jedis.tests.commands.JedisCommandTestBase"
693;"b4862828b08115ebe7b70b21da428ffa1ca3859f";"213126543653e0f0ea024493bfa66de8d7a2306d";"Pull Up Method";"redis.clients.jedis.tests.commands.HashesCommandsTest.tearDown()";"redis.clients.jedis.tests.commands.JedisCommandTestBase.tearDown()";"Pull Up Method public tearDown() : void from class redis.clients.jedis.tests.commands.HashesCommandsTest to public tearDown() : void from class redis.clients.jedis.tests.commands.JedisCommandTestBase"
693;"b4862828b08115ebe7b70b21da428ffa1ca3859f";"213126543653e0f0ea024493bfa66de8d7a2306d";"Pull Up Method";"redis.clients.jedis.tests.commands.ListCommandsTest.tearDown()";"redis.clients.jedis.tests.commands.JedisCommandTestBase.tearDown()";"Pull Up Method public tearDown() : void from class redis.clients.jedis.tests.commands.ListCommandsTest to public tearDown() : void from class redis.clients.jedis.tests.commands.JedisCommandTestBase"
693;"b4862828b08115ebe7b70b21da428ffa1ca3859f";"213126543653e0f0ea024493bfa66de8d7a2306d";"Pull Up Method";"redis.clients.jedis.tests.commands.SetCommandsTest.tearDown()";"redis.clients.jedis.tests.commands.JedisCommandTestBase.tearDown()";"Pull Up Method public tearDown() : void from class redis.clients.jedis.tests.commands.SetCommandsTest to public tearDown() : void from class redis.clients.jedis.tests.commands.JedisCommandTestBase"
693;"b4862828b08115ebe7b70b21da428ffa1ca3859f";"213126543653e0f0ea024493bfa66de8d7a2306d";"Pull Up Method";"redis.clients.jedis.tests.commands.SortedSetCommandsTest.tearDown()";"redis.clients.jedis.tests.commands.JedisCommandTestBase.tearDown()";"Pull Up Method public tearDown() : void from class redis.clients.jedis.tests.commands.SortedSetCommandsTest to public tearDown() : void from class redis.clients.jedis.tests.commands.JedisCommandTestBase"
693;"b4862828b08115ebe7b70b21da428ffa1ca3859f";"213126543653e0f0ea024493bfa66de8d7a2306d";"Pull Up Method";"redis.clients.jedis.tests.commands.SortingCommandsTest.tearDown()";"redis.clients.jedis.tests.commands.JedisCommandTestBase.tearDown()";"Pull Up Method public tearDown() : void from class redis.clients.jedis.tests.commands.SortingCommandsTest to public tearDown() : void from class redis.clients.jedis.tests.commands.JedisCommandTestBase"
693;"b4862828b08115ebe7b70b21da428ffa1ca3859f";"213126543653e0f0ea024493bfa66de8d7a2306d";"Pull Up Method";"redis.clients.jedis.tests.commands.StringValuesCommandsTest.tearDown()";"redis.clients.jedis.tests.commands.JedisCommandTestBase.tearDown()";"Pull Up Method public tearDown() : void from class redis.clients.jedis.tests.commands.StringValuesCommandsTest to public tearDown() : void from class redis.clients.jedis.tests.commands.JedisCommandTestBase"
693;"b4862828b08115ebe7b70b21da428ffa1ca3859f";"213126543653e0f0ea024493bfa66de8d7a2306d";"Pull Up Method";"redis.clients.jedis.tests.commands.TransactionCommandsTest.tearDown()";"redis.clients.jedis.tests.commands.JedisCommandTestBase.tearDown()";"Pull Up Method public tearDown() : void from class redis.clients.jedis.tests.commands.TransactionCommandsTest to public tearDown() : void from class redis.clients.jedis.tests.commands.JedisCommandTestBase"
693;"b4862828b08115ebe7b70b21da428ffa1ca3859f";"213126543653e0f0ea024493bfa66de8d7a2306d";"Pull Up Method";"redis.clients.jedis.tests.commands.AllKindOfValuesCommandsTest.setUp()";"redis.clients.jedis.tests.commands.JedisCommandTestBase.setUp()";"Pull Up Method public setUp() : void from class redis.clients.jedis.tests.commands.AllKindOfValuesCommandsTest to public setUp() : void from class redis.clients.jedis.tests.commands.JedisCommandTestBase"
693;"b4862828b08115ebe7b70b21da428ffa1ca3859f";"213126543653e0f0ea024493bfa66de8d7a2306d";"Pull Up Method";"redis.clients.jedis.tests.commands.ConnectionHandlingCommandsTest.setUp()";"redis.clients.jedis.tests.commands.JedisCommandTestBase.setUp()";"Pull Up Method public setUp() : void from class redis.clients.jedis.tests.commands.ConnectionHandlingCommandsTest to public setUp() : void from class redis.clients.jedis.tests.commands.JedisCommandTestBase"
693;"b4862828b08115ebe7b70b21da428ffa1ca3859f";"213126543653e0f0ea024493bfa66de8d7a2306d";"Pull Up Method";"redis.clients.jedis.tests.commands.HashesCommandsTest.setUp()";"redis.clients.jedis.tests.commands.JedisCommandTestBase.setUp()";"Pull Up Method public setUp() : void from class redis.clients.jedis.tests.commands.HashesCommandsTest to public setUp() : void from class redis.clients.jedis.tests.commands.JedisCommandTestBase"
693;"b4862828b08115ebe7b70b21da428ffa1ca3859f";"213126543653e0f0ea024493bfa66de8d7a2306d";"Pull Up Method";"redis.clients.jedis.tests.commands.ListCommandsTest.setUp()";"redis.clients.jedis.tests.commands.JedisCommandTestBase.setUp()";"Pull Up Method public setUp() : void from class redis.clients.jedis.tests.commands.ListCommandsTest to public setUp() : void from class redis.clients.jedis.tests.commands.JedisCommandTestBase"
693;"b4862828b08115ebe7b70b21da428ffa1ca3859f";"213126543653e0f0ea024493bfa66de8d7a2306d";"Pull Up Method";"redis.clients.jedis.tests.commands.SetCommandsTest.setUp()";"redis.clients.jedis.tests.commands.JedisCommandTestBase.setUp()";"Pull Up Method public setUp() : void from class redis.clients.jedis.tests.commands.SetCommandsTest to public setUp() : void from class redis.clients.jedis.tests.commands.JedisCommandTestBase"
693;"b4862828b08115ebe7b70b21da428ffa1ca3859f";"213126543653e0f0ea024493bfa66de8d7a2306d";"Pull Up Method";"redis.clients.jedis.tests.commands.SortedSetCommandsTest.setUp()";"redis.clients.jedis.tests.commands.JedisCommandTestBase.setUp()";"Pull Up Method public setUp() : void from class redis.clients.jedis.tests.commands.SortedSetCommandsTest to public setUp() : void from class redis.clients.jedis.tests.commands.JedisCommandTestBase"
693;"b4862828b08115ebe7b70b21da428ffa1ca3859f";"213126543653e0f0ea024493bfa66de8d7a2306d";"Pull Up Method";"redis.clients.jedis.tests.commands.StringValuesCommandsTest.setUp()";"redis.clients.jedis.tests.commands.JedisCommandTestBase.setUp()";"Pull Up Method public setUp() : void from class redis.clients.jedis.tests.commands.StringValuesCommandsTest to public setUp() : void from class redis.clients.jedis.tests.commands.JedisCommandTestBase"
693;"b4862828b08115ebe7b70b21da428ffa1ca3859f";"213126543653e0f0ea024493bfa66de8d7a2306d";"Pull Up Method";"redis.clients.jedis.tests.commands.TransactionCommandsTest.setUp()";"redis.clients.jedis.tests.commands.JedisCommandTestBase.setUp()";"Pull Up Method public setUp() : void from class redis.clients.jedis.tests.commands.TransactionCommandsTest to public setUp() : void from class redis.clients.jedis.tests.commands.JedisCommandTestBase"
698;"3dd7ca6f2a2612eaa6091c9ae62846228ae78a9a";"d48ab8def2ff73592c0f5a3a7470995cd9ecaa05";"Rename Method";"redis.clients.jedis.tests.commands.SortingCommandsTest.sortBy()";"redis.clients.jedis.tests.commands.SortingCommandsTest.sortDesc()";"Rename Method public sortBy() : void renamed to public sortDesc() : void in class redis.clients.jedis.tests.commands.SortingCommandsTest"
702;"20acb5bc60402dcbed785d04966afa10b21b86e5";"81cc2cec8e52b8fd814d5ddd0e4a277f6b08441b";"Rename Method";"redis.clients.jedis.Protocol.getSingleLineReply(InputStream)";"redis.clients.jedis.Protocol.process(InputStream)";"Rename Method public getSingleLineReply(is InputStream) : String renamed to private process(is InputStream) : Object in class redis.clients.jedis.Protocol"
