"Number";"Commit";"Parent";"Refactoring";"EntityBefore";"EntityAfter";"FullDescription"
335;"c3cfd0b31fcc32a5edac4f89e0fed3de1a5a98b1";"2ba6dc7a422acb40063b36018fe804aa55cb01ec";"Extract Method";"zmq.Decoder.message_ready()";"zmq.DecoderBase.session_write(Msg)";"Extract Method protected session_write(msg Msg) : boolean extracted from private message_ready() : boolean in class zmq.Decoder"
335;"c3cfd0b31fcc32a5edac4f89e0fed3de1a5a98b1";"2ba6dc7a422acb40063b36018fe804aa55cb01ec";"Extract Method";"zmq.TestMonitor.testMonitor()";"zmq.ZMQ.zmq_sleep(int)";"Extract Method public zmq_sleep(s int) : void extracted from public testMonitor() : void in class zmq.TestMonitor"
335;"c3cfd0b31fcc32a5edac4f89e0fed3de1a5a98b1";"2ba6dc7a422acb40063b36018fe804aa55cb01ec";"Pull Up Attribute";"zmq.Decoder.buf";"zmq.DecoderBase.buf";"Pull Up Attribute private buf : ByteBuffer from class zmq.Decoder to class zmq.DecoderBase"
335;"c3cfd0b31fcc32a5edac4f89e0fed3de1a5a98b1";"2ba6dc7a422acb40063b36018fe804aa55cb01ec";"Pull Up Attribute";"zmq.Decoder.bufsize";"zmq.DecoderBase.bufsize";"Pull Up Attribute private bufsize : int from class zmq.Decoder to class zmq.DecoderBase"
335;"c3cfd0b31fcc32a5edac4f89e0fed3de1a5a98b1";"2ba6dc7a422acb40063b36018fe804aa55cb01ec";"Pull Up Attribute";"zmq.Decoder.to_read";"zmq.DecoderBase.to_read";"Pull Up Attribute private to_read : int from class zmq.Decoder to class zmq.DecoderBase"
335;"c3cfd0b31fcc32a5edac4f89e0fed3de1a5a98b1";"2ba6dc7a422acb40063b36018fe804aa55cb01ec";"Pull Up Attribute";"zmq.Decoder.session";"zmq.DecoderBase.session";"Pull Up Attribute private session : SessionBase from class zmq.Decoder to class zmq.DecoderBase"
335;"c3cfd0b31fcc32a5edac4f89e0fed3de1a5a98b1";"2ba6dc7a422acb40063b36018fe804aa55cb01ec";"Pull Up Attribute";"zmq.Decoder.read_buf";"zmq.DecoderBase.read_buf";"Pull Up Attribute private read_buf : ByteBuffer from class zmq.Decoder to class zmq.DecoderBase"
339;"d6d04bf8e1f96988af554fa822b4e032e285fb46";"77a6e275f398e3eda27933d7b2b284c4832ba943";"Inline Method";"zmq.IpcListener.close()";"zmq.SocketBase.bind(String)";"Inline Method public close() : void inlined to public bind(addr_ String) : int in class zmq.SocketBase"
341;"292ea59853e21efca30596248b3bbf500033717b";"29c1f5a2d420de1ca4d9d24b2530b938b8ffd3bd";"Extract Method";"zmq.Msg.data(boolean)";"zmq.Msg.get_buffer()";"Extract Method private get_buffer() : ByteBuffer extracted from public data(rewind boolean) : ByteBuffer in class zmq.Msg"
342;"29c1f5a2d420de1ca4d9d24b2530b938b8ffd3bd";"f43b8bed9046ae5180aaffe65a91fbccaad9e98e";"Rename Class";"zmq.PollerBase.Timer";"zmq.PollerBase.TimerInfo";"Rename Class zmq.PollerBase.Timer renamed to zmq.PollerBase.TimerInfo"
342;"29c1f5a2d420de1ca4d9d24b2530b938b8ffd3bd";"f43b8bed9046ae5180aaffe65a91fbccaad9e98e";"Rename Method";"zmq.ZMQ.s_recvmsg(SocketBase,Msg,int)";"zmq.ZMQ.zmq_send(SocketBase,Msg,int)";"Rename Method public s_recvmsg(s_ SocketBase, msg_ Msg, flags_ int) : int renamed to public zmq_send(s_ SocketBase, msg Msg, flags_ int) : int in class zmq.ZMQ"
342;"29c1f5a2d420de1ca4d9d24b2530b938b8ffd3bd";"f43b8bed9046ae5180aaffe65a91fbccaad9e98e";"Rename Method";"zmq.Blob.put(byte[])";"zmq.Blob.data()";"Rename Method public put(data byte[]) : Blob renamed to public data() : byte[] in class zmq.Blob"
342;"29c1f5a2d420de1ca4d9d24b2530b938b8ffd3bd";"f43b8bed9046ae5180aaffe65a91fbccaad9e98e";"Extract Method";"zmq.Msg.data()";"zmq.Msg.data(boolean)";"Extract Method public data(rewind boolean) : ByteBuffer extracted from package data() : byte[] in class zmq.Msg"
342;"29c1f5a2d420de1ca4d9d24b2530b938b8ffd3bd";"f43b8bed9046ae5180aaffe65a91fbccaad9e98e";"Extract Method";"zmq.FQ.recvpipe(Msg,Pipe[])";"zmq.Msg.has_more()";"Extract Method public has_more() : boolean extracted from private recvpipe(msg_ Msg, pipe_ Pipe[]) : int in class zmq.FQ"
342;"29c1f5a2d420de1ca4d9d24b2530b938b8ffd3bd";"f43b8bed9046ae5180aaffe65a91fbccaad9e98e";"Extract Method";"zmq.SocketBase.extract_flags(Msg)";"zmq.Msg.has_more()";"Extract Method public has_more() : boolean extracted from private extract_flags(msg_ Msg) : void in class zmq.SocketBase"
342;"29c1f5a2d420de1ca4d9d24b2530b938b8ffd3bd";"f43b8bed9046ae5180aaffe65a91fbccaad9e98e";"Extract Method";"zmq.Pipe.read(Msg)";"zmq.Msg.has_more()";"Extract Method public has_more() : boolean extracted from package read(msg_ Msg) : boolean in class zmq.Pipe"
342;"29c1f5a2d420de1ca4d9d24b2530b938b8ffd3bd";"f43b8bed9046ae5180aaffe65a91fbccaad9e98e";"Extract Method";"zmq.SessionBase.read(Msg)";"zmq.Msg.has_more()";"Extract Method public has_more() : boolean extracted from private read(msg_ Msg) : boolean in class zmq.SessionBase"
342;"29c1f5a2d420de1ca4d9d24b2530b938b8ffd3bd";"f43b8bed9046ae5180aaffe65a91fbccaad9e98e";"Extract Method";"zmq.LB.send(Msg,int)";"zmq.Msg.has_more()";"Extract Method public has_more() : boolean extracted from public send(msg_ Msg, flags_ int) : boolean in class zmq.LB"
342;"29c1f5a2d420de1ca4d9d24b2530b938b8ffd3bd";"f43b8bed9046ae5180aaffe65a91fbccaad9e98e";"Extract Method";"zmq.SocketBase.connect(String)";"zmq.Utils.memcpy(ByteBuffer,byte[],int)";"Extract Method public memcpy(dest ByteBuffer, src byte[], size int) : void extracted from package connect(addr_ String) : boolean in class zmq.SocketBase"
342;"29c1f5a2d420de1ca4d9d24b2530b938b8ffd3bd";"f43b8bed9046ae5180aaffe65a91fbccaad9e98e";"Extract Method";"zmq.SessionBase.read(Msg)";"zmq.Utils.memcpy(ByteBuffer,byte[],int)";"Extract Method public memcpy(dest ByteBuffer, src byte[], size int) : void extracted from private read(msg_ Msg) : boolean in class zmq.SessionBase"
343;"f43b8bed9046ae5180aaffe65a91fbccaad9e98e";"24650dd79a8a136f86b076c195fb03b005b43e33";"Extract Method";"zmq.Utils.memcpy(byte[],byte[],int)";"zmq.Utils.memcpy(byte[],int,byte[],int,int)";"Extract Method public memcpy(dest byte[], to int, src byte[], from int, size int) : void extracted from public memcpy(dest byte[], src byte[], size int) : void in class zmq.Utils"
344;"24650dd79a8a136f86b076c195fb03b005b43e33";"431050c79cfccc2745e640f7e3102b1f8dccebd3";"Extract Method";"zmq.Utils.tune_tcp_keepalives(SocketChannel,int,int,int,int)";"zmq.Utils.tune_tcp_keepalives(Socket,int,int,int,int)";"Extract Method public tune_tcp_keepalives(fd Socket, tcp_keepalive int, tcp_keepalive_cnt int, tcp_keepalive_idle int, tcp_keepalive_intvl int) : void extracted from public tune_tcp_keepalives(fd SocketChannel, tcp_keepalive int, tcp_keepalive_cnt int, tcp_keepalive_idle int, tcp_keepalive_intvl int) : void in class zmq.Utils"
344;"24650dd79a8a136f86b076c195fb03b005b43e33";"431050c79cfccc2745e640f7e3102b1f8dccebd3";"Extract Method";"zmq.Utils.tune_tcp_socket(SocketChannel)";"zmq.Utils.tune_tcp_socket(Socket)";"Extract Method public tune_tcp_socket(fd Socket) : void extracted from public tune_tcp_socket(fd SocketChannel) : void in class zmq.Utils"
345;"431050c79cfccc2745e640f7e3102b1f8dccebd3";"6c879957f19a7adcb42c692a949be1904a20182e";"Rename Class";"zmq.TCPConnecter";"zmq.TcpConnecter";"Rename Class zmq.TCPConnecter renamed to zmq.TcpConnecter"
345;"431050c79cfccc2745e640f7e3102b1f8dccebd3";"6c879957f19a7adcb42c692a949be1904a20182e";"Rename Class";"zmq.IPCConnecter";"zmq.IpcConnecter";"Rename Class zmq.IPCConnecter renamed to zmq.IpcConnecter"
345;"431050c79cfccc2745e640f7e3102b1f8dccebd3";"6c879957f19a7adcb42c692a949be1904a20182e";"Move Method";"zmq.Array.swap(List,int,int)";"zmq.Utils.swap(List,int,int)";"Move Method public swap(items List, index1_ int, index2_ int) : void from class zmq.Array to public swap(items List, index1_ int, index2_ int) : void from class zmq.Utils"
346;"6c879957f19a7adcb42c692a949be1904a20182e";"21853e15b55f7e0203d6ff5b51468b44b337319b";"Rename Method";"zmq.Signaler.wait(int)";"zmq.Signaler.wait_event(long)";"Rename Method package wait(timeout_ int) : int renamed to package wait_event(timeout_ long) : boolean in class zmq.Signaler"
346;"6c879957f19a7adcb42c692a949be1904a20182e";"21853e15b55f7e0203d6ff5b51468b44b337319b";"Extract Method";"zmq.SocketBase.connect(String)";"zmq.Address.resolved()";"Extract Method public resolved() : IZAddress extracted from package connect(addr_ String) : int in class zmq.SocketBase"
346;"6c879957f19a7adcb42c692a949be1904a20182e";"21853e15b55f7e0203d6ff5b51468b44b337319b";"Extract Method";"zmq.SocketBase.connect(String)";"zmq.Address.resolved(IZAddress)";"Extract Method public resolved(value IZAddress) : IZAddress extracted from package connect(addr_ String) : int in class zmq.SocketBase"
346;"6c879957f19a7adcb42c692a949be1904a20182e";"21853e15b55f7e0203d6ff5b51468b44b337319b";"Extract Method";"zmq.SocketBase.process_commands(int,boolean)";"zmq.Command.destination()";"Extract Method public destination() : ZObject extracted from package process_commands(timeout_ int, throttle_ boolean) : int in class zmq.SocketBase"
346;"6c879957f19a7adcb42c692a949be1904a20182e";"21853e15b55f7e0203d6ff5b51468b44b337319b";"Extract Method";"zmq.Mtrie.add_helper(byte[],int,int,Pipe)";"zmq.Mtrie.realloc(Mtrie[],short,boolean)";"Extract Method private realloc(table Mtrie[], size short, ended boolean) : Mtrie[] extracted from private add_helper(prefix_ byte[], start_ int, size_ int, pipe_ Pipe) : boolean in class zmq.Mtrie"
346;"6c879957f19a7adcb42c692a949be1904a20182e";"21853e15b55f7e0203d6ff5b51468b44b337319b";"Extract Method";"zmq.Mtrie.rm_helper(byte[],int,int,Pipe)";"zmq.Mtrie.realloc(Mtrie[],short,boolean)";"Extract Method private realloc(table Mtrie[], size short, ended boolean) : Mtrie[] extracted from private rm_helper(prefix_ byte[], start_ int, size_ int, pipe_ Pipe) : boolean in class zmq.Mtrie"
346;"6c879957f19a7adcb42c692a949be1904a20182e";"21853e15b55f7e0203d6ff5b51468b44b337319b";"Extract Method";"zmq.Poller.set_pollin(SelectableChannel)";"zmq.Poller.register(SelectableChannel,int)";"Extract Method private register(handle_ SelectableChannel, ops int) : void extracted from package set_pollin(handle_ SelectableChannel) : void in class zmq.Poller"
346;"6c879957f19a7adcb42c692a949be1904a20182e";"21853e15b55f7e0203d6ff5b51468b44b337319b";"Inline Method";"zmq.Signaler.socket_recv(SelectableChannel,byte[],int,int)";"zmq.Signaler.recv()";"Inline Method private socket_recv(r2 SelectableChannel, dummy byte[], length int, i int) : int inlined to package recv() : void in class zmq.Signaler"
346;"6c879957f19a7adcb42c692a949be1904a20182e";"21853e15b55f7e0203d6ff5b51468b44b337319b";"Inline Method";"zmq.Signaler.socket_send(SelectableChannel,byte[],int,int)";"zmq.Signaler.send()";"Inline Method private socket_send(w2 SelectableChannel, dummy byte[], length int, j int) : int inlined to package send() : void in class zmq.Signaler"
346;"6c879957f19a7adcb42c692a949be1904a20182e";"21853e15b55f7e0203d6ff5b51468b44b337319b";"Inline Method";"zmq.Signaler.unblock_socket(SelectableChannel)";"zmq.Signaler.()";"Inline Method private unblock_socket(channel SelectableChannel) : void inlined to package Signaler() in class zmq.Signaler"
