"Number";"Commit";"Parent";"Refactoring";"EntityBefore";"EntityAfter";"FullDescription"
293;"ad05e374c1154e22b4af3490d691ed669a14f9b2";"d4810b6f8d72ddcae0f5f91c04a22781c521f24a";"Rename Method";"org.jeromq.ZMQ.Socket.sendMsg(Msg,int)";"org.jeromq.ZMQ.Socket.send(Msg)";"Rename Method public sendMsg(msg Msg, flags int) : boolean renamed to public send(msg Msg) : boolean in class org.jeromq.ZMQ.Socket"
295;"fcaeb02d34cbd1aa40a0d5ecf089c565e9d6ddf9";"1785a53e1b8777103b562c934e665d6e0a0624f3";"Extract Method";"zmq.Router.xhas_in()";"zmq.Msg.is_identity()";"Extract Method public is_identity() : boolean extracted from protected xhas_in() : boolean in class zmq.Router"
295;"fcaeb02d34cbd1aa40a0d5ecf089c565e9d6ddf9";"1785a53e1b8777103b562c934e665d6e0a0624f3";"Extract Method";"zmq.Router.xrecv(int)";"zmq.Msg.is_identity()";"Extract Method public is_identity() : boolean extracted from protected xrecv(flags_ int) : Msg in class zmq.Router"
299;"20108a195a8adf66c9abfc1de603927739bcf948";"c6766c88b43d486fa19191d0e5f7128457508714";"Rename Method";"org.jeromq.ZLogManager.getConfig()";"org.jeromq.ZLogManager.config()";"Rename Method public getConfig() : ZLogConfig renamed to public config() : ZLogConfig in class org.jeromq.ZLogManager"
299;"20108a195a8adf66c9abfc1de603927739bcf948";"c6766c88b43d486fa19191d0e5f7128457508714";"Extract Method";"org.jeromq.ZLog.Segment.recover()";"org.jeromq.ZLog.readMsg(ByteBuffer)";"Extract Method private readMsg(buf ByteBuffer) : Msg extracted from public recover() : void in class org.jeromq.ZLog.Segment"
299;"20108a195a8adf66c9abfc1de603927739bcf948";"c6766c88b43d486fa19191d0e5f7128457508714";"Extract Method";"org.jeromq.ZLog.Segment.getBuffer(boolean)";"org.jeromq.ZLog.Segment.getChannel(boolean)";"Extract Method protected getChannel(writable boolean) : FileChannel extracted from public getBuffer(writable boolean) : MappedByteBuffer in class org.jeromq.ZLog.Segment"
299;"20108a195a8adf66c9abfc1de603927739bcf948";"c6766c88b43d486fa19191d0e5f7128457508714";"Extract Method";"zmq.Msg.header_buf()";"zmq.Msg.header()";"Extract Method public header() : byte[] extracted from public header_buf() : ByteBuffer in class zmq.Msg"
302;"6bdf7f487f9e1e1bb6c6b1707656e8a660c5ce1c";"54c99df7a458ead936aedaf8af57e2d18c11a893";"Extract Method";"org.jeromq.ZLog.append(Msg)";"org.jeromq.ZLog.getBuffer(long,boolean)";"Extract Method public getBuffer(size long, writable boolean) : MappedByteBuffer extracted from public append(msg Msg) : long in class org.jeromq.ZLog"
302;"6bdf7f487f9e1e1bb6c6b1707656e8a660c5ce1c";"54c99df7a458ead936aedaf8af57e2d18c11a893";"Inline Method";"zmq.EncoderBase.get_data(ByteBuffer,int[])";"zmq.EncoderBase.get_data()";"Inline Method public get_data(data_ ByteBuffer, offset_ int[]) : Transfer inlined to protected get_data() : Transfer in class zmq.EncoderBase"
302;"6bdf7f487f9e1e1bb6c6b1707656e8a660c5ce1c";"54c99df7a458ead936aedaf8af57e2d18c11a893";"Inline Method";"zmq.Msg.size(int,boolean)";"zmq.Msg.size(int)";"Inline Method public size(size_ int, buffered boolean) : void inlined to public size(size_ int) : void in class zmq.Msg"
306;"0cc3607e319bf209e58e2bed33b67638116704ed";"c045f400bd32b1fe098ea8ead3f5206474b8978c";"Inline Method";"zmq.ZError.EACCES()";"zmq.TcpListener.set_address(String)";"Inline Method public EACCES() : void inlined to public set_address(addr_ String) : boolean in class zmq.TcpListener"
306;"0cc3607e319bf209e58e2bed33b67638116704ed";"c045f400bd32b1fe098ea8ead3f5206474b8978c";"Inline Method";"zmq.ZError.EFAULT()";"zmq.ZMQ.zmq_poll(Selector,PollItem[],long)";"Inline Method public EFAULT() : void inlined to public zmq_poll(selector Selector, items_ PollItem[], timeout_ long) : int in class zmq.ZMQ"
306;"0cc3607e319bf209e58e2bed33b67638116704ed";"c045f400bd32b1fe098ea8ead3f5206474b8978c";"Inline Method";"zmq.ZError.EFAULT()";"zmq.SocketBase.send(Msg,int)";"Inline Method public EFAULT() : void inlined to public send(msg_ Msg, flags_ int) : boolean in class zmq.SocketBase"
306;"0cc3607e319bf209e58e2bed33b67638116704ed";"c045f400bd32b1fe098ea8ead3f5206474b8978c";"Inline Method";"zmq.ZError.ETERM()";"zmq.SocketBase.process_commands(int,boolean)";"Inline Method public ETERM() : void inlined to private process_commands(timeout_ int, throttle_ boolean) : boolean in class zmq.SocketBase"
306;"0cc3607e319bf209e58e2bed33b67638116704ed";"c045f400bd32b1fe098ea8ead3f5206474b8978c";"Inline Method";"zmq.ZError.ETERM()";"zmq.SocketBase.setsockopt(int,Object)";"Inline Method public ETERM() : void inlined to public setsockopt(option_ int, optval_ Object) : void in class zmq.SocketBase"
306;"0cc3607e319bf209e58e2bed33b67638116704ed";"c045f400bd32b1fe098ea8ead3f5206474b8978c";"Inline Method";"zmq.ZError.ETERM()";"zmq.SocketBase.getsockopt(int)";"Inline Method public ETERM() : void inlined to public getsockopt(option_ int) : int in class zmq.SocketBase"
306;"0cc3607e319bf209e58e2bed33b67638116704ed";"c045f400bd32b1fe098ea8ead3f5206474b8978c";"Inline Method";"zmq.ZError.ETERM()";"zmq.Ctx.create_socket(int)";"Inline Method public ETERM() : void inlined to public create_socket(type_ int) : SocketBase in class zmq.Ctx"
306;"0cc3607e319bf209e58e2bed33b67638116704ed";"c045f400bd32b1fe098ea8ead3f5206474b8978c";"Inline Method";"zmq.ZError.ETERM()";"zmq.SocketBase.getsockoptx(int)";"Inline Method public ETERM() : void inlined to public getsockoptx(option_ int) : Object in class zmq.SocketBase"
306;"0cc3607e319bf209e58e2bed33b67638116704ed";"c045f400bd32b1fe098ea8ead3f5206474b8978c";"Inline Method";"zmq.ZError.ETERM()";"zmq.SocketBase.bind(String)";"Inline Method public ETERM() : void inlined to public bind(addr_ String) : boolean in class zmq.SocketBase"
306;"0cc3607e319bf209e58e2bed33b67638116704ed";"c045f400bd32b1fe098ea8ead3f5206474b8978c";"Inline Method";"zmq.ZError.ETERM()";"zmq.SocketBase.connect(String)";"Inline Method public ETERM() : void inlined to public connect(addr_ String) : boolean in class zmq.SocketBase"
306;"0cc3607e319bf209e58e2bed33b67638116704ed";"c045f400bd32b1fe098ea8ead3f5206474b8978c";"Inline Method";"zmq.ZError.ETERM()";"zmq.SocketBase.term_endpoint(String)";"Inline Method public ETERM() : void inlined to public term_endpoint(addr_ String) : boolean in class zmq.SocketBase"
306;"0cc3607e319bf209e58e2bed33b67638116704ed";"c045f400bd32b1fe098ea8ead3f5206474b8978c";"Inline Method";"zmq.ZError.ETERM()";"zmq.SocketBase.send(Msg,int)";"Inline Method public ETERM() : void inlined to public send(msg_ Msg, flags_ int) : boolean in class zmq.SocketBase"
306;"0cc3607e319bf209e58e2bed33b67638116704ed";"c045f400bd32b1fe098ea8ead3f5206474b8978c";"Inline Method";"zmq.ZError.ETERM()";"zmq.SocketBase.recv(int)";"Inline Method public ETERM() : void inlined to public recv(flags_ int) : Msg in class zmq.SocketBase"
310;"c53333c4eb1667cc49155ff8559b8095c234a3cd";"d942dafae02bb928395a4cd28e317c915acdd643";"Inline Method";"zmq.YQueue.Chunk.reset()";"zmq.YQueue.pop()";"Inline Method protected reset() : void inlined to public pop() : void in class zmq.YQueue"
311;"d942dafae02bb928395a4cd28e317c915acdd643";"ec56572a711348cdefbdcceac97ba05c3e42aaca";"Move Class";"zmq.ZException.IOException";"zmq.ZError.IOException";"Move Class zmq.ZException.IOException moved to zmq.ZError.IOException"
311;"d942dafae02bb928395a4cd28e317c915acdd643";"ec56572a711348cdefbdcceac97ba05c3e42aaca";"Move Class";"zmq.ZException.InstantiationException";"zmq.ZError.InstantiationException";"Move Class zmq.ZException.InstantiationException moved to zmq.ZError.InstantiationException"
311;"d942dafae02bb928395a4cd28e317c915acdd643";"ec56572a711348cdefbdcceac97ba05c3e42aaca";"Rename Method";"zmq.Ctx.register_endpoints(String,Endpoint)";"zmq.Ctx.register_endpoint(String,Endpoint)";"Rename Method public register_endpoints(addr_ String, endpoint_ Endpoint) : void renamed to public register_endpoint(addr_ String, endpoint_ Endpoint) : boolean in class zmq.Ctx"
312;"ec56572a711348cdefbdcceac97ba05c3e42aaca";"99edf4d80c70e0e79127fab19dc670937b1e8406";"Extract Method";"org.jeromq.ZLog.(ZLogManager.ZLogConfig,String)";"org.jeromq.ZLog.reset()";"Extract Method public reset() : void extracted from public ZLog(conf ZLogManager.ZLogConfig, topic String) in class org.jeromq.ZLog"
313;"99edf4d80c70e0e79127fab19dc670937b1e8406";"c645bb2142eaf11da4f93427393eab26ab4c7359";"Rename Method";"zmq.SessionBase.process_destroy()";"zmq.SessionBase.destroy()";"Rename Method protected process_destroy() : void renamed to public destroy() : void in class zmq.SessionBase"
313;"99edf4d80c70e0e79127fab19dc670937b1e8406";"c645bb2142eaf11da4f93427393eab26ab4c7359";"Rename Method";"zmq.TcpConnecter.process_destroy()";"zmq.TcpConnecter.destroy()";"Rename Method protected process_destroy() : void renamed to public destroy() : void in class zmq.TcpConnecter"
313;"99edf4d80c70e0e79127fab19dc670937b1e8406";"c645bb2142eaf11da4f93427393eab26ab4c7359";"Rename Method";"zmq.TcpListener.process_destroy()";"zmq.TcpListener.destroy()";"Rename Method protected process_destroy() : void renamed to public destroy() : void in class zmq.TcpListener"
313;"99edf4d80c70e0e79127fab19dc670937b1e8406";"c645bb2142eaf11da4f93427393eab26ab4c7359";"Extract Method";"org.jeromq.ZMQ.getFullVersion()";"zmq.ZMQ.ZMQ_MAKE_VERSION(int,int,int)";"Extract Method public ZMQ_MAKE_VERSION(major int, minor int, patch int) : int extracted from public getFullVersion() : int in class org.jeromq.ZMQ"
315;"38d6cbb18d4d580c987a69023add2e241787ab7d";"26cccea64b2cd16356a85d674efa96ec043e9847";"Move And Rename Class";"org.jeromq.ZDecoder";"org.jeromq.codec.Persistence";"Move And Rename Class org.jeromq.ZDecoder moved to org.jeromq.codec.Persistence"
315;"38d6cbb18d4d580c987a69023add2e241787ab7d";"26cccea64b2cd16356a85d674efa96ec043e9847";"Rename Method";"zmq.Helper.DummySocketChannel.implCloseSelectableChannel()";"zmq.Helper.DummySocketChannel.close()";"Rename Method protected implCloseSelectableChannel() : void renamed to public close() : void in class zmq.Helper.DummySocketChannel"
315;"38d6cbb18d4d580c987a69023add2e241787ab7d";"26cccea64b2cd16356a85d674efa96ec043e9847";"Extract Method";"zmq.Ctx.terminate()";"zmq.Ctx.destroy()";"Extract Method protected destroy() : void extracted from public terminate() : void in class zmq.Ctx"
315;"38d6cbb18d4d580c987a69023add2e241787ab7d";"26cccea64b2cd16356a85d674efa96ec043e9847";"Extract Method";"zmq.SocketBase.check_destroy()";"zmq.Own.destory()";"Extract Method protected destory() : void extracted from private check_destroy() : void in class zmq.SocketBase"
317;"a27838e21bd6c9b657a8a3dd6e93e8b1707ec0c5";"f710999913ecf90eaa5bbea515de22a467ddee24";"Rename Method";"zmq.StreamEngine.close()";"zmq.StreamEngine.destroy()";"Rename Method public close() : void renamed to public destroy() : void in class zmq.StreamEngine"
319;"672c2adbf78049403ecd6e5624ca2c108b63dc21";"5b5edfa756a02d44cccaac5cd497bebc60f4e10c";"Rename Class";"zmq.TestHelper";"zmq.Helper";"Rename Class zmq.TestHelper renamed to zmq.Helper"
321;"6316d3cc088a85d053009f675f5363eef54422e7";"430ab6a9d697cff39a11bb991b1f9b30928f749f";"Extract Method";"org.jeromq.ZLog.append(Msg)";"org.jeromq.ZMQ.Msg.headerBuf()";"Extract Method public headerBuf() : ByteBuffer extracted from public append(msg Msg) : long in class org.jeromq.ZLog"
321;"6316d3cc088a85d053009f675f5363eef54422e7";"430ab6a9d697cff39a11bb991b1f9b30928f749f";"Extract Method";"org.jeromq.ZLog.append(Msg)";"org.jeromq.ZMQ.Msg.headerSize()";"Extract Method public headerSize() : int extracted from public append(msg Msg) : long in class org.jeromq.ZLog"
322;"430ab6a9d697cff39a11bb991b1f9b30928f749f";"5086bd4dc2b3ab83189d453026f36acdea863901";"Move Class";"org.zeromq.ZContext";"org.jeromq.ZContext";"Move Class org.zeromq.ZContext moved to org.jeromq.ZContext"
322;"430ab6a9d697cff39a11bb991b1f9b30928f749f";"5086bd4dc2b3ab83189d453026f36acdea863901";"Move Class";"org.zeromq.ZDecoder";"org.jeromq.ZDecoder";"Move Class org.zeromq.ZDecoder moved to org.jeromq.ZDecoder"
322;"430ab6a9d697cff39a11bb991b1f9b30928f749f";"5086bd4dc2b3ab83189d453026f36acdea863901";"Move Class";"org.zeromq.ZDevice";"org.jeromq.ZDevice";"Move Class org.zeromq.ZDevice moved to org.jeromq.ZDevice"
322;"430ab6a9d697cff39a11bb991b1f9b30928f749f";"5086bd4dc2b3ab83189d453026f36acdea863901";"Move Class";"org.zeromq.ZFrame";"org.jeromq.ZFrame";"Move Class org.zeromq.ZFrame moved to org.jeromq.ZFrame"
322;"430ab6a9d697cff39a11bb991b1f9b30928f749f";"5086bd4dc2b3ab83189d453026f36acdea863901";"Move Class";"org.zeromq.ZMQ";"org.jeromq.ZMQ";"Move Class org.zeromq.ZMQ moved to org.jeromq.ZMQ"
322;"430ab6a9d697cff39a11bb991b1f9b30928f749f";"5086bd4dc2b3ab83189d453026f36acdea863901";"Move Class";"org.zeromq.ZMsg";"org.jeromq.ZMsg";"Move Class org.zeromq.ZMsg moved to org.jeromq.ZMsg"
322;"430ab6a9d697cff39a11bb991b1f9b30928f749f";"5086bd4dc2b3ab83189d453026f36acdea863901";"Move And Rename Class";"org.zeromq.ZLog";"org.jeromq.ZLog.Segment";"Move And Rename Class org.zeromq.ZLog moved to org.jeromq.ZLog.Segment"
322;"430ab6a9d697cff39a11bb991b1f9b30928f749f";"5086bd4dc2b3ab83189d453026f36acdea863901";"Rename Method";"zmq.Msg.init_size(int,boolean)";"zmq.Msg.size(int,boolean)";"Rename Method private init_size(size_ int, buffered boolean) : void renamed to public size(size_ int, buffered boolean) : void in class zmq.Msg"
322;"430ab6a9d697cff39a11bb991b1f9b30928f749f";"5086bd4dc2b3ab83189d453026f36acdea863901";"Move Method";"org.zeromq.TestZLogManager.setUpt()";"org.jeromq.TestZLogManager.setUpt()";"Move Method public setUpt() : void from class org.zeromq.TestZLogManager to public setUpt() : void from class org.jeromq.TestZLogManager"
322;"430ab6a9d697cff39a11bb991b1f9b30928f749f";"5086bd4dc2b3ab83189d453026f36acdea863901";"Move Method";"org.zeromq.TestZLogManager.testNewTopic()";"org.jeromq.TestZLogManager.testNewTopic()";"Move Method public testNewTopic() : void from class org.zeromq.TestZLogManager to public testNewTopic() : void from class org.jeromq.TestZLogManager"
322;"430ab6a9d697cff39a11bb991b1f9b30928f749f";"5086bd4dc2b3ab83189d453026f36acdea863901";"Move Method";"org.zeromq.TestZLogManager.testOverflow()";"org.jeromq.TestZLogManager.testOverflow()";"Move Method public testOverflow() : void from class org.zeromq.TestZLogManager to public testOverflow() : void from class org.jeromq.TestZLogManager"
322;"430ab6a9d697cff39a11bb991b1f9b30928f749f";"5086bd4dc2b3ab83189d453026f36acdea863901";"Extract Method";"org.zeromq.TestZLogManager.testOverflow()";"org.jeromq.ZLog.start()";"Extract Method public start() : long extracted from public testOverflow() : void in class org.zeromq.TestZLogManager"
322;"430ab6a9d697cff39a11bb991b1f9b30928f749f";"5086bd4dc2b3ab83189d453026f36acdea863901";"Move Attribute";"org.zeromq.ZLog.SUFFIX";"org.jeromq.ZLog.SUFFIX";"Move Attribute private SUFFIX : String from class org.zeromq.ZLog to class org.jeromq.ZLog"
322;"430ab6a9d697cff39a11bb991b1f9b30928f749f";"5086bd4dc2b3ab83189d453026f36acdea863901";"Move Attribute";"org.zeromq.ZLog.mgr";"org.jeromq.ZLog.mgr";"Move Attribute private mgr : ZLogManager from class org.zeromq.ZLog to class org.jeromq.ZLog"
322;"430ab6a9d697cff39a11bb991b1f9b30928f749f";"5086bd4dc2b3ab83189d453026f36acdea863901";"Move Attribute";"org.zeromq.ZLog.topic";"org.jeromq.ZLog.topic";"Move Attribute private topic : String from class org.zeromq.ZLog to class org.jeromq.ZLog"
322;"430ab6a9d697cff39a11bb991b1f9b30928f749f";"5086bd4dc2b3ab83189d453026f36acdea863901";"Move Attribute";"org.zeromq.ZLogManager.basedir";"org.jeromq.ZLogManager.basedir";"Move Attribute private basedir : File from class org.zeromq.ZLogManager to class org.jeromq.ZLogManager"
322;"430ab6a9d697cff39a11bb991b1f9b30928f749f";"5086bd4dc2b3ab83189d453026f36acdea863901";"Move Attribute";"org.zeromq.TestZLogManager.datadir";"org.jeromq.TestZLogManager.datadir";"Move Attribute private datadir : String from class org.zeromq.TestZLogManager to class org.jeromq.TestZLogManager"
324;"19eea5d8011f55bad5740e63376625c5e2af6699";"952b73eaea0ed0c7f716e72995aaba2734215ca0";"Inline Method";"zmq.DecoderBase.session_write(Msg)";"zmq.TestDecoder.CustomDecoder.read_body()";"Inline Method protected session_write(msg Msg) : boolean inlined to private read_body() : boolean in class zmq.TestDecoder.CustomDecoder"
324;"19eea5d8011f55bad5740e63376625c5e2af6699";"952b73eaea0ed0c7f716e72995aaba2734215ca0";"Inline Method";"zmq.DecoderBase.session_write(Msg)";"zmq.Decoder.message_ready()";"Inline Method protected session_write(msg Msg) : boolean inlined to private message_ready() : boolean in class zmq.Decoder"
324;"19eea5d8011f55bad5740e63376625c5e2af6699";"952b73eaea0ed0c7f716e72995aaba2734215ca0";"Inline Method";"zmq.DecoderBase.session_write(Msg)";"zmq.TestProxyTcp.ProxyDecoder.read_body()";"Inline Method protected session_write(msg Msg) : boolean inlined to private read_body() : boolean in class zmq.TestProxyTcp.ProxyDecoder"
324;"19eea5d8011f55bad5740e63376625c5e2af6699";"952b73eaea0ed0c7f716e72995aaba2734215ca0";"Inline Method";"zmq.EncoderBase.session_read()";"zmq.Encoder.message_ready()";"Inline Method protected session_read() : Msg inlined to private message_ready() : boolean in class zmq.Encoder"
324;"19eea5d8011f55bad5740e63376625c5e2af6699";"952b73eaea0ed0c7f716e72995aaba2734215ca0";"Inline Method";"zmq.EncoderBase.session_read()";"zmq.TestProxyTcp.ProxyEncoder.write_header()";"Inline Method protected session_read() : Msg inlined to private write_header() : boolean in class zmq.TestProxyTcp.ProxyEncoder"
324;"19eea5d8011f55bad5740e63376625c5e2af6699";"952b73eaea0ed0c7f716e72995aaba2734215ca0";"Inline Method";"zmq.EncoderBase.session_read()";"zmq.TestEncoder.CustomEncoder.read_body()";"Inline Method protected session_read() : Msg inlined to private read_body() : boolean in class zmq.TestEncoder.CustomEncoder"
324;"19eea5d8011f55bad5740e63376625c5e2af6699";"952b73eaea0ed0c7f716e72995aaba2734215ca0";"Move Attribute";"zmq.Proxy.ProxySession.identity_sent";"zmq.TestProxyTcp.ProxyDecoder.identity_sent";"Move Attribute package identity_sent : boolean from class zmq.Proxy.ProxySession to class zmq.TestProxyTcp.ProxyDecoder"
328;"a7a2444ee3da99bd2ce223c3cbb86e3e176b262a";"f4579c06617d21efd1fca85ca7fcf5a59fecd7e0";"Rename Method";"zmq.SocketBase.getsockopt(int,ByteBuffer)";"zmq.SocketBase.getsockoptx(int)";"Rename Method public getsockopt(option_ int, ret ByteBuffer) : int renamed to public getsockoptx(option_ int) : Object in class zmq.SocketBase"
328;"a7a2444ee3da99bd2ce223c3cbb86e3e176b262a";"f4579c06617d21efd1fca85ca7fcf5a59fecd7e0";"Rename Method";"zmq.ZMQ.zmq_getsockopt(SocketBase,int,ByteBuffer)";"zmq.ZMQ.zmq_getsockoptx(SocketBase,int)";"Rename Method public zmq_getsockopt(s_ SocketBase, option_ int, ret ByteBuffer) : int renamed to public zmq_getsockoptx(s_ SocketBase, option_ int) : Object in class zmq.ZMQ"
328;"a7a2444ee3da99bd2ce223c3cbb86e3e176b262a";"f4579c06617d21efd1fca85ca7fcf5a59fecd7e0";"Extract Method";"zmq.PollItem.(SocketBase,int)";"zmq.PollItem.init(int)";"Extract Method private init(ops int) : void extracted from public PollItem(s_ SocketBase, ops int) in class zmq.PollItem"
328;"a7a2444ee3da99bd2ce223c3cbb86e3e176b262a";"f4579c06617d21efd1fca85ca7fcf5a59fecd7e0";"Extract Method";"zmq.Poller.reset_pollin(SelectableChannel)";"zmq.Poller.register(SelectableChannel,int,boolean)";"Extract Method private register(handle_ SelectableChannel, ops int, negate boolean) : void extracted from public reset_pollin(handle_ SelectableChannel) : void in class zmq.Poller"
328;"a7a2444ee3da99bd2ce223c3cbb86e3e176b262a";"f4579c06617d21efd1fca85ca7fcf5a59fecd7e0";"Extract Method";"zmq.Poller.reset_pollout(SelectableChannel)";"zmq.Poller.register(SelectableChannel,int,boolean)";"Extract Method private register(handle_ SelectableChannel, ops int, negate boolean) : void extracted from public reset_pollout(handle_ SelectableChannel) : void in class zmq.Poller"
328;"a7a2444ee3da99bd2ce223c3cbb86e3e176b262a";"f4579c06617d21efd1fca85ca7fcf5a59fecd7e0";"Extract Method";"zmq.Poller.register(SelectableChannel,int)";"zmq.Poller.register(SelectableChannel,int,boolean)";"Extract Method private register(handle_ SelectableChannel, ops int, negate boolean) : void extracted from private register(handle_ SelectableChannel, ops int) : void in class zmq.Poller"
329;"f4579c06617d21efd1fca85ca7fcf5a59fecd7e0";"1511713267ee692ccb317e20a3eec365697b9d7f";"Rename Class";"zmq.TestUtil";"zmq.TestHelper";"Rename Class zmq.TestUtil renamed to zmq.TestHelper"
332;"f027f964eaebd5c6d8c89151bf3aa8564fc5211b";"39be9dbdce0dec7920b7936db4a47b4fcec954df";"Rename Method";"zmq.TestProxyTcp.testReqrepTcp()";"zmq.TestProxyTcp.testProxyTcp()";"Rename Method public testReqrepTcp() : void renamed to public testProxyTcp() : void in class zmq.TestProxyTcp"
333;"39be9dbdce0dec7920b7936db4a47b4fcec954df";"5486b95141a49f0a1dc2a4011fc21c4ba1375460";"Rename Method";"zmq.Encoder.call_next()";"zmq.Encoder.next()";"Rename Method private call_next() : boolean renamed to protected next() : boolean in class zmq.Encoder"
333;"39be9dbdce0dec7920b7936db4a47b4fcec954df";"5486b95141a49f0a1dc2a4011fc21c4ba1375460";"Pull Up Method";"zmq.Encoder.next_step(ByteBuffer,int,Step,boolean)";"zmq.EncoderBase.next_step(ByteBuffer,int,Object,boolean)";"Pull Up Method private next_step(buf_ ByteBuffer, to_write_ int, next_ Step, beginning_ boolean) : void from class zmq.Encoder to protected next_step(buf_ ByteBuffer, to_write_ int, next_ Object, beginning_ boolean) : void from class zmq.EncoderBase"
333;"39be9dbdce0dec7920b7936db4a47b4fcec954df";"5486b95141a49f0a1dc2a4011fc21c4ba1375460";"Pull Up Method";"zmq.Encoder.set_session(SessionBase)";"zmq.EncoderBase.set_session(SessionBase)";"Pull Up Method public set_session(session_ SessionBase) : void from class zmq.Encoder to public set_session(session_ SessionBase) : void from class zmq.EncoderBase"
333;"39be9dbdce0dec7920b7936db4a47b4fcec954df";"5486b95141a49f0a1dc2a4011fc21c4ba1375460";"Pull Up Method";"zmq.Encoder.get_data(ByteBuffer,int[])";"zmq.EncoderBase.get_data(ByteBuffer,int[])";"Pull Up Method public get_data(data_ ByteBuffer, offset_ int[]) : ByteBuffer from class zmq.Encoder to public get_data(data_ ByteBuffer, offset_ int[]) : ByteBuffer from class zmq.EncoderBase"
333;"39be9dbdce0dec7920b7936db4a47b4fcec954df";"5486b95141a49f0a1dc2a4011fc21c4ba1375460";"Extract Method";"zmq.Encoder.message_ready()";"zmq.EncoderBase.session_read()";"Extract Method protected session_read() : Msg extracted from private message_ready() : boolean in class zmq.Encoder"
333;"39be9dbdce0dec7920b7936db4a47b4fcec954df";"5486b95141a49f0a1dc2a4011fc21c4ba1375460";"Extract Method";"zmq.Encoder.call_next()";"zmq.EncoderBase.state()";"Extract Method protected state() : Object extracted from private call_next() : boolean in class zmq.Encoder"
333;"39be9dbdce0dec7920b7936db4a47b4fcec954df";"5486b95141a49f0a1dc2a4011fc21c4ba1375460";"Pull Up Attribute";"zmq.Encoder.buf";"zmq.EncoderBase.buf";"Pull Up Attribute private buf : ByteBuffer from class zmq.Encoder to class zmq.EncoderBase"
333;"39be9dbdce0dec7920b7936db4a47b4fcec954df";"5486b95141a49f0a1dc2a4011fc21c4ba1375460";"Pull Up Attribute";"zmq.Encoder.session";"zmq.EncoderBase.session";"Pull Up Attribute private session : SessionBase from class zmq.Encoder to class zmq.EncoderBase"
334;"5486b95141a49f0a1dc2a4011fc21c4ba1375460";"c3cfd0b31fcc32a5edac4f89e0fed3de1a5a98b1";"Extract Method";"zmq.ZMQ.zmq_device(int,SocketBase,SocketBase)";"zmq.Device.device(SocketBase,SocketBase)";"Extract Method public device(insocket_ SocketBase, outsocket_ SocketBase) : boolean extracted from public zmq_device(device_ int, insocket_ SocketBase, outsocket_ SocketBase) : boolean in class zmq.ZMQ"
334;"5486b95141a49f0a1dc2a4011fc21c4ba1375460";"c3cfd0b31fcc32a5edac4f89e0fed3de1a5a98b1";"Extract Method";"zmq.Mtrie.rm_helper(Pipe,byte[],int,int,IMtrieHandler,Object)";"zmq.Utils.realloc(byte[],int)";"Extract Method public realloc(src byte[], size int) : byte[] extracted from private rm_helper(pipe_ Pipe, buff_ byte[], buffsize_ int, maxbuffsize_ int, func_ IMtrieHandler, arg_ Object) : boolean in class zmq.Mtrie"
335;"c3cfd0b31fcc32a5edac4f89e0fed3de1a5a98b1";"2ba6dc7a422acb40063b36018fe804aa55cb01ec";"Rename Method";"zmq.Decoder.call_next()";"zmq.Decoder.next()";"Rename Method private call_next() : boolean renamed to protected next() : boolean in class zmq.Decoder"
335;"c3cfd0b31fcc32a5edac4f89e0fed3de1a5a98b1";"2ba6dc7a422acb40063b36018fe804aa55cb01ec";"Pull Up Method";"zmq.Decoder.get_buffer()";"zmq.DecoderBase.get_buffer()";"Pull Up Method public get_buffer() : ByteBuffer from class zmq.Decoder to public get_buffer() : ByteBuffer from class zmq.DecoderBase"
335;"c3cfd0b31fcc32a5edac4f89e0fed3de1a5a98b1";"2ba6dc7a422acb40063b36018fe804aa55cb01ec";"Pull Up Method";"zmq.Decoder.set_session(SessionBase)";"zmq.DecoderBase.set_session(SessionBase)";"Pull Up Method public set_session(session_ SessionBase) : void from class zmq.Decoder to public set_session(session_ SessionBase) : void from class zmq.DecoderBase"
335;"c3cfd0b31fcc32a5edac4f89e0fed3de1a5a98b1";"2ba6dc7a422acb40063b36018fe804aa55cb01ec";"Pull Up Method";"zmq.Decoder.process_buffer(ByteBuffer)";"zmq.DecoderBase.process_buffer(ByteBuffer)";"Pull Up Method public process_buffer(buf_ ByteBuffer) : int from class zmq.Decoder to public process_buffer(buf_ ByteBuffer) : int from class zmq.DecoderBase"
335;"c3cfd0b31fcc32a5edac4f89e0fed3de1a5a98b1";"2ba6dc7a422acb40063b36018fe804aa55cb01ec";"Pull Up Method";"zmq.Decoder.next_step(ByteBuffer,int,Step)";"zmq.DecoderBase.next_step(ByteBuffer,int,Object)";"Pull Up Method private next_step(buf_ ByteBuffer, to_read_ int, next_ Step) : void from class zmq.Decoder to protected next_step(buf_ ByteBuffer, to_read_ int, state_ Object) : void from class zmq.DecoderBase"
